username,displayName,tweet,likes,retweets,link,date
BashirAhmaad,Bashir Ahmad,"There was a Hausa–Fulani guy, named Zulum Tambuwal from Borokoto State. 😅 https://t.co/pGVb9Qeyc4",171,13,https://twitter.com/BashirAhmaad/status/1540454852542824448,2022-06-24 22:00:31+00:00
AishaYesufu,Aisha Yesufu,Sadly many think that every Fulani is Muslim. That is so far from the truth. https://t.co/sl8gZegZ37,100,9,https://twitter.com/AishaYesufu/status/1535933106003365888,2022-06-12 10:32:43+00:00
bulamabukarti,Bulama Bukarti,Police probe of the Owo attack found that it’s people who disguised as worshippers that detonated explosives inside the Church before shooting started. How likely is it for ‘Fulani herdsmen’ to successfully disguise as Yoruba worshippers? It’s always better to wait for the facts.,2232,1082,https://twitter.com/bulamabukarti/status/1534072444721500160,2022-06-07 07:19:07+00:00
AreaFada1,Charly Boy Area Fada 1,"If Buhari could appoint a Fulani man from Niger Republic to the OAU then instead of a Nigerian Igbo man that was a citizen of his own country...
Think of it...
""A leopard never changes its Spots""...",444,285,https://twitter.com/AreaFada1/status/1533204806252232707,2022-06-04 21:51:26+00:00
AreaFada1,Charly Boy Area Fada 1,"Fulani/Islam is busy plotting and strategizing, yet most ignorant Nigerians haven't noticed it. Most Southerners are still busy campaigning for Fulani/Islam.
#ourmumuneverdo?",1382,716,https://twitter.com/AreaFada1/status/1533086517417197570,2022-06-04 14:01:23+00:00
ShehuSani,Senator Shehu Sani,"First Interactive Dialogue under  the theme “The future of Fulani Pastoralists in Nigeria” organised by The Miyetti Allah Kautal Hore at Hilton Hotel,Abuja. https://t.co/fyVQlmFxMG",861,98,https://twitter.com/ShehuSani/status/1532384044381618176,2022-06-02 15:30:01+00:00
ShehuSani,Senator Shehu Sani,"Earlier today,Miyetti Allah Kautal Hore first Interactive Dialogue and Cultural Festival held at Hilton Hotel Abuja.Theme;The future of Fulani Pastoralists in Nigeria. https://t.co/yHD7nrY1rN",187,32,https://twitter.com/ShehuSani/status/1532375854218616833,2022-06-02 14:57:28+00:00
ShehuSani,Senator Shehu Sani,"Peter Obi is coming to Kaduna;As a good friend,any proverb said in Hausa or Fulani or Arabic dialects I will help in translating it to you and send to your WhatsApp;So that they don’t give you the Jagaban-Amaechi experience by the time you leave.",6164,1245,https://twitter.com/ShehuSani/status/1526144331169538050,2022-05-16 10:15:37+00:00
ShehuSani,Senator Shehu Sani,The Miyetti that didn’t buy N40m form for a Fulani Atiku couldn’t have bought N100m Form for GEJ.They are simply used in a political chess game.,4655,1071,https://twitter.com/ShehuSani/status/1523932850491478019,2022-05-10 07:47:59+00:00
ShehuSani,Senator Shehu Sani,There are millions of fulani that are neither Bandits nor armed herdsmen nor terrorists;but they have now become profiled victims of the dastardly &amp; cruel activities of their kinsmen.They are unjust recipients of societal anger &amp; vendetta.They must revolt against those bad eggs.,2408,503,https://twitter.com/ShehuSani/status/1514198828748005382,2022-04-13 11:08:27+00:00
ShehuSani,Senator Shehu Sani,"The most dangerous terrorists in Nigeria today are Turji,Gide &amp; Manjagara &amp; they are all of our Fulani ethnic group;killing,raping,kidnapping people &amp; burning down villages.They r evil men &amp; those who pamper them or cover them up r equally evil.Their atrocities are unforgivable.",3023,968,https://twitter.com/ShehuSani/status/1502186307761672193,2022-03-11 07:34:59+00:00
ShehuSani,Senator Shehu Sani,@fulani_leemah Rasha zata Ukraine kenan.,17,1,https://twitter.com/ShehuSani/status/1497557347895586818,2022-02-26 13:01:09+00:00
BashirAhmaad,Bashir Ahmad,@Fulani_Tutor Thank you Tutor. 🙏🏽,7,0,https://twitter.com/BashirAhmaad/status/1495138970086387712,2022-02-19 20:51:23+00:00
bulamabukarti,Bulama Bukarti,"Third, he said marginalisation of Fulanis should stop. That they’re not out to break up Nigeria or take over govt, but were pushed by discrimination &amp; bigotry against Fulanis. I don’t see how this could stand in the face of the fact that the president &amp; many governors are Fulani.",79,48,https://twitter.com/bulamabukarti/status/1472560882752397315,2021-12-19 13:34:07+00:00
ShehuSani,Senator Shehu Sani,"Bandits killed the Lere LG Cattle Breeders Chairman in Kaduna State,Abubakar Danladi for failing to post a ransom of $40k.The Bandits are majorly Fulani,but they don’t even spare their kinsmen or tribal leaders.Their atrocities are indefensible and without borders.",461,130,https://twitter.com/ShehuSani/status/1439139079652708360,2021-09-18 08:07:49+00:00
ShehuSani,Senator Shehu Sani,@OduduwaR Correction;It’s Fulani/Yoruba Government;PMB and Osibanjo.,117,17,https://twitter.com/ShehuSani/status/1424795035934117888,2021-08-09 18:09:42+00:00
AishaYesufu,Aisha Yesufu,@nwaegbe_nkem @FlorenceOzor @Jokotade_ng What will Fulani say?,4,2,https://twitter.com/AishaYesufu/status/1423355138924847107,2021-08-05 18:48:04+00:00
AreaFada1,Charly Boy Area Fada 1,"To all our Fulani haters, who are against the dot, we will use your hate as our fuel. https://t.co/nJY4Fcnllc",42,24,https://twitter.com/AreaFada1/status/1419284575562485770,2021-07-25 13:13:06+00:00
ShehuSani,Senator Shehu Sani,"Whenever @renoomokri tells Hausa/Fulani the truth,they chase him with Swords;Whenever he tells Igbos the truth,they chase him with machetes.Its easier to tell the truth than to accept it.",2002,431,https://twitter.com/ShehuSani/status/1413540931756826627,2021-07-09 16:49:55+00:00
AishaYesufu,Aisha Yesufu,"Southern Kaduna people were being killed during Jonathan but bloody sycophants insulted us for making demands then. 
You think Fulani herdsmen started attacking today? Those who now make demands once attacked us for making same demands because their own was in power.
Nonsense!",1738,504,https://twitter.com/AishaYesufu/status/1403084268725800963,2021-06-10 20:18:52+00:00
AreaFada1,Charly Boy Area Fada 1,"My friend, do not be mumued the real battle is not between North and South, Christian and Muslim, Igbo and Fulani. No.The real battle is between love and hate, between extremism and tolerance, between meritocracy and privilege, between a dynamic view of culture and a static one.",132,45,https://twitter.com/AreaFada1/status/1400698997594103809,2021-06-04 06:20:39+00:00
AishaYesufu,Aisha Yesufu,My Governor is @GovernorObaseki and I didn't know he was fulani or hausa https://t.co/VeuuSWTuyM,42,8,https://twitter.com/AishaYesufu/status/1399709524811030537,2021-06-01 12:48:50+00:00
ShehuSani,Senator Shehu Sani,A delegation of Fulani Youth leaders from across Nigeria paid me a courtesy call in my office.A fruitful meeting in search of peace. https://t.co/b9Ft04OXrR,453,101,https://twitter.com/ShehuSani/status/1382671223679811584,2021-04-15 12:24:43+00:00
ShehuSani,Senator Shehu Sani,I took Amala and Fura in the spirit of Yoruba and Fulani are one;I had to be rescued by flagyl.,10405,1663,https://twitter.com/ShehuSani/status/1381260623196094467,2021-04-11 14:59:29+00:00
ShehuSani,Senator Shehu Sani,"@OduduwaR We want you in a United Nigeria.God &amp; Lugard hath put us together,don’t tear us asunder.We should be for better for worse.Stop filling 4 divorce.Embrace the ideology of YORULANI;Yoruba &amp; Fulani are One.I have joined your handle and I hope you wunt block me;Amala &amp; Fura are One.",32,8,https://twitter.com/ShehuSani/status/1379383582356033536,2021-04-06 10:40:48+00:00
obyezeks,Oby Ezekwesili,"Ebony killings. 

Should Nigeria’s descent into a Mass Killing Field for gun-totting Fulani herdsmen continue while @MBuhari sits in office either fiddling or traveling to take care of his own health?

This is the real Question citizens who care about Dignity of Life should ask✍🏾",1017,499,https://twitter.com/obyezeks/status/1377250040935297027,2021-03-31 13:22:52+00:00
ShehuSani,Senator Shehu Sani,The Only state where Yoruba and Fulani ‘are one’ is Kwara;And now they are in a boxing ring over Hijab.,4944,1180,https://twitter.com/ShehuSani/status/1376830633612349442,2021-03-30 09:36:17+00:00
ShehuSani,Senator Shehu Sani,Yoruba/Fulani harmony is called YORULANI  and the disciples of it are called YORULANIANS... the dynasty was founded in Kano today.,3281,689,https://twitter.com/ShehuSani/status/1376639985407946754,2021-03-29 20:58:43+00:00
bulamabukarti,Bulama Bukarti,"Akwai wata 'yar Fulani da na ga tana ta shan kanshi akan street dinnan. An bani labarin yadda tayi kaurin suna wajen kukan wanka lokacin tana karama. Zan tona asiri. Kina cewa ""taak"", zan fasa kwai.",169,23,https://twitter.com/bulamabukarti/status/1370086625754157062,2021-03-11 18:58:01+00:00
AishaYesufu,Aisha Yesufu,@hauwa_farouk @Engr_hauwerh @Fulani_Tutor @Jamo_Danbatta @Aysha_Goni @__maryamaa___ @SavvyRinu Thank you and to you too.,2,0,https://twitter.com/AishaYesufu/status/1368830805422792709,2021-03-08 07:47:50+00:00
ShehuSani,Senator Shehu Sani,I just met this young Fulani man while driving into Abuja. https://t.co/c4vSY5Feyq,5731,1171,https://twitter.com/ShehuSani/status/1367418396002893829,2021-03-04 10:15:25+00:00
AreaFada1,Charly Boy Area Fada 1,"I swear to the Almighty God that the government is the one arming Us.We Fulani dont know guns.We only know cows and how to rear cows.Cows don't give birth to guns.I swear to God , we just sat down and were supplied AK47  by the government.I am not afraid to say the truth. https://t.co/RFJUSaEolm",377,416,https://twitter.com/AreaFada1/status/1367115149874761728,2021-03-03 14:10:26+00:00
AishaYesufu,Aisha Yesufu,This is the state of the Commander-in-chief and you think you will be secured. Someone that has not secured his state. He is fulani from Katsina that is also being terrorised and you think your own state being terrorised will be his priority https://t.co/JtAGxQppoQ,137,81,https://twitter.com/AishaYesufu/status/1362496907717844996,2021-02-18 20:19:11+00:00
AishaYesufu,Aisha Yesufu,@NzeneriM He says Southerners will shame me. I told him I am insulted by many from the South and many from the North. Ipob members have camped on my TL amd call me fulani herdswoman. I am okay with that.😁,3,0,https://twitter.com/AishaYesufu/status/1361404969258262529,2021-02-15 20:00:13+00:00
AishaYesufu,Aisha Yesufu,Mr Advocate for human rights @General_Somto. The Eastern Security Network has no right to attack a fulani settlement same way nobody has a right to attack you because some criminals happen to speak the same language as you. Fighting for human rights is done without bias https://t.co/Fxekcg1O2v,72,41,https://twitter.com/AishaYesufu/status/1360956867111968769,2021-02-14 14:19:37+00:00
AishaYesufu,Aisha Yesufu,"You think because you are hausa or you are fulani that you hold a special place with Buhari?! 
You really are fooling yourself. Buhari is an incompetent, clueless, corrupt  inept and a failed leader that distributes the #ICCIF equally. 
He has repeatedly shown that!",1974,640,https://twitter.com/AishaYesufu/status/1360948284592967685,2021-02-14 13:45:30+00:00
bulamabukarti,Bulama Bukarti,"First they condemned every Fulani for the crime of some and justified attacks on them.

They are now justifying attacking Hausa traders because of Fulani herders and are exonerating the hoodlums that started the Oyo attacks.

That's the definition of hypocrisy amidst ethnicism.",2414,1638,https://twitter.com/bulamabukarti/status/1360693802231607297,2021-02-13 20:54:17+00:00
AishaYesufu,Aisha Yesufu,"@navy_guns I prefer you not forgiving ooooh. When ESN go and attack a Fulani herdsmen camp, I will still say it is not acceptable. That some people have terrorised you or you don't like some people is not a reason to go attacking anyone that they bear affiliations with.",1,0,https://twitter.com/AishaYesufu/status/1359159455573803011,2021-02-09 15:17:20+00:00
AishaYesufu,Aisha Yesufu,"@Bulamacartoons @EjenaviOnovaye That you decided to cancel it in your cartoon does not mean that it is cancelled. Many a times, I have been told to focus on the prostitution in Edo because of some who engage in it. You blatantly don't want others to talk about some Fulani herdsmen involved in terrorism",11,3,https://twitter.com/AishaYesufu/status/1358851905259241474,2021-02-08 18:55:15+00:00
AishaYesufu,Aisha Yesufu,"@STARSFLYZ1 @ankaboy Good bless you  for taking this ob on. I usually miss out on News. These are not the fulani herdsmen that were attacked by ESN. The ones attacked are the ones in their rugga with their cows. Their cows where even killed. 
Be reading the news as you tag me.",23,5,https://twitter.com/AishaYesufu/status/1357266279078498304,2021-02-04 09:54:32+00:00
bulamabukarti,Bulama Bukarti,"My Column this week: I argued that Ganduje's proposition for a law banning Fulani herdsmen from the middle belt and southern Nigeria is an affront to the constitution, a recipe for disintegration and will be ineffective in any case.
  
https://t.co/wG9KVaytSJ",137,38,https://twitter.com/bulamabukarti/status/1357261770075889667,2021-02-04 09:36:37+00:00
AishaYesufu,Aisha Yesufu,"I knew I did some tweets about Fulani herdsmen and how they started arming themselves years ago. They too started by protecting themselves from the armed robbers that used to rob and kill them until some of them turned rogue and became the transgressors.
What is bad is bad! https://t.co/pvg3edTl36",100,25,https://twitter.com/AishaYesufu/status/1356595941902532609,2021-02-02 13:30:51+00:00
AishaYesufu,Aisha Yesufu,@chikwadoca @AbdulMahmud01 Protecting yourself and becoming the transgressors are two different things. Fulani herdsmen also started by protecting themselves when they were constantly being robbed and killed by armed robbers and government did nothing,0,0,https://twitter.com/AishaYesufu/status/1356587833331486721,2021-02-02 12:58:38+00:00
AishaYesufu,Aisha Yesufu,"The same mouth I used for IPOB is the same mouth I use for fulani herdsmen.

Being Fulani herdsmen doesn't make one an automatic criminal. Those who perpetrated dastardly act should be fished out and not a bad paint used on everyone in a group. 
#SoroSoke #EndSars #WeMove https://t.co/F9wyqdotm6 https://t.co/w7jzF5eHvJ",85,22,https://twitter.com/AishaYesufu/status/1356579767710023682,2021-02-02 12:26:35+00:00
AishaYesufu,Aisha Yesufu,"When it was reported that Fulani threatened to expel Igbos and I said no one has monopoly of violence I was Fulani hater. Now that it was reported that Fulani are being driven away and I say no one has monopoly of violence I am Igbo hater 🤣🤣🤣🤣
Na only me dey hate all of una https://t.co/PkmAKB8BKK https://t.co/Yw2meQEz7w",78,21,https://twitter.com/AishaYesufu/status/1356252975170252804,2021-02-01 14:48:01+00:00
AreaFada1,Charly Boy Area Fada 1,"My People, 

Na so we go dey?
Dis is becoming a very normal story in Nigeria now.
Fulani Supremacy? https://t.co/AAT5KP5aIa",76,92,https://twitter.com/AreaFada1/status/1354791385619181578,2021-01-28 14:00:11+00:00
mrmacaronii,MrMacaroni,"I didn’t add ‘Fulani’ to my tweet because criminals are criminals no matter the Tribe. 
If you add it or any other tribe and start talking about ethnicity, that’s on you. 
The Killings and Kidnappings of Nigerians by Herdsmen and The Goverment’s Nepotism must end! 
Simple!!!",4969,1208,https://twitter.com/mrmacaronii/status/1353653761659568129,2021-01-25 10:39:41+00:00
bulamabukarti,Bulama Bukarti,"I’ve read this report. Nowhere did Badejo say, “Fulani Own Nigerian Lands”. I think Sahara Reporters’ American funders need to call this outlet to order. This is not journalism. It’s spreading falsehood and prejudice. https://t.co/lYYG1K3Tbv",869,616,https://twitter.com/bulamabukarti/status/1353356252961591296,2021-01-24 14:57:29+00:00
bulamabukarti,Bulama Bukarti,The attack on the Seriki Fulani in Oyo is an abhorrent crime that can lead to civil strife. Blanket profiling of *any* group for the crime of a few is unfair. Authorities must stop this barbarity&amp;punish offenders. Criminals among Fulanis must be punished ALONE &amp; according to law.,1139,429,https://twitter.com/bulamabukarti/status/1353044917631803394,2021-01-23 18:20:21+00:00
AishaYesufu,Aisha Yesufu,"@nwaegbe_nkem @Yusu768 @Waspapping_ 😆😆😆😆😆😆
Sister ooooh! Since 2014 that I joined twitter GEJ and PMB supporters have dragged me ooooh. It means I deal with them equally! ☺☺☺
On a serious note. Fulani herdsmen people live in forests and bushes with their animals just like the Maasai people",30,1,https://twitter.com/AishaYesufu/status/1346098236080214017,2021-01-04 14:16:43+00:00
AishaYesufu,Aisha Yesufu,"In 2016 I looked my father in the eyes &amp; told him every Nigerian has a right to live in any part of Nigeria. The fulani issue might be a reason for you to whip up tribal sentiments and now you have a voice that has been missing when injustice was meted on others, it isn't for me https://t.co/OgcyxP1Tti",106,33,https://twitter.com/AishaYesufu/status/1346047278767865856,2021-01-04 10:54:14+00:00
AreaFada1,Charly Boy Area Fada 1,"I see so much similarities between The Republican Party in America and our own APC party in Nigeria.

Buhari is all for the Fulani’s and his cows.
Trump is all for his Family members and his friends.

Oya give me some more similarities...................",4,2,https://twitter.com/AreaFada1/status/1338886207602913280,2020-12-15 16:38:41+00:00
BashirAhmaad,Bashir Ahmad,"@gimbakakanda @Mubarack_Umar @Abdulrahmanleme Enjoying Alhaji... I remember this Fulani Alhaji @Abdulrahmanleme has a PJ, so you are only one decision away from us.",12,2,https://twitter.com/BashirAhmaad/status/1335534575016177664,2020-12-06 10:40:30+00:00
BashirAhmaad,Bashir Ahmad,"His Royal Highness, Ambassador Ahmad Nuhu Bamalli was formally installed as the 19th Fulani Emir of Zazzau. Congratulations once again to good people of Zazzau Emirate (bayin Kanawa). https://t.co/VyE2wpc7Vz",1937,232,https://twitter.com/BashirAhmaad/status/1325757179954073600,2020-11-09 11:08:37+00:00
bulamabukarti,Bulama Bukarti,"In the interview, CP Fulani Kwajafa (rted), who created SARS in 1984, told BBC Hausa that had he known SARS would become the evil it became, he won’t have created it.

He condemned SARS’s abuses and said he’s ashamed to have created.

Those defending SARS should bury their heads. https://t.co/YDhL3jmGlu",8115,14466,https://twitter.com/bulamabukarti/status/1316668242803462145,2020-10-15 09:12:26+00:00
bulamabukarti,Bulama Bukarti,Tabdi! ‘Yar Fulani ta shigo gari kenan. Lalle qiyama ta zo. https://t.co/v1oO9AvZVA,26,6,https://twitter.com/bulamabukarti/status/1310987552313225217,2020-09-29 16:59:24+00:00
bulamabukarti,Bulama Bukarti,"Kebbi is the only state in its axis largely NOT affected by the growing violence in northwest Nigeria, but some elements are working to disturb this amazing, if not miraculous, record.

Fulani communities in Zuru LGA reported earlier this week that 63 of their members- including",312,160,https://twitter.com/bulamabukarti/status/1296399051806715906,2020-08-20 10:49:54+00:00
AishaYesufu,Aisha Yesufu,"Today they accuse me of hating 'Fulani' 😁😁😁😁
#LikeGejitesLikeBuharists https://t.co/fckE6cnC7X",6,0,https://twitter.com/AishaYesufu/status/1291695615362191361,2020-08-07 11:20:07+00:00
bulamabukarti,Bulama Bukarti,"Da a bani nonon Fulani, gwara a bani kero na kur6a.",55,4,https://twitter.com/bulamabukarti/status/1274719163920113667,2020-06-21 15:01:46+00:00
bulamabukarti,Bulama Bukarti,"Da na kwana bukkar fulani, gwara na kwana ramin maciji. 

Kuma saura ku ce da ku nake. Ni wakata kawai nake rerawa. Yauwa.",394,28,https://twitter.com/bulamabukarti/status/1269257886951227392,2020-06-06 13:20:36+00:00
ShehuSani,Senator Shehu Sani,"To end the Banditry &amp; Herdsmen violence,Prez Buhari should delegate a committee of prominent pure fulani leaders such as Prof Jubril Aminu,Bukar Abba Ibrahim,ex Gov Sule Lamido,Prof Iya Abubakar,Dr Mahmud Tukur &amp; others;they should engage all stakeholders &amp; end the attacks.",1942,342,https://twitter.com/ShehuSani/status/1268859528424099846,2020-06-05 10:57:40+00:00
bulamabukarti,Bulama Bukarti,"Da a ba ni ‘yar fulani, gwara a ba ni mari uku.",117,15,https://twitter.com/bulamabukarti/status/1267135408887996416,2020-05-31 16:46:38+00:00
NGRPresident,Presidency Nigeria,"PRESIDENT BUHARI CONDEMNS KILLINGS IN THE NAME OF REVENGE

President @MBuhari has again condemned the wave of attacks and counterattacks on people among the Fulani and Addara communities in Kajuru LGA of Kaduna State, saying that killing in the name of revenge is wrong.",588,173,https://twitter.com/NGRPresident/status/1260330780527558657,2020-05-12 22:07:28+00:00
AreaFada1,Charly Boy Area Fada 1,"Boko Haram, Fulani Herdsmen, Jihad are some words that has conjured up our Islamophobia.

 Just like Fake Pastors have given Christianity a Bad name, Fake Imams and crazy Jihadist have given Islam a Bad Image. https://t.co/gaRrfsObB0",35,17,https://twitter.com/AreaFada1/status/1247298897363566598,2020-04-06 23:03:25+00:00
bulamabukarti,Bulama Bukarti,"@Chuksbey Only that the Buhari contested against Atiku, a fellow Muslim, northerner &amp; Fulani. If you are talking of 2015, Jonathan’s failure was clear to all. That’s why majority of Nigerians - including southern Christians - voted Buhari, whom we thought would be better, but we’re wrong.",17,0,https://twitter.com/bulamabukarti/status/1241252440231620609,2020-03-21 06:36:57+00:00
AreaFada1,Charly Boy Area Fada 1,"Which is more Dangerous?
Fulani Government or Coronavirus? https://t.co/IJZJMCuTkA",66,38,https://twitter.com/AreaFada1/status/1238242874824757248,2020-03-12 23:18:01+00:00
AreaFada1,Charly Boy Area Fada 1,It's the same. A tacit support for the Fulani agenda to increase their political capital and whatever it is they think they stand to gain at the expense of the people. You're selling the people out! Saboteurs in Igbo land. Kai!!!!!,9,0,https://twitter.com/AreaFada1/status/1237366827682054146,2020-03-10 13:16:55+00:00
AreaFada1,Charly Boy Area Fada 1,"God punish the Minister of health wey cookup the Yeye story say coronavirus don arrive Nigeria, throwing everybody into panic. Sotey the useless CNN pple come go carry news dem no investigate.

Everything for dis our Fulani infested country don turn to racket, scam and scamming. https://t.co/8wazfBtwZ8",93,39,https://twitter.com/AreaFada1/status/1235609893077426181,2020-03-05 16:55:29+00:00
AishaYesufu,Aisha Yesufu,I asked this question when the term fulani herdsmen was being thrown around but the name stuck https://t.co/uulvQUnKav,8,4,https://twitter.com/AishaYesufu/status/1226789032497205249,2020-02-10 08:44:32+00:00
AishaYesufu,Aisha Yesufu,This was me in March 2015 questioning the use of the term Fulani herdsmen https://t.co/fckE6cnC7X,6,1,https://twitter.com/AishaYesufu/status/1226788280399794177,2020-02-10 08:41:33+00:00
bulamabukarti,Bulama Bukarti,3. Your point that the first wave were non-Hausa/Fulani ignores the existence of Hausa/Fulani BH members inside Bauchi even during Yusuf l’s reign.,0,1,https://twitter.com/bulamabukarti/status/1218863196121026561,2020-01-19 11:50:05+00:00
bulamabukarti,Bulama Bukarti,"I hear you @FulanNasrullah.

1. While I agee that there’re a chuck of Ibira, Igala and others in Ansaru, I believe, what we call “Hausa/Fulani” outnumbers them. I don’t have figures why didn’t give any. But if you do have, please avail us. https://t.co/lP3YgsRaRb",4,1,https://twitter.com/bulamabukarti/status/1218863188663578627,2020-01-19 11:50:04+00:00
bulamabukarti,Bulama Bukarti,I agree with you on this. Some even falsely say that it’s a Fulani Jihad. There are things you don’t say in public but I did a lot to fight this idea here in England including the British Parliament. Maybe you will get know if and when we meet or through those who were there. https://t.co/cBRdq3Vqfs,7,0,https://twitter.com/bulamabukarti/status/1218850882122649600,2020-01-19 11:01:10+00:00
bulamabukarti,Bulama Bukarti,"I didn’t mention any to stigmatize or for any bad motive. Those who know me know that I love and respect my Hausa and Fulani friends as much as I respect my Kanuri ones. In fact, I have more Hausa and Fulani friends than Kanuris. But won’t stop me from stating the fact.",6,3,https://twitter.com/bulamabukarti/status/1218841268379377664,2020-01-19 10:22:58+00:00
bulamabukarti,Bulama Bukarti,You could say 90+% of JAS is Kanuri. Most members of Ansaru are Hausa/Fulani. Their first leader was Muhammad Auwal from Gombe. Some BH scholars even hypothesize that it’s partly because of tribal politics that Ansaru broke away from BH. Most bandits are Fulanis. https://t.co/UUh5WsXif7,12,10,https://twitter.com/bulamabukarti/status/1218841266152255488,2020-01-19 10:22:57+00:00
bulamabukarti,Bulama Bukarti,"4. Last Ramadhan, Ansaru released its 1st tafsir in Fulfude, an indication that it’s trying to recruit and radicalise Fulani bandits with excellent knowledge of the terrain and years of experience. Has Ansaru succeeded? If so, it will be like adding salt to a fresh, open wound.",26,46,https://twitter.com/bulamabukarti/status/1218801827468234752,2020-01-19 07:46:14+00:00
