username,displayName,tweet,likes,retweets,link,date
ShehuSani,Senator Shehu Sani,"The Killers in the North West are called Bandits;North East,Terrorists;South East,Hoodlums;South West,Herdsmen;Benue,militia;POrt Harcourt,Cultists.South South,Militants.",2415,732,https://twitter.com/ShehuSani/status/1386012320673972228,2021-04-24 17:41:02+00:00
bulamabukarti,Bulama Bukarti,"Yesterday, the New York Times published a great article on how ""In Bid to Boost Its Profile, ISIS Turns to Africa’s Militants"".

This reminded of a piece I wrote in 2017 warning of exactly this, highlighting  how it might happen and making recommendations:
https://t.co/iFtxSPybFA",41,14,https://twitter.com/bulamabukarti/status/1380059799824572418,2021-04-08 07:27:51+00:00
ShehuSani,Senator Shehu Sani,"Where there is Black Gold,there are militants;Where there is Gold,there are Bandits.",2229,389,https://twitter.com/ShehuSani/status/1372590534162837510,2021-03-18 16:47:39+00:00
ShehuSani,Senator Shehu Sani,An appeal to the Niger Delta militants not to add to our woes.,2786,368,https://twitter.com/ShehuSani/status/1364513991343689728,2021-02-24 09:54:21+00:00
bulamabukarti,Bulama Bukarti,"President Buhari’s reaction to the attack that killed 100 people in Niger Republic according to Garba Shehu,

“I am profoundly shocked by the large scale death of innocent people at the hands of these callous militants who have no regard for the sanctity of human life.""",331,95,https://twitter.com/bulamabukarti/status/1345977598665510912,2021-01-04 06:17:21+00:00
bulamabukarti,Bulama Bukarti,"“Only in Nigeria have we seen militants walk into a high school and abduct the whole student body,” said Bulama Bukarti, an analyst at the Tony Blair Institute for Global Change... An attack on Nigeria’s children is an attack on the country’s future.” https://t.co/Bp4uuf3KHX",182,45,https://twitter.com/bulamabukarti/status/1338875171613052928,2020-12-15 15:54:50+00:00
AishaYesufu,Aisha Yesufu,"Reports from northeastern Nigeria's Borno State say suspected Boko Haram militants have stormed farms and killed at least 40 people.

The incident took place early Saturday.
Until the North is ready, the killings will not stop. Sadly, securing lives has been turned to politics. https://t.co/cEU7V5N1dh",800,374,https://twitter.com/AishaYesufu/status/1332759341909336065,2020-11-28 18:52:43+00:00
bulamabukarti,Bulama Bukarti,"A great piece on the dangerous roads into Maiduguri by @JoeWSJ:

“Maiduguri has become a green zone, but step outside the city and you immediately see the reality,” said Bulama Bukarti... “The attacks on these roads are continuous and the militants can...”
https://t.co/cbMRPIG7pq",74,42,https://twitter.com/bulamabukarti/status/1329680779849457665,2020-11-20 06:59:36+00:00
AishaYesufu,Aisha Yesufu,@tobialajiki They have been on it for many years. They want boko Haram members to get what Niger Delta militants got,24,6,https://twitter.com/AishaYesufu/status/1233440742640627713,2020-02-28 17:16:03+00:00
