username,displayName,tweet,likes,retweets,link,date
dabiodunMFR,Prince Dr. Dapo Abiodun - MFR,"This is the power of youth, the strength in unity, and the new ERA in Nigeria.",36,19,https://twitter.com/dabiodunMFR/status/1316042159146049536,2020-10-13 15:44:36+00:00
mrmacaronii,MrMacaroni,Nigerian Youths!!!!!! We have a voice!!! This is the beginning of a New Nigeria!!!!! SARS has been dissolved!!!,62848,32944,https://twitter.com/mrmacaronii/status/1315272753361154048,2020-10-11 12:47:15+00:00
NGRPresident,Presidency Nigeria,"President Buhari today addressed, via a video message, the virtual 2020 Biodiversity Summit, held on the margins of the 75th UN General Assembly, in New York. In his remarks he outlined measures by Nigeria to reverse biodiversity loss. #UNGA75 #UNGA2020",233,43,https://twitter.com/NGRPresident/status/1311419327594344448,2020-09-30 21:35:07+00:00
MBuhari,Muhammadu Buhari,"Let me also congratulate the new Emir, Sheikh Nawaf Al-Ahmad Al-Jaber Al-Sabah. I urge him to build on the commendable legacy of his predecessor and deepen existing relations between Kuwait and Nigeria.",827,111,https://twitter.com/MBuhari/status/1311337458160803843,2020-09-30 16:09:48+00:00
PoliceNG,Nigeria Police Force,"Members of the Nigeria Civil Society Situation Room were at the Force Headquarters to congratulate the IGP on the recent reforms and achievements of the Force, especially the new Nigeria Police Act, 2020 which repeals the Police Act Cap. P19, Laws of the Federation, 2004 and ...",12,1,https://twitter.com/PoliceNG/status/1310615437881868290,2020-09-28 16:20:45+00:00
NGRPresident,Presidency Nigeria,"In May this year, President Buhari received President Embalo in Abuja, during which the Nigerian leader congratulated his counterpart on his confirmation as President, assuring him of Nigeria’s support to the new government in Guinea Bissau.",29,10,https://twitter.com/NGRPresident/status/1309068872004374528,2020-09-24 09:55:15+00:00
BashirAhmaad,Bashir Ahmad,"Nigeria recorded 79 new COVID-19 cases y’day as NCDC announced last night, the cases were the lowest in months as the country intensifies its efforts to win over the pandemic so schools, social activities and full businesses can be re-opened earlier than the expectations of many.",1960,328,https://twitter.com/BashirAhmaad/status/1305420272535822336,2020-09-14 08:17:01+00:00
obyezeks,Oby Ezekwesili,Incredible! No way a people can go from precipice to a New Path without a willingness to part with the old ways that alienated them from greatness. God does not care about hollow platitudes. He wishes that a country like #Nigeria and #Nigerians #Think #Admit #Design #Act on GOOD.,13,3,https://twitter.com/obyezeks/status/1301823229623967744,2020-09-04 10:03:39+00:00
obyezeks,Oby Ezekwesili,"“Then the Lord was jealous for his land and took pity on his people. The Lord replied to them: “I am sending you grain, new wine and olive oil, enough to satisfy you fully; never again will I make you an object of scorn to the nations.”
Joel 2:18-19 #Nigeria",19,4,https://twitter.com/obyezeks/status/1301821536438046720,2020-09-04 09:56:55+00:00
obyezeks,Oby Ezekwesili,"The #Bible book of Joel Chapter One also has: 
“The field is wasted, The land mourns; For the grain is ruined, The new wine is dried up, The oil fails.”
Joel 1:10.
“All the trees of the field are withered; Surely joy has withered away from the sons of men.”
Joel 1:12. 
#Nigeria",20,2,https://twitter.com/obyezeks/status/1301807573298016256,2020-09-04 09:01:26+00:00
BashirAhmaad,Bashir Ahmad,"Nigeria; Aviation services to fully resume on 5th September, as the international airspace will be opened and joined with already existing domestic aviation services. New guidelines on risk reduction will be published by the PTF for international travellers. — PTF.",1051,231,https://twitter.com/BashirAhmaad/status/1301615932050157573,2020-09-03 20:19:55+00:00
AishaYesufu,Aisha Yesufu,@koffi890 @speakerdiz @elrufai Waiting for him to lead creation of NewNigeria,1,0,https://twitter.com/AishaYesufu/status/1301112234312110081,2020-09-02 10:58:24+00:00
AishaYesufu,Aisha Yesufu,"Fantastic!
When are we having New Nigeria? https://t.co/70LALfVVIN",11,5,https://twitter.com/AishaYesufu/status/1300855976669646849,2020-09-01 18:00:08+00:00
BashirAhmaad,Bashir Ahmad,"The NCDC’s latest update last night showed that Nigeria recorded its lowest single-day COVID–19 cases in four months, 138 new cases. We look forward to seeing more improved situation in the coming days, in sha Allah. #COVID19Nigeria",1086,114,https://twitter.com/BashirAhmaad/status/1300385729550454784,2020-08-31 10:51:32+00:00
BashirAhmaad,Bashir Ahmad,"Today, Muharram 1st in Nigeria, the first day of the Islamic New Year, 1442 AH. May this New Year usher in a new beginning, peace happiness and joy for you and your loved ones. Happy Islamic New Year to all of us. #1442Hijriah",2074,339,https://twitter.com/BashirAhmaad/status/1296737956712120321,2020-08-21 09:16:35+00:00
BashirAhmaad,Bashir Ahmad,"So tomorrow, not today is the Islamic New Year in Nigeria, thank you for bringing my attention, the calendar I am using on my phone shows today is Muharram 1st, but we always follow the authority. May God spare our lives to see tomorrow and beyond. #1442Hijriah",2097,324,https://twitter.com/BashirAhmaad/status/1296383359728455682,2020-08-20 09:47:33+00:00
BashirAhmaad,Bashir Ahmad,"Latest @NCDCgov report on COVID-19 shows that in the last 24 hours, Nigeria recorded 1,689 recovery, 329 new cases with 7 deaths. Now, total confirmed cases 48,445; total discharged 35,998, while 973 are the total deaths. It is still very important to #WearAMask, esp. in public.",638,93,https://twitter.com/BashirAhmaad/status/1294415381168377857,2020-08-14 23:27:30+00:00
BashirAhmaad,Bashir Ahmad,"The new acquired locomotives and coaches for #AbujaKadunaRail, test-run to be done today, and deployment when the train service resumes. The Ministry of Transportation plans to increase the Abuja-Kaduna frequency from four return trips daily to seven. #Nigeria https://t.co/SrHGPVTERz",1763,458,https://twitter.com/BashirAhmaad/status/1286996324492222464,2020-07-25 12:06:49+00:00
bulamabukarti,Bulama Bukarti,I welcome the new National Consultative Front. Nigeria deserves better than the binary choice between two evils. Seeing the eminent Nigerians on the list is very inspiring. I hope this one will be different and will start mobilizing now so as create a strong Third Force for 2023.,110,12,https://twitter.com/bulamabukarti/status/1278731274925027328,2020-07-02 16:44:28+00:00
BashirAhmaad,Bashir Ahmad,"When completed, the 614km Ajaokuta-Kaduna-Kano natural gas pipeline will push #Nigeria’s power generation capacity to more than 10,000MW as the three new captive gas-fired plants, to be located in #Abuja, #Kaduna and #Kano, are expected to deliver 3,600MW of power. #AKKProject https://t.co/FQrje2B3Ti",1104,296,https://twitter.com/BashirAhmaad/status/1278003504917987328,2020-06-30 16:32:34+00:00
BashirAhmaad,Bashir Ahmad,"On completion, the 614km Ajaokuta-Kaduna-Kano (AKK) natural gas pipeline will push Nigeria’s power generation capacity to more than 10,000MW as the three (AKK) new captive gas-fired plants, to be located in Abuja, Kaduna and Kano, are expected to deliver 3,600MW of power.",1154,301,https://twitter.com/BashirAhmaad/status/1276647852526243846,2020-06-26 22:45:41+00:00
AreaFada1,Charly Boy Area Fada 1,"Now that hushpuppi's 'inglorious' career of defrauding people is over, who will be the new Hero for the mumulistic youths.

 Nigeria youths pick your Hero’s wisely. https://t.co/YR9mwvW0Zv",35,17,https://twitter.com/AreaFada1/status/1276308615775825927,2020-06-26 00:17:41+00:00
BashirAhmaad,Bashir Ahmad,"Nigeria recorded 745 new COVID–19 cases in a single day, extremely scary! Please take responsibility, protect yourself, your family and your beloved ones. Wear a mask and keep the distance.",1356,282,https://twitter.com/BashirAhmaad/status/1273749927433318402,2020-06-18 22:50:22+00:00
MBuhari,Muhammadu Buhari,"The Public Service of Nigeria remains the bedrock for the formulation and implementation of policies, programmes and projects in the country. This accounts for why it continues to evolve especially as new socio-economic challenges emerge for Government to address.",227,102,https://twitter.com/MBuhari/status/1271331836795510784,2020-06-12 06:41:44+00:00
BashirAhmaad,Bashir Ahmad,"The NCDC last night reported 663 new cases of #COVID19 in Nigeria. The numbers keep increasing wildly and at the same time the fear of the deadly virus keeps decreasing ridiculously. At all costs, we need to protect ourselves &amp; our beloved ones, the virus is very real. #StaySafe!",1332,260,https://twitter.com/BashirAhmaad/status/1270595049076768769,2020-06-10 05:54:00+00:00
BashirAhmaad,Bashir Ahmad,"UN, Nigeria trash rumours of new nation called UNO State of Cameroon https://t.co/C25nTxKUhD",364,121,https://twitter.com/BashirAhmaad/status/1269244492277780480,2020-06-06 12:27:23+00:00
BashirAhmaad,Bashir Ahmad,"“Nigeria may lose 24 councils to new UN state” you might have read this story on the Guardian newspapers, WhatsApp or somewhere else, the story is 100% fake, fabricated, may be for an agenda only best known to those that started the spreading the fake news.",2446,753,https://twitter.com/BashirAhmaad/status/1269244115780284416,2020-06-06 12:25:53+00:00
ShehuSani,Senator Shehu Sani,Some years ago I met Majek Fashek near a train station in New York b4 he returned to Nigeria.He was a shadow of d man many of us loved decades ago.Majek rode thru a rough &amp; dangerous terrain in Life.He tried to pick up &amp; now is gone.He was an unforgettable https://t.co/BEp0MYorJr,1820,214,https://twitter.com/ShehuSani/status/1267716320365367297,2020-06-02 07:14:58+00:00
BashirAhmaad,Bashir Ahmad,"Things not looking good gaskiya, 553 new cases in Nigeria, 378 in Lagos alone. Taking responsibility is the only way that can slow down these numbers. Stay at home, when going out becomes necessary, wear a mask, observe social distancing and other NCDC guidelines. Let’s do it! 🙏🏼",2433,486,https://twitter.com/BashirAhmaad/status/1266876894525427712,2020-05-30 23:39:23+00:00
BashirAhmaad,Bashir Ahmad,"New cases, 389 recorded in Nigeria, 256 in Lagos alone. This is very scary, what’s really happening in Lagos? If not very necessary, please #StayAtHome, when no any other option but to go out, wear a mask and abide by all NCDC guidelines. #StaySafe!",1253,245,https://twitter.com/BashirAhmaad/status/1265782485981462530,2020-05-27 23:10:36+00:00
BashirAhmaad,Bashir Ahmad,"President @MBuhari commiserates with the media industry, particularly Nigeria Union of Journalists and Nigeria Guild of Editors, over the passing of the Saturday Editor of New Telegraph Newspapers, Mr. Waheed Bakare.",782,76,https://twitter.com/BashirAhmaad/status/1264935155925422085,2020-05-25 15:03:37+00:00
BashirAhmaad,Bashir Ahmad,"The new moon of Shawwal is not sighted in Nigeria, the #EidAlFitr is on Sunday, 24th May, 2020, Sultan of Sokoto, Alhaji Muhammad Sa’ad Abubakar III has announced.",3150,1007,https://twitter.com/BashirAhmaad/status/1263919877208903682,2020-05-22 19:49:15+00:00
bulamabukarti,Bulama Bukarti,"In a new report, @CrisisGroup says over 8,000 Nigerians have been killed by communal clashes, criminals and extremists in Northwestern Nigeria. It confirms what we know about the actors, drivers, dynamics and impact of the crisis and adds insights.
https://t.co/FvPpUCfBCy",46,16,https://twitter.com/bulamabukarti/status/1262483160874582018,2020-05-18 20:40:16+00:00
BashirAhmaad,Bashir Ahmad,"PROFILE: He was Minister of External Affairs (1984-1985) and subsequently Ambassador/Permanent Representative of Nigeria to the UN (1990-1999); read a brief profile of Amb. Ibrahim A. Gambari, President Muhammadu Buhari’s new CoS. https://t.co/OHrYCBxsAA",1816,572,https://twitter.com/BashirAhmaad/status/1260538880241143810,2020-05-13 11:54:23+00:00
BashirAhmaad,Bashir Ahmad,"The COVID—19 pandemic has changed the world in many ways, the “new normals” are uncountable. This is the first online court sitting in Nigeria, held in Maiduguri, Borno State https://t.co/DT2GeP53qe",1153,491,https://twitter.com/BashirAhmaad/status/1255121897769127936,2020-04-28 13:09:14+00:00
MBuhari,Muhammadu Buhari,"Nigeria continues to adapt to these new global realities on a daily basis. Today, I will present the facts as they are and explain our plans for the coming months fully aware that some key variables and assumptions may change in the coming days or weeks.",1964,718,https://twitter.com/MBuhari/status/1254848420814172161,2020-04-27 19:02:32+00:00
BashirAhmaad,Bashir Ahmad,"This is scary, as the NCDC reported 114 new cases, raising the total number of the cases to 1095 in Nigeria. Hey, we need to do this sacrifice, this virus is very real, let’s abandon the streets now and #StayAtHome",4804,1107,https://twitter.com/BashirAhmaad/status/1253824380095823874,2020-04-24 23:13:21+00:00
BashirAhmaad,Bashir Ahmad,The Sultan of Sokoto has just announced the sight of the new month of Ramadan. Tomorrow is 1st day of Ramadan in Nigeria. May Allah accept all our ibadah. #Ramadan Mubarak to all my brothers and sisters.,4410,1353,https://twitter.com/BashirAhmaad/status/1253414154343346182,2020-04-23 20:03:16+00:00
BashirAhmaad,Bashir Ahmad,"So far, 188 #COVID19 patients have recovered in Nigeria, as the NCDC reported thirty-eight new cases of the pandemic. Numbers from Kano are not looking good.",2066,401,https://twitter.com/BashirAhmaad/status/1252363890605740032,2020-04-20 22:29:53+00:00
dabiodunMFR,Prince Dr. Dapo Abiodun - MFR,The Nigeria Centre for Disease Control @NCDCgov has confirmed 2 new cases of COVID-19 in Ogun State. https://t.co/CqEvE9EF6y,340,126,https://twitter.com/dabiodunMFR/status/1251773890021543936,2020-04-19 07:25:26+00:00
bulamabukarti,Bulama Bukarti,"Yesterday, @KNSMOH announced 12 new cases &amp; first Covid-19 death in Kano. This rises total cases to 21 and makes Kano the 3rd state in Nigeria. This for a state that had zero cases just five days ago is worrying. It suggests that the virus might have spread beneath the surface...",518,205,https://twitter.com/bulamabukarti/status/1250651802313412608,2020-04-16 05:06:40+00:00
BashirAhmaad,Bashir Ahmad,"While it’s something of joy to see that 128 #COVID19 patients have so far, recovered from the pandemic in Nigeria, but the number of new cases especially in Kano and Lagos will definitively not make us sleep well tonight.",2209,479,https://twitter.com/BashirAhmaad/status/1250564039543062530,2020-04-15 23:17:56+00:00
BashirAhmaad,Bashir Ahmad,"Nigeria has recorded 8 new #COVID19 recovery today, raising the total number of recovered patients to 99, unfortunately, with 11 deaths. #StayAtHome",972,196,https://twitter.com/BashirAhmaad/status/1250158666478768128,2020-04-14 20:27:07+00:00
BashirAhmaad,Bashir Ahmad,"The Nigeria Centre for Disease Control (⁦@NCDCgov⁩) says by the end of this week, there will be four new molecular diagnostic laboratories for testing the #COVID19 in Kano, Kaduna, Jos and Maiduguri. https://t.co/5ApLvzxcNR",566,177,https://twitter.com/BashirAhmaad/status/1247459990920728578,2020-04-07 09:43:33+00:00
BashirAhmaad,Bashir Ahmad,"The @NCDCgov has announced 8 new cases of #COVID19 in the country, 7 in Lagos and 1 in Benue. As at 4:00 pm on March 28th, there are 89 confirmed cases of #coronavirus in Nigeria. Oh God! This thing is very real, kindly keep endoring the new protocols, especially the #StayAtHome.",1221,396,https://twitter.com/BashirAhmaad/status/1243920657580199936,2020-03-28 15:19:30+00:00
BashirAhmaad,Bashir Ahmad,"President @MBuhari this afternoon, received briefings from Minister of Health, @DrEOEhanire and Director-General of @NCDCgov, Dr. @Chikwe_I as Nigeria intensifies and introduces new measures to curtail and prevent the spread of #COVID19 outbreak in the country. #COVID19Nigeria https://t.co/N8svUAfWse",2616,926,https://twitter.com/BashirAhmaad/status/1243883991188541440,2020-03-28 12:53:48+00:00
AishaYesufu,Aisha Yesufu,"Nigeria is about to face the biggest medical challenge it has ever known with it's healthcare system in shambles and the SA to the President on New media @toluogunlesi is calling me names for asking a question on a tweet I came across, meaning no emergency meetings at villa? https://t.co/JNXPd00qrr",52,18,https://twitter.com/AishaYesufu/status/1242105066481483776,2020-03-23 15:04:59+00:00
BashirAhmaad,Bashir Ahmad,"The @NCDCGov has confirmed 5 new cases of #COVID19 this morning (at 9:45am). 2 in FCT, 2 in Lagos and 1 in Edo

Confirmed cases in Nigeria, so far

Lagos - 24
Abuja - 6
Ogun - 2
Ekiti - 1
Oyo - 1
Edo - 1

Total: 35
Recoveries: 2

Stay safe! #COVID19Nigeria",2301,1012,https://twitter.com/BashirAhmaad/status/1242016003778850816,2020-03-23 09:11:05+00:00
BashirAhmaad,Bashir Ahmad,"UPDATE: Four new cases of #COVID19 confirmed in Nigeria this morning. LAG — 3, Oyo — 1.

Breakdown of cases by states;

Lagos - 19
FCT - 3
Ogun - 2
Ekiti - 1
Oyo - 1

Total: 26 confirmed cases.

For real time updates on #COVID19Nigeria visit - https://t.co/LAjyb8nYQT",1675,861,https://twitter.com/BashirAhmaad/status/1241640631107280897,2020-03-22 08:19:29+00:00
BashirAhmaad,Bashir Ahmad,"FLASH: The Federal Ministry of Health has just confirmed 10 new cases of #coronavirus in Nigeria. Of the 10 new cases, 3 are in the Federal Capital Territory, Abuja and 7 are in Lagos State.",2661,1304,https://twitter.com/BashirAhmaad/status/1241360353348509696,2020-03-21 13:45:46+00:00
BashirAhmaad,Bashir Ahmad,"As Nigeria recorded 5 new cases of #Coronavirus, please read carefully, all you need to know about the virus, its symptoms, how it spreads and the prevention. #SafeHands

Kindly send to your beloved ones, family, friends and as many as you can.

Please RETWEET for others #COVID19 https://t.co/yeq7NPxqY9",957,833,https://twitter.com/BashirAhmaad/status/1240238200095989760,2020-03-18 11:26:44+00:00
BashirAhmaad,Bashir Ahmad,"FLASH: Nigeria has recorded 5 new cases of #Coronavirus, bringing to 8 confirmed cases in the country. All 5 cases had a travel history to the UK and US. Nobody has died from the disease in Nigeria and one of the earlier three cases had completely recovered. #COVID19Nigeria",1126,439,https://twitter.com/BashirAhmaad/status/1240230987377844225,2020-03-18 10:58:04+00:00
BashirAhmaad,Bashir Ahmad,"Happy new month Nigerians, read this thread and be proud of your Motherland. The @fmohnigeria and @NCDCgov have been assuring Nigerians of their readiness and it’s very obvious for all to see. Thank you for putting this together, Doc. Good to see #Nigeria ahead. #COVID19Nigeria https://t.co/z3k1hfe8s0",166,44,https://twitter.com/BashirAhmaad/status/1234077478785863681,2020-03-01 11:26:13+00:00
obyezeks,Oby Ezekwesili,"You never change things by fighting against the existing reality. To change something, build a new
model that makes the old model obsolete~~~ Buckminster Fuller

The reality of Nigeria’s, nay Africa’s #MonopolyDemocracy demands we build a new model. 

Hence, we #FixPolitics.",16,5,https://twitter.com/obyezeks/status/1230771407400751104,2020-02-21 08:29:04+00:00
bulamabukarti,Bulama Bukarti,"4. In Zamfara and Imo, the applicants want the Supreme Court to upturn its own judgement in the very matter in question. If the Court accedes to them or even gets into the substance of the applications, that will be new era in Nigeria’s legal procedure and jurisprudence.",18,9,https://twitter.com/bulamabukarti/status/1230200821272449024,2020-02-19 18:41:46+00:00
bulamabukarti,Bulama Bukarti,"Here’s why trekking for politicians is becoming an industry in northern Nigeria. 

“It was gathered that Mr Ganduje had given the trekker the sum of N500,000 and a Hajj slot and a brand new laptop computer.”

https://t.co/nq7DtV0RmM",48,5,https://twitter.com/bulamabukarti/status/1225858124407615488,2020-02-07 19:05:26+00:00
MBuhari,Muhammadu Buhari,"This new Visa Policy will advance our goal of building a globally competitive economy, by helping attract Innovation, and specialized skills and knowledge from abroad, to complement locally available ones. We are sending a message to the world that Nigeria is Open for Business.",943,201,https://twitter.com/MBuhari/status/1224697254054891521,2020-02-04 14:12:33+00:00
MBuhari,Muhammadu Buhari,"Pleased to announce that Nigeria has a new Visa Policy, which I launched today. This new Policy will help improve our business environment, attract FDI, boost tourism, and improve African integration, without compromising national security and our territorial integrity. https://t.co/Pbue6URZ6k",6824,1262,https://twitter.com/MBuhari/status/1224696733848031234,2020-02-04 14:10:29+00:00
BashirAhmaad,Bashir Ahmad,Thhe UK-Africa Investment Summit has launched a new partnership for growth in Nigeria. The British Commissioner @CatrionaLaing1 in a statement said that the commercial deals worth £324m (over ₦153.4 billion) has been signed between Nigeria and the UK Investors. #InvestInNigeria https://t.co/X7f0kgUCXL,225,44,https://twitter.com/BashirAhmaad/status/1219687942077198336,2020-01-21 18:27:20+00:00
NGRPresident,Presidency Nigeria,"President Buhari, in a formal letter, recounts the strides being taken in Nigeria-China 🇳🇬 🇨🇳 relations, and says “we have new opportunities for mutual benefits.”

The full text of the letter: https://t.co/zqliQf6DBm",26,9,https://twitter.com/NGRPresident/status/1219662463534280704,2020-01-21 16:46:06+00:00
BashirAhmaad,Bashir Ahmad,"A new case for a Commonwealth based on trade by President Muhammadu Buhari

“Relations between Nigeria and the UK are close and longstanding, most recently reiterated in our 2018 bilateral security pact and our collaboration in anti-trafficking” PMB writes https://t.co/kWQp63sYZV",235,56,https://twitter.com/BashirAhmaad/status/1219191438098997248,2020-01-20 09:34:24+00:00
PoliceNG,Nigeria Police Force,"I trust that you shall not fail the Nigeria Police Force, neither will you fail the nation in the arduous responsibilities that your new rank shall impose on you.",15,4,https://twitter.com/PoliceNG/status/1214949769753350146,2020-01-08 16:39:32+00:00
RealSeunKuti,Seun Anikulapo Kuti,"Nigeria needs 30 million new jobs by 2030 – World Bank – WER WE GO SEE AM, DAT MUST B IN OUR DREAMS SOFAR NA DIS SAME SET OF RULERS IN APC AND PDP DEY RULE OUR CONTRI. NA REASON WHY D YOUTHS AND POOR MUST COME TOGETHER TO CHASE DIS RULERS OUT COME 2023  https://t.co/SL1aGySZrX",14,9,https://twitter.com/RealSeunKuti/status/1212769197157179392,2020-01-02 16:14:43+00:00
BashirAhmaad,Bashir Ahmad,"Nigeria is the most tremendous, can-do market, offering extraordinary opportunities and returns. Investors can look forward with confidence not only to an increasing momentum of change but also to specific incentives, including our new visa-on-arrival policy. #PMBs2020Letter https://t.co/0HUV6dETDQ",184,51,https://twitter.com/BashirAhmaad/status/1212314707358560256,2020-01-01 10:08:44+00:00
BashirAhmaad,Bashir Ahmad,President Muhammadu Buhari writes to Nigerians — “This is a new year and the beginning of a new decade - the Nigerian Decade of prosperity and promise for Nigeria and for Africa.” #HappyNewDecade  https://t.co/hdAflrwlbo,463,113,https://twitter.com/BashirAhmaad/status/1212308955269083136,2020-01-01 09:45:53+00:00
NGRPresident,Presidency Nigeria,“This is a new year and the beginning of a new decade - the Nigerian Decade of prosperity and promise for Nigeria and for Africa.” — @MBuhari,428,85,https://twitter.com/NGRPresident/status/1212291560135700480,2020-01-01 08:36:45+00:00
MBuhari,Muhammadu Buhari,"Fellow Nigerians, this is a new year and the beginning of a new decade - the Nigerian Decade of prosperity and promise for Nigeria and for Africa.

My New Year Message: https://t.co/QRA6zKYLcl",6935,1302,https://twitter.com/MBuhari/status/1212274949253214214,2020-01-01 07:30:45+00:00
