username,displayName,tweet,likes,retweets,link,date
AishaYesufu,Aisha Yesufu,"They will not take the nonsense their children took. They have started showing it. The banditry and kidnappings and terrorism is just the beginning. In the word of SLS the North will destroy itself if.....

https://t.co/54lA5thdPy",12,5,https://twitter.com/AishaYesufu/status/1297275487757258759,2020-08-22 20:52:33+00:00
AishaYesufu,Aisha Yesufu,"@i_am_dexterous Na the power they hunt them in terms of terrorism, insurgency and banditry",2,0,https://twitter.com/AishaYesufu/status/1297250728394842112,2020-08-22 19:14:10+00:00
AishaYesufu,Aisha Yesufu,Dedicating himself to #LeahSharibu is not the issue but obliterating the #ChibokGirls abduction who were abducted same manner but under a different government because of his political bias is political terrorism. Reno Omokri @renoomokri is a political terrorist! https://t.co/PC80HA4hib,11,2,https://twitter.com/AishaYesufu/status/1293862591773790208,2020-08-13 10:50:55+00:00
PoliceNG,Nigeria Police Force,"international assignments such as the UN/AU Peacekeeping Operations as well as support for Counter-Terrorism Training programs.

The IGP, while noting that the construction of the college was through enormous goodwill and support from the Nasarawa State Government, ...",11,2,https://twitter.com/PoliceNG/status/1293574203845877762,2020-08-12 15:44:58+00:00
MBuhari,Muhammadu Buhari,"It was an opportunity to share notes and ideas. We are doing all that is necessary to defeat banditry, kidnapping, terrorism and other forms of criminality in Nigeria. We are also aware of the areas that need improvement, including synergy, and intelligence-gathering.",496,122,https://twitter.com/MBuhari/status/1293244561649795074,2020-08-11 17:55:05+00:00
PoliceNG,Nigeria Police Force,"The Squad comprises: the Police Mobile Force (PMF), Counter Terrorism Unit (CTU), Police Special Forces, Detectives/Intelligence Operatives as well as personnel of the Kaduna State Police Command, the Military and other security agencies.",32,18,https://twitter.com/PoliceNG/status/1287757738811023361,2020-07-27 14:32:24+00:00
ShehuSani,Senator Shehu Sani,"The fresh killings in Southern Kaduna and the killings and abductions in the outskirts of Kaduna on Sunday stands https://t.co/iOY9XoFcZB action by the Government is satisfactory until these repeated acts of terrorism,kidnappings and massacres are successfully brought to an end.",954,231,https://twitter.com/ShehuSani/status/1283015456891248644,2020-07-14 12:28:16+00:00
bulamabukarti,Bulama Bukarti,@CalibreObscura @ottotgs @HQNigerianArmy @OfficialMNJTF @DefenceInfoNG @Nigeria And even his definition of terrorism doesn’t include exposing misinformation and disinformation.,0,0,https://twitter.com/bulamabukarti/status/1278800841240084493,2020-07-02 21:20:54+00:00
BashirAhmaad,Bashir Ahmad,"The Presidency assures Nigerians, again, that the nation’s armed forces are fully capable of dealing with the challenges of banditry and terrorism, urging more patience as the military takes appropriate steps to block gaps being exploited to unleash mayhem on innocent citizens. https://t.co/JxFKY3gZHF",852,247,https://twitter.com/BashirAhmaad/status/1272941876136599559,2020-06-16 17:19:28+00:00
AreaFada1,Charly Boy Area Fada 1,"F..k Trump.

I think Trump is taking tutorials from Buhari on how to cause division in the country.
F..k any leader who uses tribalism, religiosity and Terrorism to divide his country, may they always endup in the dustbin of history.
Der fathers😡 https://t.co/LWvEPE6ZwI",14,3,https://twitter.com/AreaFada1/status/1268271809847230469,2020-06-03 20:02:17+00:00
bulamabukarti,Bulama Bukarti,"It’s a good war tactic to control the narrative, but it’s bad tactic to create too much expectation. Fighting terrorism is as much about managing popular expectations as it’s about real success on the ground.

Untrue or exaggerated claims undermine confidence in state troops.",81,24,https://twitter.com/bulamabukarti/status/1263399502557429760,2020-05-21 09:21:28+00:00
ShehuSani,Senator Shehu Sani,"Chad is becoming a regional power,it’s threatening to pull out of all multinational coalition against terrorism in West Africa;And it’s been begged not to.",3259,615,https://twitter.com/ShehuSani/status/1248967076280184832,2020-04-11 13:32:10+00:00
NGRPresident,Presidency Nigeria,"The President has also approved an Amnesty for 2,600 inmates in Custodial Centers across the federation. This presidential amnesty DOES NOT apply to inmates sentenced for terrorism, kidnapping, armed banditry, rape, human trafficking, culpable homicide and other violent offences.",257,152,https://twitter.com/NGRPresident/status/1248235343113072640,2020-04-09 13:04:31+00:00
AishaYesufu,Aisha Yesufu,Part of @BBOG_Nigeria citizens solutions to end terrorism is dedicated to the welfare of military https://t.co/vRwNjHbC9j,2,0,https://twitter.com/AishaYesufu/status/1245053943371235334,2020-03-31 18:22:46+00:00
bulamabukarti,Bulama Bukarti,"Foolishness is when an Iranian refugee ignores all the repression, incompetence &amp; state-sanctioned terrorism in his country to focus on Nigeria. 

Madness is when he thinks  he’s the one forcing @MBuhari to speak. Egocentrics are quick at claiming credit for a collective success.",698,320,https://twitter.com/bulamabukarti/status/1244267252603633664,2020-03-29 14:16:45+00:00
AishaYesufu,Aisha Yesufu,He should have stayed in the mosque since he said people should. This is also terrorism https://t.co/2FE1NdnRNw,21,10,https://twitter.com/AishaYesufu/status/1242616574009376769,2020-03-25 00:57:32+00:00
bulamabukarti,Bulama Bukarti,"Following reports that over 75 soldiers have killed by Boko Haram, @HQNigerianArmy just admitted on @bbchausa that 47 soldiers died. This is the highest number admitted by the Nigerian Army as far as I can recall. A sad reminder that COVID-19 shouldn’t detract us from terrorism.",249,135,https://twitter.com/bulamabukarti/status/1242545160837386241,2020-03-24 20:13:46+00:00
AishaYesufu,Aisha Yesufu,"@j_andre01 @gimbakakanda Stop indulging in biological terrorism! Don't allow the devil use you. 
Ask satan to get behind thee!",1,0,https://twitter.com/AishaYesufu/status/1241933293177786369,2020-03-23 03:42:25+00:00
PoliceNG,Nigeria Police Force,"of unnecessary arrests and detention of suspects are not condoned. He reiterates that detention of suspects must be reduced to the barest minimum and that only very serious cases such as terrorism, armed robbery, homicide and other non-bailable offences should warrant detention.",165,108,https://twitter.com/PoliceNG/status/1241770773330657280,2020-03-22 16:56:38+00:00
obyezeks,Oby Ezekwesili,"The @nassnigeria must act swiftly to wake up the Commander-in-Chief of Nigeria @MBuhari to provide the Constitutional leadership he swore to, especially when the country faces any kind of War.

NASS must quickly avert the extremely costly laxity of the Counter-Terrorism War. NOW!",105,55,https://twitter.com/obyezeks/status/1240904328166113283,2020-03-20 07:33:41+00:00
AishaYesufu,Aisha Yesufu,"This is what is expected of @PoliceNG . War against terrorism is not child's play that overnight success is expected. So when @PoliceNG comes up with propaganda such as ""250"" it loses support and credibility. 
The truth is very important and we can win this war
#KadunaIsBurning https://t.co/98zQwTytMo https://t.co/ozGbTyQ7HU",9,5,https://twitter.com/AishaYesufu/status/1226504171526008834,2020-02-09 13:52:36+00:00
PoliceNG,Nigeria Police Force,"support which have resulted in the measure of successes recorded so far particularly in the fight against terrorism, banditry and other heinous crimes in the country.",83,49,https://twitter.com/PoliceNG/status/1226473795155873792,2020-02-09 11:51:54+00:00
AishaYesufu,Aisha Yesufu,"They destroy the social cohesion needed for collective action and then express surprise that insurgencies, crimes &amp; terrorism result..fools!
#KadunaIsBurning https://t.co/BODUfoMQmS",77,66,https://twitter.com/AishaYesufu/status/1226466447972544514,2020-02-09 11:22:42+00:00
AishaYesufu,Aisha Yesufu,"SSS says Nigeria is winning the war against Terrorism, your Opinion Sir?”...I don't know. People are still dying...that is sad...
#KadunaIsBurning https://t.co/6Sj1QGi5uV",57,34,https://twitter.com/AishaYesufu/status/1226466345090506752,2020-02-09 11:22:17+00:00
AishaYesufu,Aisha Yesufu,"Terrorism and banditry?!
""....both are one and the same...enemies of state...
#KadunaIsBurning https://t.co/5CRWfHXPm0",11,8,https://twitter.com/AishaYesufu/status/1226466015208407040,2020-02-09 11:20:59+00:00
NGRPresident,Presidency Nigeria,"... countering terrorism and violent extremism, economic development, asset recovery and fight against corruption.",18,6,https://twitter.com/NGRPresident/status/1225533551959040000,2020-02-06 21:35:42+00:00
PoliceNG,Nigeria Police Force,"In the aftermath of the Police counter-terrorism operations which successfully neutralized the operational bases of the Ansaru Terrorists’ Group and bandits, one Haruna Basullube ‘m’ – one of the most wanted kidnappers/cattle rustlers in the country and ...",285,142,https://twitter.com/PoliceNG/status/1225456950730797061,2020-02-06 16:31:19+00:00
NGRPresident,Presidency Nigeria,"... to prevent crime in all its manifestations, be it corruption, theft, terrorism, banditry or kidnapping. 

Without citizen involvement, there is no miracle with which less than half-a-million policemen can effectively protect a population of 200 million.",37,17,https://twitter.com/NGRPresident/status/1225174159740805122,2020-02-05 21:47:36+00:00
PoliceNG,Nigeria Police Force,"The operation which commenced in the early hours of today, 5th February, 2020, was carried out by a combined team of operatives of Operation Puff Adder made up of the Police Mobile Force (PMF), Counter Terrorism Unit (CTU), Special Forces, Intelligence Response Team (IRT), ...",294,136,https://twitter.com/PoliceNG/status/1225118139740016644,2020-02-05 18:05:00+00:00
NGRPresident,Presidency Nigeria,"Tomorrow in Abuja @NigAirForce will induct into operation its newly-acquired Agusta 109E (M) Power Helicopters &amp; an Mi-171 E Combat Helicopter. The NAF has acquired more than 20 brand new aircraft since 2015, and is deploying them in the fight against banditry and terrorism. https://t.co/pUKdYILQ2b",601,256,https://twitter.com/NGRPresident/status/1225064207902826501,2020-02-05 14:30:42+00:00
NGRPresident,Presidency Nigeria,"Condemning the heinous attack by the terrorists, the Nigerian leader assured his Nigerien counterpart that Nigeria will continue to work closely with his country and other international partners to overcome terrorism and violent extremism.",31,15,https://twitter.com/NGRPresident/status/1216745732042035200,2020-01-13 15:36:03+00:00
AishaYesufu,Aisha Yesufu,"It should be killed.  Kwankwaso sanitised Kano with no almajiris or any type of beggars on the streets.
Let government even give them incentive to have the children in school. Like 2k per month for every child in school. 
Cheaper than arms buying to fight terrorism! https://t.co/zL6S0OrBiB",38,10,https://twitter.com/AishaYesufu/status/1214193114799321088,2020-01-06 14:32:51+00:00
AishaYesufu,Aisha Yesufu,Were are the sycophants that tell us US has been fighting terrorism for years when we talk about our boys at the warfront who are ill equipped to defeat the terrorists? https://t.co/rD0oHKwO3K,24,5,https://twitter.com/AishaYesufu/status/1212378294840176642,2020-01-01 14:21:25+00:00
