username,displayName,tweet,likes,retweets,link,date
AishaYesufu,Aisha Yesufu,How will the war against terrorism ever be won? https://t.co/vjJ0jj9mVC,44,19,https://twitter.com/AishaYesufu/status/1540242019876052992,2022-06-24 07:54:48+00:00
ShehuSani,Senator Shehu Sani,"The #AswanForum is a positive platform that should set a clear and implementable solutions for combating terrorism,extremism,Farmer-Herder Conflicts and climate issues in the continent. @DailyNewsEgypt @MfaEgypt @EgyIndependent @EgyptEmbassyUSA @EgyptianMedia 
@MOICEgypt",79,15,https://twitter.com/ShehuSani/status/1539959966383185921,2022-06-23 13:14:01+00:00
PoliceNG,Nigeria Police Force,"and proper conduct of the election in Ekiti State. The IGP further noted that the personnel, comprising conventional police officers, Police Mobile Force (PMF), Counter Terrorism Unit (CTU), Special Forces personnel, Explosives Ordinance Unit (EOD),...",6,1,https://twitter.com/PoliceNG/status/1535997728882405377,2022-06-12 14:49:30+00:00
AreaFada1,Charly Boy Area Fada 1,"Countries with very corrupt leadership suffer from terrorism the most.

Just think am.",100,26,https://twitter.com/AreaFada1/status/1534162009125793794,2022-06-07 13:15:00+00:00
dj_switchaholic,Dj Switch,"Look at this buffoon! With all the mobile information you have, NIN! All manners of terrorism is happening in the country and they require communication, what have you done about it? Oh I forgot… you are a terrorist yourself! I’m so livid! #ondo https://t.co/ia8vUAE64q",1308,584,https://twitter.com/dj_switchaholic/status/1533539464034848768,2022-06-05 20:01:14+00:00
AishaYesufu,Aisha Yesufu,"Crushing?!
This is evil! This is economic terrorism https://t.co/h5giVBEDlH",195,77,https://twitter.com/AishaYesufu/status/1533111274602733568,2022-06-04 15:39:46+00:00
AishaYesufu,Aisha Yesufu,"The United States of America need to do better on this!
Come on!
You cannot continue to allow children go through this as if it is normal!
This is terrorism also!
Imagine going to school and not know if that will be your last day. Then, Imagine you are 9 years!
For God's sake! https://t.co/7su31ZoUUs",43,14,https://twitter.com/AishaYesufu/status/1532737963624484866,2022-06-03 14:56:22+00:00
NGRPresident,Presidency Nigeria,"The report looked at persistent threats, evaluated current response mechanisms, and decided on the specific actions and measures necessary to strengthen the collective security of Member States facing terrorism and violent extremism.",12,1,https://twitter.com/NGRPresident/status/1531395712725958658,2022-05-30 22:02:44+00:00
NGRPresident,Presidency Nigeria,"The Report on the Prevention and Combating of Terrorism and Violent Extremism and on Unconstitutional Changes of Government in Africa was presented by the Chairperson of the African Union Commission, H.E. Moussa Faki Mahamat @AUC_MoussaFaki #PMBAtAU",8,0,https://twitter.com/NGRPresident/status/1531395625224372226,2022-05-30 22:02:23+00:00
NGRPresident,Presidency Nigeria,"— “Ensuring that specialized institutions like the African Centre for the Study and Research on Terrorism and AFRIPOL, are adequately resourced in order for them to effectively discharge their mandate.”",9,0,https://twitter.com/NGRPresident/status/1531394995894329345,2022-05-30 21:59:53+00:00
NGRPresident,Presidency Nigeria,"— “Increasing troop levels in situations of combating terrorism, and enhancing intelligence capabilities of deployed troops, including improving the operational cooperation of contingents in the operation areas;”",10,2,https://twitter.com/NGRPresident/status/1531394629572120583,2022-05-30 21:58:26+00:00
NGRPresident,Presidency Nigeria,"“In the West African region, we are working very hard through the instrumentality of @ecowas_cedeao to combat terrorism.” — President Buhari",12,2,https://twitter.com/NGRPresident/status/1531394053606100994,2022-05-30 21:56:08+00:00
NGRPresident,Presidency Nigeria,"Following the presentation of a report on Terrorism and Violent Extremism in Africa at the meeting, President @MBuhari highlighted four items on the recommendation for immediate action.",9,0,https://twitter.com/NGRPresident/status/1531393934437625856,2022-05-30 21:55:40+00:00
NGRPresident,Presidency Nigeria,"On Saturday May 28, the President attended and spoke at the 16th @_AfricanUnion Extra-ordinary Session of the Assembly of Heads of State and Government on Terrorism, Violent Extremism and Unconstitutional Change of Government. #PMBAtAU #PMBinMalabo https://t.co/TqjxE9snjv",17,3,https://twitter.com/NGRPresident/status/1531393714987442176,2022-05-30 21:54:48+00:00
NGRPresident,Presidency Nigeria,"The AU Chairman said the rising challenges of Climate Change, natural disasters and terrorism had made it mandatory to set up an Agency that would meet the needs of displaced Africans.",30,4,https://twitter.com/NGRPresident/status/1531389327552434176,2022-05-30 21:37:22+00:00
AishaYesufu,Aisha Yesufu,"You wonder why terrorism is  thriving!
What a country!
Until people face the consequences of these mob actions, they will not stop https://t.co/hYnw2oDhES",44,25,https://twitter.com/AishaYesufu/status/1531248846281531393,2022-05-30 12:19:08+00:00
AishaYesufu,Aisha Yesufu,"This News was broken on Sunday night but it was on Tuesday that many realised they share the same religion or ethnicity with the victims &amp; became outraged! If the religion or ethnicity was different, they wouldn't have been bothered!

This is what has entrenched terrorism in Nig https://t.co/UMDGTSG4sP",355,58,https://twitter.com/AishaYesufu/status/1529380285728669697,2022-05-25 08:34:09+00:00
AishaYesufu,Aisha Yesufu,Everyone of us should be worried and aghast with what is happening in the South East. Terrorism knows no boundaries. No region in Nigeria is safe!,691,162,https://twitter.com/AishaYesufu/status/1529376347575009280,2022-05-25 08:18:30+00:00
AishaYesufu,Aisha Yesufu,"The name might change but the act of terrorism remains the same.
They kill us while we label them based on religion and tribe https://t.co/my9bT6Z58M",48,16,https://twitter.com/AishaYesufu/status/1529369988779360256,2022-05-25 07:53:14+00:00
AishaYesufu,Aisha Yesufu,"God gave people freewill. You cannot take it away from them.
They have numbers to jump on the streets to kill people but not the numbers to demand government put a stop to terrorism https://t.co/Kp2ZRwobUN",173,63,https://twitter.com/AishaYesufu/status/1525505724629061637,2022-05-14 15:58:01+00:00
NGRPresident,Presidency Nigeria,"Pres @MBuhari today in Abuja signed into law 3 bills targeted at tackling money laundering &amp; terrorism financing in Nigeria
 
Money Laundering(Prevention &amp; Prohibition) Bill, 2022

Terrorism(Prevention &amp; Prohibition) Bill, 2022

Proceeds of Crime(Recovery &amp; Management) Bill, 2022 https://t.co/CfADEkc99k",133,57,https://twitter.com/NGRPresident/status/1524805404491976705,2022-05-12 17:35:12+00:00
NGRPresident,Presidency Nigeria,"… but the ongoing visit of the UN scribe clearly showed that “the world has not forgotten us.”

The President said terrorism remains a threat to global peace, security and progress, with many already killed, while millions had been displaced by the insurgents over many years.",7,3,https://twitter.com/NGRPresident/status/1522169759890030592,2022-05-05 11:02:05+00:00
NGRPresident,Presidency Nigeria,"President @MBuhari Wednesday in Abuja said Nigeria remains grateful to the United Nations @UN and some world leaders on their steadfast partnership in fighting terrorism, saying the spotlight on Russia and Ukraine could easily distract from other pertinent global challenges.",9,6,https://twitter.com/NGRPresident/status/1522169584647815169,2022-05-05 11:01:24+00:00
NGRPresident,Presidency Nigeria,"STATE HOUSE PRESS RELEASE

WE’RE HAPPY THE WORLD IS STILL WITH US IN FIGHTING TERRORISM, PRESIDENT BUHARI TELLS UN SCRIBE, ANTONIO GUTERRES @antonioguterres 

#thread  @UN https://t.co/aDtoWCGXOb",154,45,https://twitter.com/NGRPresident/status/1522169460597141506,2022-05-05 11:00:54+00:00
PoliceNG,Nigeria Police Force,"The Nigeria Police Force hereby declare wanted the following twelve (12) persons in connection with a case of conspiracy, murder, armed robbery, act of terrorism, kidnapping, cultism and unlawful possession of firearms, house breaking, burglary, malicious damage, and ...",29,21,https://twitter.com/PoliceNG/status/1517499012290695169,2022-04-22 13:42:12+00:00
NGRPresident,Presidency Nigeria,"President Buhari, speaking at the State House on Thursday April 21, 2022, on the ongoing fight against terrorism and banditry. Nigeria will triumph over all forms of insecurity, with the combined effort of security agents and local communities. https://t.co/yuRGWGr96R",419,104,https://twitter.com/NGRPresident/status/1517497919020146689,2022-04-22 13:37:52+00:00
BashirAhmaad,Bashir Ahmad,“This administration has invested more resources than any other to tackle insecurity. We’ve acquired advanced equipment for our armed forces &amp; the police to strengthen their capacity to confront terrorism &amp; banditry. We’ve made adequate budgetary allocations for security.” — PMB.,1568,278,https://twitter.com/BashirAhmaad/status/1517232078525546498,2022-04-21 20:01:30+00:00
ShehuSani,Senator Shehu Sani,"Donating weapons to Ukraine to fight invasion,Selling weapons to Africa to fight terrorism.",6415,1825,https://twitter.com/ShehuSani/status/1514931266612781058,2022-04-15 11:38:54+00:00
bulamabukarti,Bulama Bukarti,"A family source confirmed to me that N100m, in cash, was paid for the release of the MD of Bank of Agric. The crazy money terrorists are making in Nigeria! This problem will simply keep growing. Not only are there no consequences to terrorism, it also pays handsomely. It’s sad.",3034,1880,https://twitter.com/bulamabukarti/status/1511998620056367113,2022-04-07 09:25:37+00:00
PoliceNG,Nigeria Police Force,"assured that the skills and knowledge acquired will be put to good use in the collective fight against security threats, acts of terrorism and other criminal activities in the country.",17,6,https://twitter.com/PoliceNG/status/1511692662604193796,2022-04-06 13:09:51+00:00
PoliceNG,Nigeria Police Force,"In the course of the patrol, the IGP mapped out some salient and strategic points along the express which were immediately fortified with the deployment of operatives drawn from the Police Mobile Force (PMF), Counter Terrorism Unit (CTU), Special Forces (SF), ...",46,17,https://twitter.com/PoliceNG/status/1510262783128092676,2022-04-02 14:28:01+00:00
ShehuSani,Senator Shehu Sani,Terrorism anywhere is a threat to peace everywhere #HargeisaFire #Hargeisa,796,134,https://twitter.com/ShehuSani/status/1510174515870982146,2022-04-02 08:37:16+00:00
obyezeks,Oby Ezekwesili,"Citizens who had assumed that the worst possible was the many decades of being trapped in intergenerational poverty in an ironically “oil wealthy” are now exposed to deadlier acts of terrorism. 

Obiageli “Oby” Ezekwesili (2014)",37,6,https://twitter.com/obyezeks/status/1509516159162458112,2022-03-31 13:01:12+00:00
obyezeks,Oby Ezekwesili,"However, in the last one year with escalations in insecurity wherein we are now faced with more immediate life threatening scourge of terrorism within our land those two priorities are overtaken in ranking.
Obiageli “Oby” Ezekwesili (2014)",17,8,https://twitter.com/obyezeks/status/1509514213991014403,2022-03-31 12:53:28+00:00
PoliceNG,Nigeria Police Force,"The Summit scheduled to cover the entire law enforcement and policing value chain will provide participants the thought-leadership, direction, strategies and technologies required to augment public safety in the face of growing global security threats, including terrorism, ...",7,1,https://twitter.com/PoliceNG/status/1503783615783702530,2022-03-15 17:22:07+00:00
ShehuSani,Senator Shehu Sani,"Today,I paid a courtesy call to the HQ of The Hisbah in Kano;They explained to me on how they enforce the law on Alcohol,prostitution,indecent dressing,mannequins,pornography,settlement of marital disputes and AFRO…And I called on them to lead the battle against terrorism. https://t.co/p1du9csKk6",740,168,https://twitter.com/ShehuSani/status/1503465075360907277,2022-03-14 20:16:21+00:00
bulamabukarti,Bulama Bukarti,"This sad but insightful watch by @Abdulfagge highlights some of the root causes of banditry-turned-terrorism in North West Nigeria. A successful policy must use both security &amp; developmental approaches and the FG &amp; states must develop a consistent policy.
https://t.co/Oi404E0r6F",55,17,https://twitter.com/bulamabukarti/status/1500418049400315915,2022-03-06 10:28:34+00:00
NGRPresident,Presidency Nigeria,"30th Session of #StateHouseBriefing holding this morning Thur 24th Feb, 2022, 10am.
 
Featuring the Gov of Kaduna State @elrufai, on Internal Security and economic strides in the State, and the fight against banditry and terrorism in the NW.

Livestream: https://t.co/8tDySO6WK4",105,22,https://twitter.com/NGRPresident/status/1496774392759521283,2022-02-24 09:09:58+00:00
ShehuSani,Senator Shehu Sani,"The conscription of Children for terrorism is the same as the use of Children for counter terrorism.Volunteer groups,Hunters and vigilantes complementing the fight against terrorism must take notice of this.",293,48,https://twitter.com/ShehuSani/status/1496466981918228484,2022-02-23 12:48:26+00:00
NGRPresident,Presidency Nigeria,“Africa also looks up to Europe for enhanced support in the area of combating Illicit financial flows and terrorism funding that aid the activities of terrorists and violent extremist groups.” — President Buhari #EUAUSummit,25,6,https://twitter.com/NGRPresident/status/1495776856087437320,2022-02-21 15:06:07+00:00
ShehuSani,Senator Shehu Sani,"The report of the surrender of 104 Iswap fighters and their families in Damboa,Borno State is good news.However,they must be closely watched and guided based on some previous bitter experiences.The efforts of our military in the fight against terrorism is appreciated.",564,73,https://twitter.com/ShehuSani/status/1493113835712094210,2022-02-14 06:44:13+00:00
AishaYesufu,Aisha Yesufu,"There is an orchestrated campaign to paint #EndSars protesters as violent! The #EndSars protesters were victims of government terrorism. 
They know that many are angry at the killings by govt hence the campaign. 
Get your PVC and take the protest to the polling unit
#1For5PVC https://t.co/qk47S6gQD5",133,86,https://twitter.com/AishaYesufu/status/1490722345710931971,2022-02-07 16:21:18+00:00
AishaYesufu,Aisha Yesufu,#EndSars protesters are victims of government terrorism! https://t.co/ebjMASQQUA,125,74,https://twitter.com/AishaYesufu/status/1490720825309339652,2022-02-07 16:15:15+00:00
ShehuSani,Senator Shehu Sani,"The African Union should think of setting up our own defense pact like NATO to combat the spread of terrorism in the continent,and end the desperate culture of looking up to French Soldiers,American drones or Russian mercenaries. #AUSummit2022 #AUSummit",580,122,https://twitter.com/ShehuSani/status/1490597654614654976,2022-02-07 08:05:49+00:00
NGRPresident,Presidency Nigeria,"The PSC also ensures the implementation of key conventions and instruments to combat international terrorism; promote coordination between regional mechanisms and the AU with respect to peace, security and stability in Africa.",21,7,https://twitter.com/NGRPresident/status/1489977373726584833,2022-02-05 15:01:02+00:00
BashirAhmaad,Bashir Ahmad,"The UAE is one of our strong and strategic partners in the fight against terrorism, they issued statements condemning terror attacks in Nigeria in several occasions, this link https://t.co/UwTlprVCUo is one of such statements. Terror attacks have to be condemned everywhere. https://t.co/Iw7NTucC2v",94,17,https://twitter.com/BashirAhmaad/status/1483781562311319559,2022-01-19 12:41:06+00:00
AishaYesufu,Aisha Yesufu,"Buhari is not soft on terrorism. He is enabler of terrorism. 
His incompetence, failure, lack of political will and body language have given the terrorists enabling environment to thrive https://t.co/HOkm5wBvAC",37,20,https://twitter.com/AishaYesufu/status/1480186089784725509,2022-01-09 14:33:58+00:00
AishaYesufu,Aisha Yesufu,"Any vice that exist in Nigeria is because the government gains from it!
From cultism to terrorism!

If you want anything to be solved go after their political power https://t.co/K72gfzpzTH",213,121,https://twitter.com/AishaYesufu/status/1470681429961060357,2021-12-14 09:05:51+00:00
ShehuSani,Senator Shehu Sani,The 60th ordinary session of the Heads of Government of Ecowas going on in Abuja must strongly address the common problem of terrorism bedevilling West  Africa.The rise of terror groups &amp; their deadly attacks must be curtailed.,240,56,https://twitter.com/ShehuSani/status/1470150487215378439,2021-12-12 21:56:04+00:00
ShehuSani,Senator Shehu Sani,"N800 Billion supplementary budget and nothing for the immigration service?;How serious are we about trans border crimes ,human trafficking and the fight against terrorism?",225,58,https://twitter.com/ShehuSani/status/1466750188228427779,2021-12-03 12:44:30+00:00
bulamabukarti,Bulama Bukarti,"Finally the FG had applied and the Court has declared “bandits” as terrorists under the Terrorism Prevention Act. Let’s hope that the FG will now do the right thing. Unless and until we fight these repugnant monsters like the terrorists that they are, their horror will only grow.",292,115,https://twitter.com/bulamabukarti/status/1464633697198653442,2021-11-27 16:34:19+00:00
AishaYesufu,Aisha Yesufu,"Na mema gbawa lia alo!
Bloody nonsense.  Bunch of incompetent and failed people. Enablers of insurgency and terrorism.
They embolden the terrorists to keep attacking https://t.co/RZ4vGRsgUS",32,15,https://twitter.com/AishaYesufu/status/1462870185996660744,2021-11-22 19:46:45+00:00
ShehuSani,Senator Shehu Sani,The @ABlinken visit to Nigeria should focus on support for the ongoing war against terrorism and Human rights and the rule of law issues.,108,26,https://twitter.com/ShehuSani/status/1459976747491991566,2021-11-14 20:09:16+00:00
ShehuSani,Senator Shehu Sani,"It’s ten years since the killing of Muamar Ghadafi;Libya is now an epicentre of terrorism,drug trafficking,human trafficking,slave trading and arms https://t.co/uXb709POIB has been abandoned by those who promised to turn it to a paradise of freedom.A Lesson for other countries.",342,129,https://twitter.com/ShehuSani/status/1450720678542462977,2021-10-20 07:08:57+00:00
bulamabukarti,Bulama Bukarti,OBJ's Ambassador to the UN wrote in his 2007 letter that Yakubu Musa was arrested and prosecuted. OBJ should tell us whether Yakubu was convicted or acquitted or if and why his govt dropped the charges? OBJ must be one of those northern elites sponsoring/sympathetic to terrorism?,44,17,https://twitter.com/bulamabukarti/status/1448629968427175942,2021-10-14 12:41:13+00:00
ShehuSani,Senator Shehu Sani,Shutting down telecom have no serious impact in tackling or combating terrorism in Northern Nigeria.Their atrocities continue unabated while our people in the rural areas in distress are cut off from the rest of the World.The hoopla about sim registration is useless.,1351,607,https://twitter.com/ShehuSani/status/1443687648195907586,2021-09-30 21:22:12+00:00
RealSeunKuti,Seun Anikulapo Kuti,"“We are the solution!!!
Poverty, terrorism and tyranny are man-made problems that requires man-made solution. The people must come together to change the things we can no longer accept. You are the people, you are the solution” #MOP ✊🏿ALUTA

#JoinMOP https://t.co/wHH5YuIZ0Z",6,0,https://twitter.com/RealSeunKuti/status/1441277941816647680,2021-09-24 05:46:53+00:00
AishaYesufu,Aisha Yesufu,"This terrorism needs to be stopped.
Why is @PoliceNG nonchalant even when their own are killed?
These killers have to be stopped. 
When they are done with security agents, the people will be a walk in the park. https://t.co/WOFDUNFlgF",31,10,https://twitter.com/AishaYesufu/status/1440607981591089153,2021-09-22 09:24:42+00:00
ShehuSani,Senator Shehu Sani,"If the Nigerian Government can’t expose the sponsors of terrorism, then it can’t absolve itself from the horror  and tragedy our people experiences every day of their lives.",1816,696,https://twitter.com/ShehuSani/status/1440240462338551819,2021-09-21 09:04:19+00:00
ShehuSani,Senator Shehu Sani,"The UAE has no terrorism issues,but they wasted no time in directly and openly naming the alleged culprits in terror https://t.co/UYcOIh4AEq we are,a country where tens of thousands are slaughtered and counting.",186,62,https://twitter.com/ShehuSani/status/1437806434742267904,2021-09-14 15:52:21+00:00
obyezeks,Oby Ezekwesili,"When I next returned to the US on a visit six months after #September11 , our world and specifically the country, one once knew had changed completely.

Our world changed radically, 20 years ago.

The fight against terrorism should be for all who hate evil.
Let there be 💡💡!🙏🏾✍🏾",18,1,https://twitter.com/obyezeks/status/1436737544989855745,2021-09-11 17:04:58+00:00
ShehuSani,Senator Shehu Sani,A prayer for victory in the battle against terrorism and banditry. https://t.co/mwZInzYD9A,382,131,https://twitter.com/ShehuSani/status/1436257973542670339,2021-09-10 09:19:19+00:00
ShehuSani,Senator Shehu Sani,"The FG directive to Telecos to shutdown network services in Zamfara state in order to enable it tackle terrorism is one step out of so many previous ones;Banning mining,banning motorcycles,shutting down schools &amp; markets.Anything practicable that can end terror is welcome.",488,106,https://twitter.com/ShehuSani/status/1434083893330669571,2021-09-04 09:20:18+00:00
AishaYesufu,Aisha Yesufu,"Louder please!
Those type of people are enablers of the terrorism. They are silent supporters. https://t.co/e3MvFo3VhU",90,25,https://twitter.com/AishaYesufu/status/1431638543886163969,2021-08-28 15:23:22+00:00
ShehuSani,Senator Shehu Sani,The terror attacks at the Kabul Airport is condemnable;terrorism in any part of the globe is a threat to peace in every corner of the https://t.co/Kv4JUGZ05W thoughts and prayers to the victims and their families. #AfghanistanBurning #Afghan #AfghanistanCrisis,108,19,https://twitter.com/ShehuSani/status/1430994415951257600,2021-08-26 20:43:50+00:00
AishaYesufu,Aisha Yesufu,"This was Muhammadu Buhari at Chatham House talking about what should be done to fight the terrorism in our country. 
There are many people who only chose Buhari because of his credentials to fight the terrorism.
The terrorists are the ones who got better, for them &amp; worse for us! https://t.co/uXyifgXvvr",303,218,https://twitter.com/AishaYesufu/status/1430546872226177024,2021-08-25 15:05:27+00:00
AishaYesufu,Aisha Yesufu,"Whenever a Nigerian soldier is killed by civilians, the military usually raze down the towns it happened. They have committed lots of these human rights abuses.
 Why are they not doing same to terrorists?
Why is there no political and military will to fight terrorism in Nigeria?",4622,2492,https://twitter.com/AishaYesufu/status/1430273575601197059,2021-08-24 20:59:28+00:00
AishaYesufu,Aisha Yesufu,"I see PDP sycophants foaming in the mouth again. Gosh!
There is no difference between APC and PDP. Both are pathetic failures! Their defenders are the same.
For those of you that are now outraged at the position of Nigeria on the global terrorism index, Nigeria was SECOND in 2014 https://t.co/CxLgAzcMHP",84,52,https://twitter.com/AishaYesufu/status/1427657865544744964,2021-08-17 15:45:34+00:00
AishaYesufu,Aisha Yesufu,"Why the surprise that Nigeria is number 3 on the Global terrorism index? We have been number 3 since 2015. We were number 4 in 2012 and number 2 in 2014.
2010 11th
2011 6th
2012 4th
2013 4th
2014 2nd
2015 3rd
2016 3rd
2017 3rd
2018 3rd
2019 3rd 
https://t.co/evhgwy5GcN https://t.co/3T4TA03HA3",22,21,https://twitter.com/AishaYesufu/status/1427611453020938240,2021-08-17 12:41:08+00:00
ShehuSani,Senator Shehu Sani,The President is wrong;Infrastructure alone can’t defeat terrorism;our neighbors have no railways and no terrorism.There is no excuse;provide effective leadership and lead our security forces to protect our people from killings and kidnappings.,564,143,https://twitter.com/ShehuSani/status/1427243381944721416,2021-08-16 12:18:33+00:00
ShehuSani,Senator Shehu Sani,The only the victims of terrorism can forgive the atrocities of terrorists.,199,32,https://twitter.com/ShehuSani/status/1425109263698042881,2021-08-10 14:58:20+00:00
bulamabukarti,Bulama Bukarti,"Zamfara is the state worst hit by bandits' terrorism. A month ago, its Governor left PDP for APC, while his deputy stayed in PDP. Since then, the State Assembly has made impeaching the deputy their Number 1 priority. The lives and property of their constituents? Who gives a damn?",696,487,https://twitter.com/bulamabukarti/status/1422511311116718081,2021-08-03 10:55:00+00:00
ShehuSani,Senator Shehu Sani,Visa sanctions is the best step in tackling public officials involved in Human Rights abuses or Rigging elections.Its wrong for the US to deny Nigeria the sale of  weapons crucial to the prosecution of the war against terrorism.Terrorism anywhere is terrorism everywhere.,1427,340,https://twitter.com/ShehuSani/status/1420657381147619331,2021-07-29 08:08:08+00:00
bulamabukarti,Bulama Bukarti,"In this op-ed for @Newsweek accompanying my new report on BH, I argue, 
“ISIS has transformed into a ""gig terrorism"" platform, bringing together groups with a similar ideology and objective, but completely different—even contradictory—modes of operation.”
https://t.co/QkY64bYDe0",30,20,https://twitter.com/bulamabukarti/status/1419593158183329794,2021-07-26 09:39:18+00:00
