title,link,channelId,date
Constitutional Law - Rule of Law,https://www.youtube.com/watch?v=lBJxx34uLuw,UCCyS1rOQP8eLHHkUDe6HjmA,2014-10-09T13:24:31Z
What is the Rule of Law?,https://www.youtube.com/watch?v=4x5Vp4QxacA,UCTNeieRhDNtWzRzQ_VTpmgg,2022-03-28T10:33:40Z
What is the rule of law?,https://www.youtube.com/watch?v=0R20U9zkMmg,UCjvqGEonBVoTzU8hiHKgH1w,2018-11-15T22:49:52Z
Rule Of Law | Administrative Law,https://www.youtube.com/watch?v=-camJ76UwQU,UCCqF9iufwFlwU2EGXNwi2GQ,2021-02-19T17:02:15Z
What is the Rule of Law?,https://www.youtube.com/watch?v=IZDd2v18vfw,UCgeE37huZNRgR12eA0RGhXw,2012-03-01T18:25:58Z
Rule of Law,https://www.youtube.com/watch?v=cXC5lUx0uAU,UCzqAxqTTJLI1Fdc9_tMjjwQ,2016-04-25T21:59:02Z
9 - Introduction to the Rule of Law,https://www.youtube.com/watch?v=pBh7b3JoMZE,UCJiq-hQijemX8B7oRifPIZw,2016-07-26T01:18:21Z
Rule of Law | Government |,https://www.youtube.com/watch?v=RkV-DaghHog,UCH2ONb1eLgZ76FvtGuLJDnA,2020-04-21T15:30:28Z
What does the rule of law have to do with me?,https://www.youtube.com/watch?v=aVhb5ltMHC4,UCkD7gm3Am3M3k156lk46t3A,2020-05-05T10:05:52Z
"Rule of Law, Types of Law and Sources of Law",https://www.youtube.com/watch?v=ZI_7rt9cLnQ,UCF6P4oCJGjk7-qgcoueYWZw,2016-02-10T14:05:35Z
Constitutional Principles: The Rule of Law,https://www.youtube.com/watch?v=q0MTEm2a7PA,UCEaVYnwbWa6Jzu1xfqk3RQg,2011-12-13T13:28:37Z
2019 Rule of Law Lecture,https://www.youtube.com/watch?v=ooZU3FLGyPw,UCz5BHX30rRXnabsVWy0trZQ,2019-07-04T18:57:24Z
Judiciary and the rule of law,https://www.youtube.com/watch?v=hh5pIZtv1gw,UCi3XytDJY8a3I9_vL7A_5SQ,2018-11-19T10:55:24Z
Video 1 - The Rule of Law,https://www.youtube.com/watch?v=0Hubr8mZlIc,UCqBENFkPqJaIra7OQjMXA1A,2012-02-08T00:45:26Z
Civic  Education.  The Rule Of Law.  Js2,https://www.youtube.com/watch?v=nE6Gh2BTE2Q,UCdnoBQd7MV1DGOS4g3ko7ag,2021-05-27T06:55:48Z
Lord Bingham - The Rule of Law,https://www.youtube.com/watch?v=XlMCCGD2TeM,UCvhsiQGy_zcNCiSbeXEjhLg,2010-03-10T11:52:43Z
Rule of Law | Administration Law,https://www.youtube.com/watch?v=uxlXGPBfMTU,UCECGLK59w2Zs1e-Uax0tFTw,2019-08-12T18:09:51Z
COURT JUDGEMENTS AND THE RULE OF LAW,https://www.youtube.com/watch?v=6PMSNC2EQLY,UCyEJX-kSj0kOOCS7Qlq2G7g,2022-03-11T07:18:23Z
"Constitutions, Institutions, and the Rule of Law",https://www.youtube.com/watch?v=JpzxP4jXEWI,UCGwuxdEeCf0TIA2RbPOj-8g,2012-05-24T22:00:48Z
Separation of Power and Rule of Law in India | Administrative Law,https://www.youtube.com/watch?v=Tjdxq59fOFA,UCItJsxqZNWUyxFn-A2tzizQ,2018-10-02T13:48:23Z
Hart - Concept of Law - Ch 6 (The Rule of Recognition),https://www.youtube.com/watch?v=4qtSYUccppc,UC_hukbByJP7OZ3Xm2tszacQ,2020-07-22T00:00:09Z
Court Shorts: Rule of Law,https://www.youtube.com/watch?v=bmAKAHDSnGs,UCIcgGfaeUGYJSo7bLeUr1hw,2019-08-08T11:24:50Z
The Rule of Law: what is it and why is it important?,https://www.youtube.com/watch?v=lXS0SrGmTX0,UCSrZ3UV4jOidv8ppoVuvW9Q,2020-09-30T09:43:07Z
Rule of Law- Part I ( Basic concepts and Dicey&#39;s concept regarding Rule of law),https://www.youtube.com/watch?v=20_1HiQ8K2U,UCyeEMc9PJMmChWND_7PGfMA,2020-03-27T14:25:11Z
DJ Slim   Rule of Law Prod  by Denswag,https://www.youtube.com/watch?v=Y--KtjPRUi8,UCCFWf38WgQaiSRSOSDVPeBA,2022-03-20T22:22:01Z
What is the Rule of Law?,https://www.youtube.com/watch?v=xUHCXq3AkE4,UC2FTDAHHpJ3EUa0vehijiyA,2016-01-12T14:28:14Z
Doha Declaration Rule of Law Conversations: Ep1 - The Rule of Law: a Pillar of Democracy,https://www.youtube.com/watch?v=_mYRCslq_ao,UCDlPLsjr5DYxtZKAfx4HlzQ,2021-02-18T12:33:36Z
The Rule of Law | Hindi Dubbed Crime Thriller Movie | Hollywood Movie in Hindi,https://www.youtube.com/watch?v=xuHT6fF-axo,UCxRHCJmW5aieWEqnW6O8yWw,2021-04-05T14:30:04Z
Rule of Law - JSS3 Civic,https://www.youtube.com/watch?v=mlPn49qgq4Y,UCpJ4o0eh8YUzwbRP4UXjv-A,2020-06-23T12:00:32Z
The EU&#39;s Rule of Law Approach Explained,https://www.youtube.com/watch?v=9gWhDd49weI,UCDCgvwyjJqZWYs6j0D2FF6g,2020-11-03T11:05:56Z
Fundamental British Values - The Rule of Law,https://www.youtube.com/watch?v=KiajFTMeWUc,UCcFJQRH-xnGCUztfE4ToAnw,2018-12-03T22:17:17Z
THE RULE OF LAW - The 3 principles by AV Dicey,https://www.youtube.com/watch?v=MHPE_UG4K6w,UCmCRiOAZ9BBF0wv1T6j8vJA,2020-05-25T07:02:59Z
Kimberley Motley: How I defend the rule of law | TED,https://www.youtube.com/watch?v=Td2hfdXQ5x8,UCAuUUnT6oDeKwE6v1NGQxug,2014-10-27T16:09:53Z
The Rule of Law Latest Blockbuster Hit Crime Thriller Movie || Full HD Hindi Dubbed Movie,https://www.youtube.com/watch?v=k-jUxi0ZT_I,UCxRHCJmW5aieWEqnW6O8yWw,2022-01-10T13:06:12Z
Magna Carta: The Foundation of the rule of law,https://www.youtube.com/watch?v=XuPRCV1RtZM,UCqBENFkPqJaIra7OQjMXA1A,2021-06-14T10:04:51Z
Government - THE RULE OF LAW by Helen Chukwuelue,https://www.youtube.com/watch?v=T4IaQWvg3j8,UCBv5VpN9fEuImw80HflHlIA,2020-06-22T08:12:03Z
Rule of Law | Dicey&#39;s criticism | Lecture 3 | philosophy of Law | LLB PART 1 | Histrub,https://www.youtube.com/watch?v=OsqJsbA7yIY,UC2dpXTfcE5FvfYWVQU2daqg,2021-03-04T15:59:51Z
What You Don&#39;t Know About The Rule of Law in Nigeria,https://www.youtube.com/watch?v=Drua6XP7UpY,UCkY5L8JYwx7BT0cOXYZX_dw,2019-05-29T16:30:00Z
Politics| Entrenching the Rule of Law in Nigeria,https://www.youtube.com/watch?v=dwXpZLXc-Rg,UCIe7-0BMSpE-jttc-80O63Q,2021-10-23T10:21:50Z
Who will protect the Rule of Law? | Ian Holloway | TEDxCalgarySalon,https://www.youtube.com/watch?v=9b_t58eE2aQ,UCsT0YIqwnpJCM-mx7-gSA4Q,2018-08-14T18:30:18Z
"Security, Human Rights, and Rule of Law | Nigeria’s Democracy at 20",https://www.youtube.com/watch?v=l0PWIAjM2ac,UCCrMEGn7KUTpjN8ZP15TWNw,2019-10-23T17:59:01Z
What is the rule of law and why does it matter?,https://www.youtube.com/watch?v=Cu3hjLyTI88,UCYM_yPIyhn05Eo80AnsndXg,2017-02-22T15:19:44Z
The Rule of Law,https://www.youtube.com/watch?v=z2O0yp-xijc,UCK08_B5SZwoEUk2hDPMOijQ,2012-06-20T14:49:49Z
Q&amp;As on the Rule of Law and Judicial Independence,https://www.youtube.com/watch?v=EGix3p4OFMk,UCRM1xpu2UzPvR4AuB3y15hQ,2021-03-12T11:58:11Z
Lord Bingham and Shami Chakrabarti - The Rule of Law,https://www.youtube.com/watch?v=R-ZRN42zxQY,UCvhsiQGy_zcNCiSbeXEjhLg,2010-02-15T16:20:48Z
"Group urges police compliance, respect of rule of law",https://www.youtube.com/watch?v=npzd7tOULuc,UCBzu4YqGiBxBD8pq8NiBuKw,2019-09-20T19:18:51Z
Rule  of Law  || Constitution Law || LL.B III || CSS/PMS,https://www.youtube.com/watch?v=zkhzzUVIrlo,UCeD7VeZP4MUrFkHgHcqJJtw,2021-11-09T20:43:03Z
"7. The Mixed Regime and the Rule of Law: Aristotle&#39;s Politics, I, III",https://www.youtube.com/watch?v=fy8lwIYCTMA,UC4EY_qnSeAP1xGsh61eOoJA,2008-09-22T05:32:47Z
The Rule of Law,https://www.youtube.com/watch?v=XAJVu9LK7WE,UCFJNcE0iHj7P6dhp5iCZRLg,2011-02-18T03:09:46Z
Environmental Rule of Law,https://www.youtube.com/watch?v=GEooDx4tDv0,UC9V3x9HelwEk3Z6EknB_1Cg,2014-06-16T10:26:20Z
"Former Justice Minister, Agabi Advocates Respect For Rule Of Law",https://www.youtube.com/watch?v=yxcaFMDPPzI,UCEXGDNclvmg6RW0vipJYsTQ,2021-08-30T17:49:25Z
"Where Exactly Is The Rule Of Law, Analyst Ask FG",https://www.youtube.com/watch?v=iBLAizyFX18,UCEXGDNclvmg6RW0vipJYsTQ,2019-09-29T17:42:11Z
Making A New China Ep. 17: The Rule of Law,https://www.youtube.com/watch?v=5f4nXxb7zo4,UCgrNz-aDmcr2uuto8_DL2jg,2021-07-25T06:16:54Z
Why The Rule of Law Matters,https://www.youtube.com/watch?v=7_HjJLc5OKA,UCCjRJcrVZ-i1D3P0uwizXvQ,2019-05-01T14:51:37Z
Democracy &amp; Rule of Law: Electoral act amendment; Buhari vs NASS,https://www.youtube.com/watch?v=GnYKJquO8Xk,UCEXjRWW0shCg0MHj8kI7oEQ,2018-03-20T10:55:20Z
"Rule of Law, Peace and Security (Short clip)",https://www.youtube.com/watch?v=6oisXL4yJu8,UC5O114-PQNYkurlTg6hekZw,2014-02-18T20:15:38Z
"Rule Of Law | Meaning, Dicey&#39;s Concept, Criticisms &amp; Merits | Administrative Law | In Hindi",https://www.youtube.com/watch?v=PhZdVA2OWbM,UCMP2_6OEaa696VFkSZg3iuQ,2021-02-18T02:30:04Z
Judicial Independence and The Rule of Law - Judges in Canada,https://www.youtube.com/watch?v=b0K69brkmqA,UCmZ-ODLaJDDQjXmqWLKuu_Q,2019-01-08T18:56:39Z
Civil Society Advocacy to support Anti-Corruption and Rule of Law in Nigeria,https://www.youtube.com/watch?v=czTJMVgaI5g,UCzuiQaDS-LR2Qr3QYcj730w,2021-04-28T19:18:29Z
Rule of Law Series - Part 1 - Defining the Rule of Law,https://www.youtube.com/watch?v=XFd97kQmwUM,UCqBENFkPqJaIra7OQjMXA1A,2012-10-22T04:26:32Z
"Falana Carpets Buhari Regime Over Rule of Law, Federal Character At NBA-SPIDEL Town Hall",https://www.youtube.com/watch?v=acFtga1aAJM,UCKnyVIW5QvfnsXddsjFKx4A,2022-02-28T21:20:31Z
President Buhari&#39;s War On Corruption Is In Line With Rule Of Law - APC,https://www.youtube.com/watch?v=bQ6NGmub7V0,UCLLWAXn5F415g2kNAcE_T1g,2016-10-11T09:50:06Z
Rule of Law Champion Damaris Akhigbe,https://www.youtube.com/watch?v=e53mxXyWde0,UCDlPLsjr5DYxtZKAfx4HlzQ,2020-04-23T09:01:43Z
Reagan for the Rule of Law,https://www.youtube.com/watch?v=-JMZ2Ghz8nU,UC4E4Nv5ues3BNPjcDNxStmA,2018-04-10T19:55:17Z
Implementation of environmental Rule of Law,https://www.youtube.com/watch?v=TPxBXTo5LLw,UC9V3x9HelwEk3Z6EknB_1Cg,2014-06-16T10:28:52Z
UCL Laws: The Rule of Law and Human Rights in our Time - The role of academia,https://www.youtube.com/watch?v=66g5P-3b4FE,UCQdVcNt0EUJWvlh3XUYYTLQ,2018-06-28T15:27:17Z
No Effective Rule Of Law Without Financial Autonomy- Okowa.,https://www.youtube.com/watch?v=vXMTlPxgMuo,UCe9QK3lG1UWvin-W94YkEBA,2022-07-05T18:20:50Z
"Breakout: China’s rule by law, not rule of law",https://www.youtube.com/watch?v=PazsRXSrb_M,UChqUTb7kYRX8-EiaN3XFrSQ,2021-08-05T12:38:22Z
Gov. Obaseki assures on promoting Rule of Law,https://www.youtube.com/watch?v=vWFfjdekDJQ,UCzuiQaDS-LR2Qr3QYcj730w,2020-11-27T18:39:43Z
Hong Kong protestors &#39;trampled the rule of law&#39; - News Review,https://www.youtube.com/watch?v=53oPXwEA4os,UCHaHD477h-FeBbVh9Sh7syA,2019-07-02T14:45:00Z
How Does the Structure of the Constitution Uphold the Rule of Law? [No. 86],https://www.youtube.com/watch?v=ecoXXBtSIlE,UCMk8U2Hmfdxqn3zrCq2g9oQ,2020-10-16T18:07:46Z
Vote for the Rule of Law.,https://www.youtube.com/watch?v=d22Y7p3tER0,UCpa-Zb0ZcQjTCPP1Dx_1M8Q,2020-10-24T17:23:34Z
"8. The Mixed Regime and the Rule of Law: Aristotle&#39;s Politics, IV",https://www.youtube.com/watch?v=f7qCDVkrbWk,UC4EY_qnSeAP1xGsh61eOoJA,2008-09-23T15:47:09Z
"DSS, Democracy And The Rule of Law - Bayo Akinlade",https://www.youtube.com/watch?v=9lHbKMCHow4,UCKnyVIW5QvfnsXddsjFKx4A,2019-11-25T08:06:55Z
DJ Slim replies Jay Bahd with Hot BARS and Advice! || Rule Of Law,https://www.youtube.com/watch?v=GqoS7pha__Y,UCilq1Aw-ADaw4xD_mzqjQ1Q,2022-03-22T11:36:20Z
Lawyer Analyses Issues Of Rule Of Law And Democracy,https://www.youtube.com/watch?v=eikLYMupXc8,UCEXGDNclvmg6RW0vipJYsTQ,2019-08-28T16:03:31Z
The rule of law in the GATT/WTO,https://www.youtube.com/watch?v=g3jJw98BXGs,UCS3LJf8IInqTB0fjJeZpSFw,2016-04-15T14:55:11Z
"Jungle Justice: Disregard for rule of law, human rights on the rise",https://www.youtube.com/watch?v=P8F-VawrmfE,UCgp4A6I8LCWrhUzn-5SbKvA,2020-03-10T10:30:47Z
The Rule of Law at Sea,https://www.youtube.com/watch?v=0uX9KV0FPfI,UCooFm-JPL0IcKDk1g3B2Zow,2016-03-07T07:03:35Z
Nigeria and the Rule of Law,https://www.youtube.com/watch?v=ebccqtrmU7k,UCgp4A6I8LCWrhUzn-5SbKvA,2019-10-03T15:58:30Z
AU calls on Zimbabwean government to uphold the rule of law and respect human rights,https://www.youtube.com/watch?v=87lXn3ez-js,UC8yH-uI81UUtEMDsowQyx1g,2020-08-11T18:44:51Z
Okorocha&#39;s Family Insists On Rule Of Law Over Alleged Corruption,https://www.youtube.com/watch?v=OI54HFlhGQI,UCEXGDNclvmg6RW0vipJYsTQ,2022-05-25T20:54:28Z
"Obey Court Order, Rule Of Law - Ajulo, Sani Tell DSS",https://www.youtube.com/watch?v=ky_p5GVetKc,UCEXGDNclvmg6RW0vipJYsTQ,2019-09-27T20:31:44Z
Rule of Law not just about disobedience to court orders - Fola Arthur-Worrey,https://www.youtube.com/watch?v=NH5OYw-gg2s,UCyEJX-kSj0kOOCS7Qlq2G7g,2019-10-10T17:30:17Z
Law. Order. Peace: UN Peacekeeping and Rule of Law,https://www.youtube.com/watch?v=oAHST5m1F54,UC5O114-PQNYkurlTg6hekZw,2011-05-26T16:35:13Z
"Professor Timothy Endicott, &quot;Interpretation and the Rule of Law&quot;",https://www.youtube.com/watch?v=fcX7-dxjaf8,UCY8jDqi-AsmocBDcDs0ltfw,2014-04-15T12:53:16Z
Defending Rule of Law Norms: A Conversation with Rod Rosenstein,https://www.youtube.com/watch?v=aSbV8AXFzsw,UCr5jq6MC_VCe1c5ciIZtk_w,2019-02-25T18:37:53Z
Civic Education.  Protection Of  Human Rights And The Rule Of Law.,https://www.youtube.com/watch?v=0CTi5CleKo4,UCdnoBQd7MV1DGOS4g3ko7ag,2021-07-25T11:07:00Z
Lawyer Cautions Political Gladiators In Rivers To Obey Rule of Law - Part 1,https://www.youtube.com/watch?v=pb_oJeCpRHA,UCEXGDNclvmg6RW0vipJYsTQ,2013-07-15T09:01:18Z
SMART DELTA ON RULE OF LAW EPISODE 21,https://www.youtube.com/watch?v=peaQC0hn1Ec,UC-EG7tth7NiPHPrViB0mO_Q,2018-07-05T12:58:46Z
L3: Rule of Law and Equality | Important Topics of Polity (UPSC CSE) | Sidharth Arora,https://www.youtube.com/watch?v=J44cgPNK3P8,UCABe2FgVNv2hgBeMu2mySVg,2019-06-17T07:28:14Z
Difference in Rule of Law and Rule by Law explained - Madhya Pradesh Judicial Service Exam MPJSE,https://www.youtube.com/watch?v=hwfRKSf4H6E,UCrC8mOqJQpoB7NuIMKIS6rQ,2021-05-27T11:00:14Z
RULE OF LAW,https://www.youtube.com/watch?v=VkZoGZSumUE,UCmf9exDlptdEVHIJehtPT4w,2020-05-22T20:51:08Z
Virtual Law Day Out Series: The Importance of the Rule of Law in Australia: Judge Culver,https://www.youtube.com/watch?v=NGSMXp4VIgs,UCqBENFkPqJaIra7OQjMXA1A,2020-09-08T02:29:38Z
"Focus On Buhari&#39;s Address, Governance And The Rule Of Law Pt.3 |Politics Today|",https://www.youtube.com/watch?v=PXuza23d_S0,UCEXGDNclvmg6RW0vipJYsTQ,2017-08-22T19:22:43Z
What is Rule of Law ? - Umar Riaz,https://www.youtube.com/watch?v=N5Zls20qJwQ,UCax_VEGBdTDycnMdvs8ggrw,2020-06-22T14:17:02Z
Talk Time - Rule of Law in Nigeria.,https://www.youtube.com/watch?v=v_PNtYz87Ys,UCUyaTH0R5YOHrJENYNUw-Ug,2019-10-14T11:46:25Z
Unfair Advantages: How Licenses &amp; Waivers Threaten The Rule of Law | Intellections,https://www.youtube.com/watch?v=_J_BuzH2IY4,UCFKrfZXPHx5URnspnfM8lpQ,2019-02-28T20:01:02Z
Lawyers Disagree Over Buhari&#39;s Position On Rule Of Law And National Security Pt.2 |Sunrise|,https://www.youtube.com/watch?v=q-NThTDtlVA,UCEXGDNclvmg6RW0vipJYsTQ,2018-09-01T15:18:31Z
Questions about the rule of law (Summary),https://www.youtube.com/watch?v=oumcL2oz59g,UCMPaviJxybo1RTdzvYcU91A,2020-08-24T08:21:38Z
Zuma&#39;s sentence is a triumph for the rule of law: Expert,https://www.youtube.com/watch?v=Hgnau0R5n0s,UC8yH-uI81UUtEMDsowQyx1g,2021-07-01T18:01:57Z
MATERI KULIAH KEWARGANEGARAAN; RULE OF LAW,https://www.youtube.com/watch?v=XVv2QGPEa8g,UCSyBynGnaU_2ImV38ePQGjQ,2020-04-27T18:41:32Z
"China’s Future : Democracy or Dictatorship, Rule of Law or Rule by Law?",https://www.youtube.com/watch?v=jbPvRvBbtqE,UC-ImDz1aCgVBaT1Y971Ae-Q,2019-12-17T14:06:56Z
Nigerians Request That The Rule Of Law Be Upheld,https://www.youtube.com/watch?v=vOrby3zUC84,UCKnyVIW5QvfnsXddsjFKx4A,2019-12-24T05:17:33Z
Dissecting Buhari&#39;s Comment On The Rule Of Law Pt.2 |Hard Copy|,https://www.youtube.com/watch?v=oa9UON0zTlI,UCEXGDNclvmg6RW0vipJYsTQ,2018-09-07T21:08:25Z
Rule Of Law,https://www.youtube.com/watch?v=81stEu64uSc,UCmwJ-zF-Dr0ywNPbXBRq3gg,2019-07-24T20:17:41Z
Examining Biafra Agitations And Rule Of Law Pt.2 |Politics Today|,https://www.youtube.com/watch?v=ZHEHZqdX5cU,UCEXGDNclvmg6RW0vipJYsTQ,2017-09-13T19:07:52Z
Amnesty International charges FG to adhere to rule of law,https://www.youtube.com/watch?v=KrP1O1NKhRE,UCBzu4YqGiBxBD8pq8NiBuKw,2019-12-10T18:55:38Z
Open Access  04-11-19 - Rule of Law In Nigeria,https://www.youtube.com/watch?v=rSuT_yGisyY,UCUyaTH0R5YOHrJENYNUw-Ug,2019-11-04T16:03:49Z
MEANING AND FEATURES OF RULE OF LAW | CIVIC EDUCATION | SS3,https://www.youtube.com/watch?v=YcjaY_9O71E,UC_BnnokJom1DWipMl0oSxWA,2022-02-27T18:00:04Z
The Rule of Law and the Deepening of Democracy in Nigeria: 20-03-2022,https://www.youtube.com/watch?v=ufeW43M_oi4,UCiMBkl86i_JKyEX2s6lpuZg,2022-03-20T18:57:18Z
#DiceysRule What is Prof. Dicey&#39;s Rule of Law in Hindi? डायसी का विधि का शासन क्या है?#ruleoflaw,https://www.youtube.com/watch?v=bQfeUA__NIQ,UCtUEgX4g_FtxfWhEaCuO7Jw,2018-11-14T06:41:15Z
The Code of Hammurabi &amp; the Rule of Law: Why Written Law Matters [No. 86],https://www.youtube.com/watch?v=_rC5V5vEprs,UCMk8U2Hmfdxqn3zrCq2g9oQ,2019-06-18T18:57:04Z
Civic Education (Rule of Law) for JSS 2,https://www.youtube.com/watch?v=SsaatUhFGuM,UCIMKVQw_8IruFdQHxBiS48Q,2020-06-25T23:52:47Z
PROMOTING THE RULE OF LAW IN NIGERIA,https://www.youtube.com/watch?v=ndWsLJIulgI,UCyEJX-kSj0kOOCS7Qlq2G7g,2022-07-16T09:34:48Z
Advancing the Rule of Law at LexisNexis,https://www.youtube.com/watch?v=9e95IMoKSXw,UCUOqv8P9qavq5NpFix3UHIg,2016-08-23T18:30:45Z
The Rule of Law in Public Service,https://www.youtube.com/watch?v=Bwj5M1GNJNc,UCl9CUCvOPotOcl9ZZEzPZsA,2018-03-24T19:00:01Z
"Judges, prosecutors and the rule of law",https://www.youtube.com/watch?v=g8LI8N-IkSc,UCubFTvPe-ScfgiM6Zmtp5vg,2019-02-15T14:10:47Z
The British Values - Rule of Law (4/4),https://www.youtube.com/watch?v=nAyj_cwCdsA,UCPPQoQ0GHCn-l6TZpnSBVUw,2019-12-03T17:14:57Z
Live: Officials brief on China&#39;s historic achievements in the rule of law in the new era,https://www.youtube.com/watch?v=K4Y8o3T6f0c,UCgrNz-aDmcr2uuto8_DL2jg,2022-07-28T08:21:14Z
Democracy and Rule of Law 27th Dec 2020,https://www.youtube.com/watch?v=K7g7Fc8snLM,UCEXjRWW0shCg0MHj8kI7oEQ,2020-12-28T20:27:27Z
"Osinbajo Says Key to Democracy Is Strong Laws, Rule Of Law",https://www.youtube.com/watch?v=qReg2ng5wwU,UCEXGDNclvmg6RW0vipJYsTQ,2018-02-15T21:50:09Z
Rule Of Law | Civic Education | Afrilearn,https://www.youtube.com/watch?v=tIUE-tonygE,UC_BnnokJom1DWipMl0oSxWA,2021-04-05T05:00:19Z
Rule Of Law Demands That Saraki Defends Himself    Daniel Bwala,https://www.youtube.com/watch?v=JAwz5QtUUKM,UCf0ackVO0fR8dPi_J3CRrUw,2017-07-07T11:23:56Z
ANDISHA: Justice and the Rule of Law in Afghanistan,https://www.youtube.com/watch?v=G4re0uNBAvM,UCknKEREcKsqhB9DFvT61LZQ,2017-12-05T06:10:39Z
Principles of Government: Rule of Law (Government SSS 1),https://www.youtube.com/watch?v=sZCrg62MY98,UCxCUXiehh4AUVWqC4lZ9wIQ,2022-04-25T15:01:45Z
France&#39;s Macron &#39;will implement&#39; EU funding conditionality over rule of law degradations,https://www.youtube.com/watch?v=zGd3TGMX1cI,UCQfwfsi5VrQ8yKZ-UWmAEFg,2022-01-21T16:56:36Z
Classical liberalism #4: How does the rule of law promote a free society? | James Stoner | Big Think,https://www.youtube.com/watch?v=U9BpZLJ1UkE,UCvQECJukTDE2i6aCoMnS-Vg,2020-03-11T09:00:05Z
Risks Faced by Multinational Companies and Rule of Law Issues,https://www.youtube.com/watch?v=70925DNHR1A,UCCjRJcrVZ-i1D3P0uwizXvQ,2015-09-04T14:56:39Z
Rule of Law Negara Hukum,https://www.youtube.com/watch?v=ktG9NnYB8pw,UCuRmm8mPo5w8KXybMrlDTEQ,2019-03-31T07:27:07Z
What&#39;s Left E02: Preserving the Rule of Law,https://www.youtube.com/watch?v=xFTI6jokrS4,UCcrZex5NAJkZJ5DRGTk02vw,2020-12-17T14:40:35Z
Free Thinking and the Rule of Law,https://www.youtube.com/watch?v=jgvZxgeTk28,UC1t6kKXoBvjdr8m9KJ2Fx7A,2021-12-06T12:34:01Z
Democracy and the Rule of Law | Shivam Jain Kakadia | TEDxYouth@PPSIJC,https://www.youtube.com/watch?v=Jn4r8PbEZNg,UCsT0YIqwnpJCM-mx7-gSA4Q,2020-02-26T16:24:42Z
An Introduction to the Rule of Law - UK Constitutional Law,https://www.youtube.com/watch?v=fliRZOpm1n4,UCQE35oHoXrF581qU1tB4-oA,2018-08-22T12:18:23Z
TMI: EDO POLITICAL CRISIS - The Rule Of Law vs Rule Of Might,https://www.youtube.com/watch?v=pbuEacCizWM,UCzuiQaDS-LR2Qr3QYcj730w,2019-11-06T12:11:38Z
&quot;Rule of law&quot; e &quot;rule by law&quot; - Edward Coke e o &quot;caso Bonham&quot; (&quot;Bonham case&quot;),https://www.youtube.com/watch?v=uz9Rsaz9l2k,UCRJooxeIg3O29IDIcPZPaCg,2017-04-15T18:40:51Z
Vignette #4: The Rule of Law - Judges in Canada,https://www.youtube.com/watch?v=L70hfiV0odI,UCmZ-ODLaJDDQjXmqWLKuu_Q,2019-01-30T19:23:44Z
Debate on the Rule of Law in Europe,https://www.youtube.com/watch?v=jCVrfqIJlhM,UCybCOzIBaYmXe8ms-BsYr2g,2021-01-26T14:08:17Z
The Signature Show: Nigerian Elite and the Rule of Law - Implication for a stable polity,https://www.youtube.com/watch?v=rm0yfO2CPYk,UCvEmSD5fBgnXsYKV-xKR3qA,2022-06-05T02:42:37Z
"Trump, the Constitution and the ‘Rule of Law’",https://www.youtube.com/watch?v=VZJJkOuzayo,UCkpm9QLjl64AsJOp1Hj4o7g,2017-01-30T16:34:10Z
On rule of law in China: PM Lee,https://www.youtube.com/watch?v=YumbyW-Vcpo,UCCW8a4CgTbBWzid3IJYomFQ,2014-03-29T08:13:49Z
"Oshiomhole Asks State Govt, Lawmakers To Respect Rule Of Law",https://www.youtube.com/watch?v=jHIdIBkCSs8,UCEXGDNclvmg6RW0vipJYsTQ,2019-06-22T18:56:17Z
How The Rule Of Law Promotes Prosperity | Intellections,https://www.youtube.com/watch?v=4Z_dswLk-58,UCFKrfZXPHx5URnspnfM8lpQ,2019-02-28T20:00:52Z
"Rule of Law, Peace and Security",https://www.youtube.com/watch?v=LSWR_WXDMhU,UC5O114-PQNYkurlTg6hekZw,2014-02-18T20:18:58Z
WJP Rule of Law Index: The Most Reverend Desmond Tutu,https://www.youtube.com/watch?v=14NUsNhcRuk,UCJR7EPRDPsgiy8B7uvZL_-A,2014-03-06T19:51:01Z
"Mr Femi Falana, says leaders have contempt for the rule of law",https://www.youtube.com/watch?v=KBh8Cw8BuxE,UCkY5L8JYwx7BT0cOXYZX_dw,2018-08-30T18:42:14Z
Rule of Law | Justice Rasheed A. Rizvi | Judiciary Diaries Ep 08,https://www.youtube.com/watch?v=SemQoCKIZ7w,UCNl52ZDAy4JW4Loj0FpmA4g,2021-08-22T09:06:54Z
Govt. fully responsible for collapse of rule of law: Ex-Minister,https://www.youtube.com/watch?v=Z6X0LIRLIt0,UCJruLt_Bj36jL-kVaw2jgTg,2022-06-10T12:07:33Z
"Jack Beatson, &#39;Key Ideas in Law: The Rule of Law and the Separation of Powers&#39;",https://www.youtube.com/watch?v=sVM96gBbGT4,UCiT9K1pYCJi3gWwRaE9F6ig,2021-12-17T18:00:54Z
#FreeSowore: Sowore&#39;s stringent bail conditions and Rule of law - Tope Akinyode,https://www.youtube.com/watch?v=GVwhrAydZXM,UCyEJX-kSj0kOOCS7Qlq2G7g,2019-10-07T15:25:40Z
Magna Carta 2015: Global Empowerment Through Rule of Law,https://www.youtube.com/watch?v=idAsMXWv4Cg,UCwtP1InWAZ5U3jnS_67InVw,2015-06-15T18:03:26Z
"Maddow: With The Rule Of Law Failing Under Trump, Just Diagnosing The Problem Isn’t Enough | MSNBC",https://www.youtube.com/watch?v=yCIN2Y1RQ28,UCaXkIU1QidjPwiAYu6GcHjg,2020-02-13T21:48:16Z
Lawyers Debate FG&#39;s Adherence To Rule Of Law,https://www.youtube.com/watch?v=ygZdLKNP-qg,UCEXGDNclvmg6RW0vipJYsTQ,2019-08-27T21:59:17Z
Rule of Law in La Cava [PovertyCure Episode 3],https://www.youtube.com/watch?v=N2T1mtNt5-A,UCJJniHyad24Lox_ioZVJfPA,2013-01-30T13:10:59Z
Rule of Law Series - Part 2 - Dicey&#39;s Rule of Law,https://www.youtube.com/watch?v=rkwxljnogew,UCqBENFkPqJaIra7OQjMXA1A,2012-10-22T05:04:49Z
"Defending the Rule of Law in the EU, a trip to the Legal Metaverse?: CELS Webinar",https://www.youtube.com/watch?v=D9R1SZewmXA,UCKpz_4qERjwMB7oFMW1RmHw,2022-05-17T07:46:23Z
RULE OF LAW IN ADMINISTRATIVE LAW IN INDIA,https://www.youtube.com/watch?v=PJ9ZxmOLCGc,UCoCXnXJWWkzXNcAgMwFZc9g,2019-03-27T08:28:15Z
UN Peacekeeping animation - Security and rule of law in the field,https://www.youtube.com/watch?v=UtegUGSK1bg,UC5O114-PQNYkurlTg6hekZw,2011-08-04T20:39:46Z
How Rule of Law Matters to Public Health,https://www.youtube.com/watch?v=tMYudrN_6So,UCJR7EPRDPsgiy8B7uvZL_-A,2017-08-02T20:04:40Z
Analysts Debate Right Of Protest And Rule Of Law,https://www.youtube.com/watch?v=knHendOMav8,UCEXGDNclvmg6RW0vipJYsTQ,2019-12-24T15:17:29Z
Deputy Spokesperson Toner on Rule of Law in China,https://www.youtube.com/watch?v=FqodERKhgqQ,UC6ZhpmNnLxlOYipqh8wbM3A,2016-01-21T22:50:05Z
The rule of law and the potential approval of the Polish national Recovery Plan (RRF),https://www.youtube.com/watch?v=0PWb31FJ3e4,UCMPaviJxybo1RTdzvYcU91A,2022-06-07T16:29:32Z
British Judicial System | Rule of Law | Characteristics | Exceptions | Importance | Part - 4,https://www.youtube.com/watch?v=0rQgwl_UdyY,UCCnrW6PdXlt84cp3Qkm593w,2021-11-29T05:37:04Z
"HLS in the World | National Security, Privacy, and the Rule of Law",https://www.youtube.com/watch?v=ZIqM_qtFe80,UCBcn1VNOJUsPNrsCJGTcquw,2017-11-15T14:39:58Z
"World Human Rights Day: Lack of rule of law, lawlessness, a growing concern",https://www.youtube.com/watch?v=itLVz6R6lV0,UCgp4A6I8LCWrhUzn-5SbKvA,2019-12-11T10:53:08Z
Rule of Law || Theory of Rule of Law || Rule of law and constitution || By: Loksewa Sopan,https://www.youtube.com/watch?v=ESK_LOROkrc,UCy41m7KB9TYoMH0xa5pxeuQ,2021-08-24T10:15:00Z
Rule of Law in Pakistan pdf &amp; Rule of Law in Islam &amp; Importance of Rule of Law &amp; Need of Rule of Law,https://www.youtube.com/watch?v=btsVsM5TnqM,UChLJ8dV49lzrpw67KQEQgZQ,2020-06-16T07:59:37Z
Rule Of Law: We Have No Institution In Nigeria | #JUNE12,https://www.youtube.com/watch?v=Ibv2ObK-55E,UCkY5L8JYwx7BT0cOXYZX_dw,2021-06-12T13:30:12Z
- The EU and the Rule of Law -,https://www.youtube.com/watch?v=xdMn3fHs63Q,UCiS-SjlOGkAFNGWA_SfaycQ,2019-06-13T09:39:09Z
Maintaining Judicial Independence and the Rule of Law,https://www.youtube.com/watch?v=gY2tU1l4b8k,UCVvv3JRCVQAl6ovogDum4hA,2020-09-22T22:21:18Z
Europe&#39;s values on the line? Poland in showdown over rule of law,https://www.youtube.com/watch?v=iulO3chwV0Q,UCQfwfsi5VrQ8yKZ-UWmAEFg,2021-10-21T18:10:35Z
Showcase Panel II: The Presidency and the Rule of Law [2020 National Lawyers Convention],https://www.youtube.com/watch?v=Engj2JG3ICI,UCMk8U2Hmfdxqn3zrCq2g9oQ,2020-11-25T17:29:42Z
"Democracy must come with strong rule of law, says Sultan Nazrin",https://www.youtube.com/watch?v=I3oSFC3NLPY,UC9ULnkwvyofZ_sWrzRpyvrg,2018-08-14T08:35:01Z
Three Ways To Help The People Standing Up For The Rule Of Law | Rachel Maddow | MSNBC,https://www.youtube.com/watch?v=FFegvSxwr2k,UCaXkIU1QidjPwiAYu6GcHjg,2020-02-14T20:38:02Z
Rule of Law In India | Rule of Law Explained in Hindi [Full Lecture] | Adminstrative Law | UPSC,https://www.youtube.com/watch?v=jMbFMBsednU,UCY-uERS3erEQ46T-Im6VNRg,2021-05-19T04:30:06Z
