title,link,channelId,date
Citizen vs Government:how the Rule of Law is a tool to effect change. | Sarah Thomson | TEDxTauranga,https://www.youtube.com/watch?v=xPkGQ-XILwk,UCsT0YIqwnpJCM-mx7-gSA4Q,2017-12-08T19:29:17Z
Nigeria Is The Only Country That Don’t Respect Rule Of Law - Legal Practitioners,https://www.youtube.com/watch?v=ZwaTW0sMzD8,UCEXGDNclvmg6RW0vipJYsTQ,2021-04-21T09:56:50Z
JAMB 2012 GOVERNBMENT PAST QUESTION 13 RULE OF LAW,https://www.youtube.com/watch?v=VsKAcAAsUbA,UCs_OTgKhssqR-_dAkf55OBA,2020-11-07T17:31:08Z
"The Senkaku Islands - Seeking Maritime Peace based on the Rule of Law, not force or coercion",https://www.youtube.com/watch?v=aC9gyVeCAp0,UCooFm-JPL0IcKDk1g3B2Zow,2013-10-31T09:01:48Z
"NILDS Trains Legislative Aides, Seeks Support For Nigeria&#39;s Rule Of Law",https://www.youtube.com/watch?v=_lgc-FDiPxg,UCgp4A6I8LCWrhUzn-5SbKvA,2021-10-01T15:51:50Z
CJ Maraga described as a firm believer in the rule of law,https://www.youtube.com/watch?v=TqPln0jl1QA,UCqBJ47FjJcl61fmSbcadAVg,2017-09-02T18:35:15Z
SUNSHINE AVENUE S02 E06 - RULE OF LAW (1) | TV SERIES GHANA,https://www.youtube.com/watch?v=alqJeG0eGMU,UCScxGCr19br3yPyoE-rGrng,2019-09-24T00:00:00Z
The Rule of Law | Raghav Pandey | TEDxNSUT,https://www.youtube.com/watch?v=5LDT6s7kJPI,UCsT0YIqwnpJCM-mx7-gSA4Q,2020-02-06T16:04:28Z
Rule of Law,https://www.youtube.com/watch?v=aMdq1XoLeUs,UCnM1486D9vRIn53u4sFhACQ,2020-05-22T23:28:53Z
"NBA SAYS RESTRUCTURING, RULE OF LAW KEY SOLUTIONS TO NIGERIA PROBLEMS",https://www.youtube.com/watch?v=u8gztgmi5ew,UCquVEnzkHjkyLUnfvBC2aag,2021-05-08T12:41:55Z
The Future of Rule of Law Constitutionalism in Hungary,https://www.youtube.com/watch?v=9HogkrmCQgY,UCybCOzIBaYmXe8ms-BsYr2g,2022-02-03T14:50:25Z
#B4UBlameGYB od Governance with Governor Yahaya Bello on rule of law with @MrAbelJuliushtps,https://www.youtube.com/watch?v=ee6KBcuHiN4,UCbL9hbw-MjtfBdm2DBskEKA,2022-02-24T13:58:09Z
Kofi Bentil - RULE OF LAW (TodayMedia for SLF),https://www.youtube.com/watch?v=4O5fWcrgL9U,UCkGc7_NvfpsWxA6VWmL6y7g,2017-06-06T17:00:44Z
"Talkpoint -Rule of Law and Sowore&#39;s Re-arrest, Former Governor Orji Jailed.",https://www.youtube.com/watch?v=vZq7qj17KO0,UCUyaTH0R5YOHrJENYNUw-Ug,2019-12-12T06:58:52Z
Rule Of Law - The Ukrainian Way,https://www.youtube.com/watch?v=6WR1yfMFiZo,UCv7DCkiHkPKrv2d6evh9MJw,2011-10-11T11:44:32Z
10 Years Freedom Barometer: Rule of Law,https://www.youtube.com/watch?v=fHLbI8LL9FE,UCYjIVwRWuw5w8tt-Z1Tkp0A,2020-12-21T11:56:10Z
Intellectual Property Rights and the Rule of Law [2020 National Lawyers Convention],https://www.youtube.com/watch?v=CNtP6xxAOaE,UCMk8U2Hmfdxqn3zrCq2g9oQ,2020-11-25T17:29:31Z
MEHWAR: Rule Of Law In Afghanistan Reviewed,https://www.youtube.com/watch?v=wgKSjS3pMCM,UCknKEREcKsqhB9DFvT61LZQ,2017-08-21T05:54:43Z
The Concept of Rule of Law (Bengali Explanation),https://www.youtube.com/watch?v=zjwJr-6PESA,UCoIRTR-0Mx1soCuoQLfr_rA,2021-07-29T11:52:44Z
Has Davido Just Broken The Rule Of Law And Violated The Human Rights Of These Ladies?,https://www.youtube.com/watch?v=REZK_6GgAA8,UCdjXk1U6hmVpdLNkVrwe_gw,2019-10-30T14:12:38Z
FACTORS AND IMPORTANCE OF RULE OF LAW | CIVIC EDUCATION | SS 3,https://www.youtube.com/watch?v=ITy7Z1UQZpw,UC_BnnokJom1DWipMl0oSxWA,2022-02-25T07:07:47Z
The Big Ideas of Mr Lee Kuan Yew: Rule of Law,https://www.youtube.com/watch?v=qwptKoO6vRo,UCakbhT1zJqJ9iod01nFEYhw,2013-10-04T10:49:28Z
MAGA Speaker Says Trump Loves the Rule of Law,https://www.youtube.com/watch?v=GpyClwgHKwk,UCTQnU1zyhvwscc2P5QS-tLw,2022-07-28T23:15:00Z
The Last Mission:  Establishing the Rule of Law in Iraq,https://www.youtube.com/watch?v=R7LdqDMGCCE,UCsMiZpxCtO4TU45rDYHi7yA,2011-06-16T19:44:03Z
The Right Of Might Vs The Rule Of Law,https://www.youtube.com/watch?v=eI5l9Fk75VA,UCkcjGxTW_mLZmmEfWP2UMtQ,2022-07-04T15:30:10Z
Rule of Law,https://www.youtube.com/watch?v=dRtiJURAbS4,UCFeYHmPdZoNQ4yvpX9ZBLog,2022-04-19T06:08:50Z
Morgan Lewis Partner Suet-Fern Lee on the Rule of Law,https://www.youtube.com/watch?v=FydULS9pfBs,UCpMThoKYPuJcCMW-A9K66-g,2015-11-11T13:40:56Z
Democracy and rule of law,https://www.youtube.com/watch?v=1XYN9lxtLBs,UCEXjRWW0shCg0MHj8kI7oEQ,2016-12-10T15:18:36Z
"EU mechanism on democracy, the rule of law and fundamental rights [Plenary Podcast]",https://www.youtube.com/watch?v=omTrT3fQ_o4,UCpBeaEkpytvBHzHzcck0VyQ,2016-10-20T09:58:00Z
Examining the Rule of Law,https://www.youtube.com/watch?v=uZmPoGJp8_A,UCoiTVuiMdqBRMSBGMEcmxCw,2017-06-27T16:08:53Z
The Rule of Law and the War on Terrorism From the 2011 Aspen Security Forum,https://www.youtube.com/watch?v=k6osFq1E3F4,UCoiTVuiMdqBRMSBGMEcmxCw,2011-07-30T16:50:10Z
The rule of law is sacrosanct - Mohammed Shittu,https://www.youtube.com/watch?v=zwzAwX5vdS4,UCyEJX-kSj0kOOCS7Qlq2G7g,2019-12-18T05:39:50Z
What is the responsibility of the government to uphold the rule of law? - Lady Hale,https://www.youtube.com/watch?v=K8tFBpax8do,UCTrQ7HXWRRxr7OsOtodr2_w,2021-10-08T05:00:06Z
Sunrise Daily Democracy Is About Following The Rule Of Law -Omatseye  Pt 2  22/09/15,https://www.youtube.com/watch?v=mEHgG-7Lbm8,UCEXGDNclvmg6RW0vipJYsTQ,2015-09-22T13:33:53Z
"&#39;Obey The Rule Of Law&#39;, DIG Kokumo Tells Police Officers",https://www.youtube.com/watch?v=oMLG2DiNHBE,UCEXGDNclvmg6RW0vipJYsTQ,2022-03-24T14:16:54Z
EU starts process to cut funding to Hungary over rule of law • FRANCE 24 English,https://www.youtube.com/watch?v=Fy2O320-fK8,UCQfwfsi5VrQ8yKZ-UWmAEFg,2022-04-06T09:26:02Z
Constitutional Democracy and The Rule of Law | Civic Education | SS3 | 2nd term,https://www.youtube.com/watch?v=1elV9pftAY0,UCH2ONb1eLgZ76FvtGuLJDnA,2020-04-30T06:46:14Z
Questions about the rule of law (3),https://www.youtube.com/watch?v=GEMADyYuLKo,UCMPaviJxybo1RTdzvYcU91A,2020-08-20T12:20:26Z
Rule of Law Series - Part 3 - The Rule of Law and Magna Carta,https://www.youtube.com/watch?v=tY5Uffpk0no,UCqBENFkPqJaIra7OQjMXA1A,2012-10-22T05:58:38Z
"The &quot;Laws of  Nature and  Natures God&quot;,  the rule of law.",https://www.youtube.com/watch?v=1xdpWJqeLxI,UCeC473jB9ispIuzniamwixA,2011-10-28T14:39:23Z
"INSIDE POLITICS 27TH AUGUST, 2018 (BETWEEN RULE OF LAW &amp; NATIONAL SECURITY)",https://www.youtube.com/watch?v=PBP7Xb660sE,UCX4ycrDt8awCpf7mHGbblSA,2018-08-29T17:14:57Z
Rule of Law - Rule of Law in Pakistan - Philosophy of Law -  Video Lecture by Wajdan Bukhari,https://www.youtube.com/watch?v=Zp2JC4pAAQg,UCgckm0vRjgC7v0eCKxNhUUw,2020-07-06T06:50:07Z
Gabriela Ramos on how to build the rule of law in the digital world (long version),https://www.youtube.com/watch?v=WESadNGyfQQ,UCkD7gm3Am3M3k156lk46t3A,2020-09-30T14:06:52Z
Capitalism and the Rule of Law - INET Hong Kong,https://www.youtube.com/watch?v=QgSQeqcxHeU,UCp5hG8rt1z2MJ9aNVxY2Xdg,2013-04-06T07:11:01Z
ideacity 2019 - Marie Henein - Rule of Law,https://www.youtube.com/watch?v=odNoKvHqpYA,UCNdVhGg0-TkkzWf9Gl0djow,2019-06-20T15:24:41Z
&quot;Buhari&#39;s Government Ignores The Rule of Law&quot; - Austin Ugo,https://www.youtube.com/watch?v=LeYj109thY8,UCkY5L8JYwx7BT0cOXYZX_dw,2019-01-22T12:46:27Z
Bolch Prize for the Rule of Law: A Celebration of Hon. Dikgang Moseneke &amp; Hon. Margaret H. Marshall,https://www.youtube.com/watch?v=mdBGPcsHq4k,UCtXRIIGnq4rU8REt1vAuttw,2021-06-30T20:00:12Z
Rule of Law &amp; Respect for Rights | What is Democracy? Why Democracy? | Class 9 Civics,https://www.youtube.com/watch?v=iLxRj0J4FJ4,UC3HS6gQ79jjn4xHxogw0HiA,2019-08-04T05:48:29Z
"Climate Change &amp; Rule of Law: Lecture by Philippe Sands QC chaired by Lord Carnwath, UKSC, 17.09.15",https://www.youtube.com/watch?v=eef1tK8mtEI,UCdkf93h71xVAl28v467Hk7w,2015-09-18T10:09:24Z
The collapse of rule of law in Azerbaijan | Meydan TV English,https://www.youtube.com/watch?v=oT63UvfOjfE,UC372QkR3fwJS1exiI1NTUvw,2022-02-17T12:47:02Z
Without Rule of Law: &quot;Resurgence of Community&quot; by Nutnfancy,https://www.youtube.com/watch?v=SCM3eb3ypkk,UCbT5ssxEDZHNyz28N4Ov7Wg,2011-07-17T08:15:15Z
Justice Edwin Cameron: Constitutionalism and the Rule of Law in South Africa at Twenty,https://www.youtube.com/watch?v=lUdLOAZ5Wzk,UC5_hqq61srTFiKC0Wio8YEA,2014-04-29T21:27:02Z
Justice Thomas urges courage to uphold rule of law,https://www.youtube.com/watch?v=E5C0EqVHzLs,UC52X5wxOL_s5yw0dQk7NtgA,2020-02-11T21:24:30Z
Anderson Cooper&#39;s Hope If Trump Defies The Rule Of Law,https://www.youtube.com/watch?v=J1JexF0CUOQ,UCMtFAi84ehTSYSE9XoHefig,2019-04-11T07:35:00Z
Women and the Rule of Law,https://www.youtube.com/watch?v=s5sn6yoXYjE,UCbObxjfi3W9YKnDS0PgadNA,2011-05-26T18:09:12Z
LexisNexis Rule of Law 2020,https://www.youtube.com/watch?v=ILZXNi0d_Lo,UCUOqv8P9qavq5NpFix3UHIg,2021-02-25T19:26:34Z
&#39;Reflections on the Rule of Law in a Dangerous World&#39;: The 2018 Sir David Williams Lecture,https://www.youtube.com/watch?v=glbhliaNHOg,UCKpz_4qERjwMB7oFMW1RmHw,2018-10-23T10:19:52Z
Blockchain and the Law: The Rule of Code,https://www.youtube.com/watch?v=UH1tQidGR9U,UCuLGmD72gJDBwmLw06X58SA,2018-04-27T20:10:32Z
Richard Epstein: &quot;Is the Administrative State Consistent with the Rule of Law?&quot;,https://www.youtube.com/watch?v=PPSglKMzx5o,UCnnuga6OeRr1np142p9uwFQ,2013-06-25T20:12:51Z
"Rule of Law in the EU – with H.E. Judit Varga, Minister of Justice, Hungary and MEP Monika Hohlmeier",https://www.youtube.com/watch?v=RAybqhh2D-o,UC93YmweSzyv94q9mCILLP8A,2021-02-25T06:08:30Z
Rule of Law in 5 questions: 1/ What is the Rule of Law?,https://www.youtube.com/watch?v=gghsXyCKP3A,UC8gqtMa1oTeBQmKyoYaZjfA,2020-08-19T09:47:20Z
Deborah Samuel: Rule of Law in Islam - Sheikh Burhanudeen Babal-Waiz and Sheikh Abdallah Shaban,https://www.youtube.com/watch?v=rcdKww15A4U,UCwTb9fXSUfAHIZJeMrJJzjA,2022-05-18T18:18:38Z
Advancing the Rule of Law &amp; Creating Changes through Storytelling | Samantha Siow | TEDxUoNMalaysia,https://www.youtube.com/watch?v=wtrC-_kHu20,UCsT0YIqwnpJCM-mx7-gSA4Q,2020-04-01T16:14:36Z
Webinar &quot;Coronavirus and the Rule of Law – Has COVID-19 Infected the Rule of Law ? &quot;,https://www.youtube.com/watch?v=lumooSs5_nU,UCiXiETLcbj3SVxCYTx3ClZw,2020-05-26T15:57:27Z
Kimberley Motley - Rule of Law: Afghanistan’s Best Hope,https://www.youtube.com/watch?v=HIlBEog6c1I,UCSgB2rrsP7ru_y_R2OJIvtw,2015-06-08T13:50:16Z
UNEA and the Rule of Law,https://www.youtube.com/watch?v=fLm5FIVsYZw,UC9V3x9HelwEk3Z6EknB_1Cg,2014-06-03T13:40:09Z
Rule of Law,https://www.youtube.com/watch?v=kkjFqCOtvvU,UCDByt2wQEx6-Qb2p7-5i5Qg,2021-01-18T09:23:20Z
"Sally Yates, &quot;The Rule of Law Under Siege&quot;",https://www.youtube.com/watch?v=VIoM8Xc_eDI,UCnnuga6OeRr1np142p9uwFQ,2017-11-22T17:43:41Z
Without Rule of Law:  &quot;Don&#39;t Hasten the Day&quot; by Nutnfancy,https://www.youtube.com/watch?v=xPVSE5jg_LY,UCbT5ssxEDZHNyz28N4Ov7Wg,2009-04-01T09:49:14Z
#RightFromWrong: The Rule of Law or Trump?,https://www.youtube.com/watch?v=ZfuUnhMA1LM,UC9r9HYFxEQOBXSopFS61ZWg,2020-08-04T22:18:30Z
Polish PM accuses EU of blackmail as row over rule of law escalates - BBC Newsnight,https://www.youtube.com/watch?v=_NIc1StM3S4,UC16niRr50-MSBwiO3YDb3RA,2021-10-19T22:28:47Z
Buhari&#39;s Governments&#39; Penchant For Contempt of Rule of Law,https://www.youtube.com/watch?v=hfhvi2jp5f8,UCKnyVIW5QvfnsXddsjFKx4A,2019-04-26T08:58:28Z
The EU Rule of Law Mission launches the “Speak Up on Time” media campaign,https://www.youtube.com/watch?v=4zen_RqgVGc,UCxqi22Ew8nU-DkpgFc5sk2w,2020-05-20T13:01:08Z
Protection of the Rule of Law,https://www.youtube.com/watch?v=Laavjt0amHg,UCJiq-hQijemX8B7oRifPIZw,2016-07-26T01:35:45Z
Yates: Trump has raised assault on rule of law,https://www.youtube.com/watch?v=oLliporfSpw,UCupvZG-5ko_eiXAupbDfxWw,2018-05-26T23:59:45Z
The violence trap: Why democracy and rule of law fail in the developing world,https://www.youtube.com/watch?v=RYFAmyRH2vo,UCUKg41qkUTUQXGDzklgpmlQ,2015-06-11T00:31:19Z
Climate Change and Rule of Law,https://www.youtube.com/watch?v=hmqe4A3irTQ,UC4SMSzl_jbGe7VFkoOAeRhQ,2015-09-17T20:58:20Z
"Road to Polexit? Warsaw takes on EU, triggers rule of law showdown",https://www.youtube.com/watch?v=T6ZVMT4IUIY,UCQfwfsi5VrQ8yKZ-UWmAEFg,2021-10-11T18:21:17Z
Questions about the rule of law (2),https://www.youtube.com/watch?v=3QAeKX_zz3Y,UCMPaviJxybo1RTdzvYcU91A,2020-08-20T09:40:42Z
Rule of Law,https://www.youtube.com/watch?v=zB3yF-QzT6w,UCpwKhjCGfijdzdwRDeWuqLQ,2022-01-29T14:53:31Z
Questions about the rule of law (5),https://www.youtube.com/watch?v=fpOZ2hOrw3g,UCMPaviJxybo1RTdzvYcU91A,2020-08-24T07:32:05Z
Pence ‘standing up for the rule of law’: Former GOP representative,https://www.youtube.com/watch?v=IzP0e5GsbjM,UCBi2mrWuNuyYy4gbM6fU18Q,2022-02-05T02:57:15Z
Polish judicial reforms key to EU rule-of-law conditionality row • FRANCE 24 English,https://www.youtube.com/watch?v=5mAjvUSST-M,UCQfwfsi5VrQ8yKZ-UWmAEFg,2022-02-16T14:35:49Z
Is Duterte&#39;s drug war undermining the rule of law? 🇵🇭 – UpFront,https://www.youtube.com/watch?v=q53tiEY2Zwc,UCNye-wNBqNL5ZzHSJj3l8Bg,2017-10-07T13:09:55Z
Singapore is committed to rule of law with no compromises: Minister K Shanmugam,https://www.youtube.com/watch?v=UU_o-hgVTTI,UC83jt4dlz1Gjl58fzQrrKZg,2020-11-04T15:26:03Z
RULE OF LAW VS RULE BY LAW,https://www.youtube.com/watch?v=S1rDXcxzxPg,UC_-lKULN4pN6P90FjFybTxg,2022-04-01T12:49:35Z
Rule of Law,https://www.youtube.com/watch?v=aMdq1XoLeUs,UCnM1486D9vRIn53u4sFhACQ,2020-05-22T23:28:53Z
"Brexit negotiations, rule of law, and Belgian fries (Tweets of the Week, Ep. 12)",https://www.youtube.com/watch?v=50gdqevMRnw,UCDCgvwyjJqZWYs6j0D2FF6g,2017-07-21T04:00:01Z
Poland under pressure to respect rule of law and press freedom,https://www.youtube.com/watch?v=J6IxHYpe-mE,UCvU4p_w08osQsrNi_I4ZtDA,2016-01-20T11:00:22Z
FARAKHABAR: Ghani’s Remarks on Rule of Law Discussed,https://www.youtube.com/watch?v=wuaiBxGUyC0,UCknKEREcKsqhB9DFvT61LZQ,2016-12-19T16:40:26Z
DeSantis: Scaring a jury &#39;completely antithetical&#39; to the rule of law,https://www.youtube.com/watch?v=teTThK951wk,UCXIJgqnII2ZOINSWNOGFThA,2021-04-21T03:38:28Z
What is WJP’s Mexico States Rule of Law Index? #Explainer,https://www.youtube.com/watch?v=xn-yIjUkc2M,UCJR7EPRDPsgiy8B7uvZL_-A,2018-10-15T20:30:27Z
Enabling Investment and Innovation: The Critical Role of the Rule of Law,https://www.youtube.com/watch?v=WIFXraULmfQ,UCJR7EPRDPsgiy8B7uvZL_-A,2017-08-02T18:07:23Z
"UK, US: Nigerian Gov. should respect the rule of law",https://www.youtube.com/watch?v=du6mOCGagnI,UCyEJX-kSj0kOOCS7Qlq2G7g,2019-12-12T17:43:33Z
The Rule of Law Oral History Project: Cerie Bullivant,https://www.youtube.com/watch?v=ziZQmNqij14,UChzhFUxUZFAQSJZ_Tp4B1fA,2013-07-23T15:15:30Z
HLA HART&#39;S RULE OF RECOGNITION EXPLAINED,https://www.youtube.com/watch?v=_U9q--vzzlg,UCVh2cmNOpIibnoetzIKwIYg,2020-03-01T21:12:54Z
Why The Rule of Law is a Social Good | Prof. Christopher May | TEDxLancasterU,https://www.youtube.com/watch?v=nXo1EftnQFQ,UCsT0YIqwnpJCM-mx7-gSA4Q,2017-06-08T15:11:06Z
&quot;Rule of Law in the Digital Age - A Constitutional Framework&quot; - By Justice S Ravindra Bhat,https://www.youtube.com/watch?v=7kra88qgPcw,UCdIawGl2i_LOIHmGUw1S9Ug,2020-12-12T12:22:26Z
Wale Adeagbo in SFL West African Conference 2019; RULE OF LAW IN THE 21ST CENTURY AFRICA.,https://www.youtube.com/watch?v=VlV9Y-mj32g,UCO_Rn2lvRhtUZ__V5woD0JA,2022-07-26T15:12:58Z
Respect Rule Of Law,https://www.youtube.com/watch?v=Z_pb3OW_QV8,UCPLECk9Uw7HATirXNnPr6lw,2022-07-23T12:00:19Z
Lopsided Appointments Issues Is Not About Democracy But The Rule Of Law,https://www.youtube.com/watch?v=-eN24_-Lflc,UCkY5L8JYwx7BT0cOXYZX_dw,2020-06-24T12:54:53Z
Brexit Undermines the Rule of Law in the UK,https://www.youtube.com/watch?v=DshlC-gwSIQ,UCdg9-GJXJIcsDq4axvr79hA,2022-06-17T13:22:03Z
WJP Rule of Law Index 2021 Launch,https://www.youtube.com/watch?v=moZVZ5L7sxA,UCJR7EPRDPsgiy8B7uvZL_-A,2021-10-15T03:04:57Z
Martin Krygier on &quot;Why the Rule of Law is More Than a Legal Issue&quot;,https://www.youtube.com/watch?v=V5Vmxe3xyPA,UCybCOzIBaYmXe8ms-BsYr2g,2011-11-11T09:51:22Z
Democracy &amp; the Rule of Law in Uganda- Straight Talk Africa,https://www.youtube.com/watch?v=-UXgTufIrKQ,UC_wEFPo0aHFIAhkB7SC7PVw,2016-08-31T19:55:55Z
The War on Terror and the Rule of Law with Wallace Tashima,https://www.youtube.com/watch?v=7_XwAkkCpOg,UCh6KFtW4a4Ozr81GI1cxaBQ,2008-01-11T01:36:10Z
CIVIC RUTH FAITHFUL RULE OF LAW MVCA,https://www.youtube.com/watch?v=PMquOewFQtA,UC1sfIy6ECgHUT_qSDplbPlw,2020-04-27T14:10:24Z
Rule of law | Drishti IAS | Vikash divyakriti |#study_point |,https://www.youtube.com/watch?v=q3p9iMpQnOc,UCCppELNy1Wo488lBUlF5_Ww,2022-03-22T05:55:55Z
Rule of law: First Annual Report on the Rule of Law situation across the European Union,https://www.youtube.com/watch?v=j-FIytmwMuU,UCkXWisas7nopnXQVgqMwodQ,2020-09-30T13:57:53Z
pm Imran Khan speech rule of law#speech #pmimrankhan #viral,https://www.youtube.com/watch?v=U5YoXHdupaE,UCs6CLwaK5JNGKyhkXFHB7_A,2022-03-09T18:22:31Z
Governor Godwin Obaseki restates commitment to rule of law,https://www.youtube.com/watch?v=MgYSApR4eo8,UC3f1R-cCROJkzmpK7gSBnQw,2017-01-20T16:02:33Z
"Rule of Law — Bryan Stevenson, Equal Justice Initiative",https://www.youtube.com/watch?v=1tSeQVufTcQ,UC0jFnHOBYEzZjsWkvmL7QKg,2019-12-12T19:50:27Z
"Hon. William H. Pryor, Jr. | Moral Duty &amp; the Rule of Law",https://www.youtube.com/watch?v=HX3J8ebf008,UCQZCYn0xmNrkrlszmpUPf-w,2014-02-04T19:44:09Z
World Justice Project (WJP) Rule of Law Index: Leading Voices,https://www.youtube.com/watch?v=Loh_Zyi-qzw,UCJR7EPRDPsgiy8B7uvZL_-A,2016-10-19T21:28:30Z
What&#39;s The point of the rule of law?,https://www.youtube.com/watch?v=gEJEOIWtVz0,UC-ImDz1aCgVBaT1Y971Ae-Q,2018-12-20T10:18:10Z
"DOJ, ipinagtanggol ang pagpapatupad ng Pilipinas sa rule of law",https://www.youtube.com/watch?v=XQN_4LvVJ3o,UC3XaG-7UVi2vD8ZZEMNnnpw,2021-10-16T06:00:05Z
Interview with IBA Executive Director Mark Ellis on the rule of law,https://www.youtube.com/watch?v=6G-rgZFQF2E,UCP_zpn_s9qzxmNcS6ULctSQ,2022-03-29T08:36:02Z
Hong Kong Under China: Challenges to the Rule of Law and Judicial Independence,https://www.youtube.com/watch?v=s5tPiSuoVFo,UCSh-dNnqe1agUSzPM01LgBA,2015-02-16T23:02:52Z
Judges fight to defend the rule of law and save Poland&#39;s democracy | Witness Documentary,https://www.youtube.com/watch?v=FmtnMkok7wY,UCNye-wNBqNL5ZzHSJj3l8Bg,2022-07-21T09:04:50Z
&#39;Republicans won&#39;t stand up for the rule of law&#39;: Rep. Adam Schiff | ABC News,https://www.youtube.com/watch?v=9JNnjlAH_GA,UCBi2mrWuNuyYy4gbM6fU18Q,2020-07-12T15:55:05Z
Poland rule-of-law row to dominate EU summit • FRANCE 24 English,https://www.youtube.com/watch?v=9bvxAphkUE4,UCQfwfsi5VrQ8yKZ-UWmAEFg,2021-10-21T12:57:47Z
Imran Khan Speech On The Rule Of Law#shorts #viral #viralshorts NAYA BBC URDU,https://www.youtube.com/watch?v=yniAbOOp1OI,UCQcjOpvGGI9DtOK8OsC8Hjw,2022-07-26T06:23:50Z
Breaking News!!! United Liberians For Justice And The Rule Of Law Press Conference on Mr. Paul Sethi,https://www.youtube.com/watch?v=PEWVv9XWLSs,UCHpZgLKQR5yXnE1KtjpvjaA,2022-04-21T18:30:31Z
Turkey 2008 - The Rule of Law and the Military,https://www.youtube.com/watch?v=wNyLbamBUJw,UCw-kH-Od73XDAt7qtH9uBYA,2008-11-19T17:52:17Z
The Rule of Law,https://www.youtube.com/watch?v=RgTKrMeevps,UCUTakq6hFsvgh4YiyfeS44Q,2020-09-25T11:23:46Z
Turkey 2008 - The Rule of Law and the Military,https://www.youtube.com/watch?v=wNyLbamBUJw,UCw-kH-Od73XDAt7qtH9uBYA,2008-11-19T17:52:17Z
The Rule of Law,https://www.youtube.com/watch?v=RgTKrMeevps,UCUTakq6hFsvgh4YiyfeS44Q,2020-09-25T11:23:46Z
RULE OF LAW in GOVERNMENT ON LEARNING TIME.,https://www.youtube.com/watch?v=naj5fuc4Wxs,UC3c3SXjxmmyNo8ZEfxT3qww,2017-07-27T01:33:04Z
Chapter 4  - CJ 101 - The Rule of Law,https://www.youtube.com/watch?v=OqLKJM4Vj5Y,UCY032X9xd0cb8sIUx1I9-NA,2016-08-09T17:48:20Z
UNDP South Sudan: Rule of law,https://www.youtube.com/watch?v=iEKIkcHOV78,UCagCOAfZBpsTOlAJq_vcWbw,2008-01-17T19:57:55Z
Rule of Law vs Arbitrary Law,https://www.youtube.com/watch?v=vCb-hFp1u9I,UCZEkCafXFL3bteX-OFyAAeg,2018-08-30T03:35:53Z
"Promoting peace, justice &amp; the rule of law: the journey of UNODC’s Doha Declaration Global Programme",https://www.youtube.com/watch?v=l3ObrSOdJz0,UCDlPLsjr5DYxtZKAfx4HlzQ,2021-02-26T11:55:53Z
Judit Varga &amp; Thomas Byrne TD - Rule of Law in the EU,https://www.youtube.com/watch?v=yh2RQhau_vQ,UCxVKCX36rGPO4YXBWDrW6gg,2021-02-02T17:12:07Z
EU Leaders Rejected Viktor Orban&#39;s Rule-of-Law Demands,https://www.youtube.com/watch?v=ySPD6_96A4E,UCkXWisas7nopnXQVgqMwodQ,2020-07-19T16:10:15Z
"Aboriginal Property Rights, Duty to Consult, and Rule of Law Theory",https://www.youtube.com/watch?v=8Q_dTgIlKQE,UCqSPoOaDhRPrxmtfpUR6N9Q,2018-03-19T17:15:00Z
Subjection to the rule of law is absent in our Policing system. Our leaders are a product of us.,https://www.youtube.com/watch?v=UlQCtDv3iKQ,UCuZ24A8pL0GHIOacMkC9OOA,2022-05-27T15:09:17Z
Pence calls Arpaio a &#39;champion&#39; for &#39;rule of law&#39;,https://www.youtube.com/watch?v=DexFmFguGhw,UCupvZG-5ko_eiXAupbDfxWw,2018-05-02T16:01:08Z
Voice of Assenna: The Eritrean People&#39;s Desire for Rule of Law will Never Die,https://www.youtube.com/watch?v=CGejoZ-LNHY,UCMKaCcIDaPJc7ELfP75UeYA,2015-01-06T01:25:56Z
"Prosecutorial Discretion, Partisanship, and the Rule of Law [2020 National Lawyers Convention]",https://www.youtube.com/watch?v=3sCHmoZuhrk,UCMk8U2Hmfdxqn3zrCq2g9oQ,2020-11-25T17:29:31Z
Replacing Rule Of Law Violates The Trust At Heart Of US Life | Rachel Maddow | MSNBC,https://www.youtube.com/watch?v=MyFZUwvkIC8,UCaXkIU1QidjPwiAYu6GcHjg,2020-02-14T20:38:50Z
The Rule of Law Oral History Project: Gareth Peirce,https://www.youtube.com/watch?v=TxMXwggviNA,UChzhFUxUZFAQSJZ_Tp4B1fA,2013-07-19T21:28:43Z
Law Day 2021 - “Advancing the Rule of Law Now: A Global Perspective”,https://www.youtube.com/watch?v=d_c55omdFTY,UCbObxjfi3W9YKnDS0PgadNA,2021-05-26T13:27:06Z
&#39;The Rule of Law and Human Dignity&#39;: The 2011 Sir David Williams Lecture - Professor Jeremy Waldron,https://www.youtube.com/watch?v=X3cyYnle0ec,UCKpz_4qERjwMB7oFMW1RmHw,2014-03-26T12:15:50Z
Polish PM Morawiecki takes defiant tone in EU rule of law clash | DW News,https://www.youtube.com/watch?v=1BZBVBjkfuE,UCknLrEdhRCp1aegoMqRaCZg,2021-10-19T10:01:14Z
&#39;I’m Committed To The Rule Of Law&#39;: Barrett Discusses Decision To Accept Nomination | NBC News,https://www.youtube.com/watch?v=RM2xbGMYZuY,UCeY0bbntWzzVIaj2z3QigXg,2020-10-13T14:59:46Z
The Rule of law crisis in Poland and the primacy of EU law - President von der Leyen at the EPlenary,https://www.youtube.com/watch?v=9CVxFzLmerc,UCMPaviJxybo1RTdzvYcU91A,2021-10-19T08:29:50Z
Breaking down the rule of law will break down society: McCarthy,https://www.youtube.com/watch?v=hJQsIY-XU6A,UCXIJgqnII2ZOINSWNOGFThA,2020-06-26T15:16:22Z
Mahabharata and Rule of Law | Apurv Mishra | TEDxRGNUL,https://www.youtube.com/watch?v=U3XqxG2FvRw,UCsT0YIqwnpJCM-mx7-gSA4Q,2017-08-08T19:57:44Z
RULE OF LAW,https://www.youtube.com/watch?v=1oyW1qlKIOY,UCMEoy8TQhBB9COGhfkoKKKQ,2022-06-05T10:06:21Z
4TH ANNUAL CRIMINAL LAW REVIEW CONFERENCE 2021 || BY THE RULE OF LAW DEVELOPMENT FOUNDATION [ROL…,https://www.youtube.com/watch?v=6vGNvlpbjEQ,UCCSYQW9Dj4qNwjr9PGEuPPw,2021-11-25T11:08:31Z
Natasha Srdoc | Jerusalem Leaders Summit 2016 | Erosion of the Rule of Law and Security Threats,https://www.youtube.com/watch?v=zX3J-XXd4Ls,UCGuOxUSmyfGF6RR_lELtU2A,2017-02-09T18:52:19Z
Evidence Law: The Rule of Relevance and Admissibility of Character Evidence,https://www.youtube.com/watch?v=byczmeYHCyE,UCSxkqyENz-czORfYZipgt1w,2020-04-22T15:09:45Z
America’s Criminal Justice System: Essential for the Rule of Law,https://www.youtube.com/watch?v=rfWj6eC_hNE,UCJR7EPRDPsgiy8B7uvZL_-A,2018-08-10T16:57:05Z
Protection of Human rights and the Rule of law.,https://www.youtube.com/watch?v=toU-Qzdr5-k,UCDByt2wQEx6-Qb2p7-5i5Qg,2021-01-18T09:13:30Z
Class 9 Civics Chapter 1 | Rule of Law and Respect for Rights - What Is Democracy? Why Democracy?,https://www.youtube.com/watch?v=i1svbAUxta4,UC3HS6gQ79jjn4xHxogw0HiA,2021-09-15T07:00:09Z
"Extradition bill could damage Hong Kong&#39;s rule of law, says AmCham president",https://www.youtube.com/watch?v=aEP_-FUzqLY,UC4SUWizzKc1tptprBkWjX2Q,2019-05-19T03:07:36Z
16th Annual Timothy A. Gelatt Dialogue on the Rule of Law in Asia,https://www.youtube.com/watch?v=rOqas45h7hg,UCPIj95W1bHT9NSpNMm2oVbQ,2010-09-21T01:07:09Z
Rep. Ted Lieu: ‘Incredible Disrespect’ For Rule Of Law By Trump Administration | All In | MSNBC,https://www.youtube.com/watch?v=V01J3ZyK3q8,UCaXkIU1QidjPwiAYu6GcHjg,2017-06-07T19:13:48Z
Gender Equality and the Rule of Law: Chief Justice Maite Oronoz-Rodríguez,https://www.youtube.com/watch?v=7QxVJ1aTLB0,UCPIj95W1bHT9NSpNMm2oVbQ,2020-04-27T15:04:24Z
"Biden Vows to &#39;Restore Democracy, the Rule of Law&#39; Amid U.S. Capitol Chaos",https://www.youtube.com/watch?v=eBrE0qFlAwY,UChirEOpgFCupRAk5etXqPaA,2021-01-06T23:36:37Z
Comey: Trump &#39;undermines the rule of law&#39; when calling Cohen a &#39;rat&#39;,https://www.youtube.com/watch?v=i97_9nbN9u8,UCHd62-u_v4DvJ8TCFtpi4GA,2018-12-17T21:28:33Z
WJP Rule of Law Index 2014,https://www.youtube.com/watch?v=pKWctwIJJlc,UCJR7EPRDPsgiy8B7uvZL_-A,2014-05-30T23:18:02Z
Criminal Justice 2021 and The Rule of Law [2021 National Lawyers Convention],https://www.youtube.com/watch?v=dH6ss_oAiVY,UCMk8U2Hmfdxqn3zrCq2g9oQ,2021-12-07T12:57:25Z
"Democratising Information, Justice, Equality and the Rule of Law",https://www.youtube.com/watch?v=KB0cazFvbP4,UCh7EUh69RBoRL-xkMWKFwfA,2013-01-24T12:20:33Z
CIVIC EDUCATION: Rule of Law,https://www.youtube.com/watch?v=bkmw55s69Jw,UCinL3xGKFt1BgWPPbSzK0bA,2022-06-24T00:53:04Z
4TH ANNUAL CRIMINAL LAW REVIEW CONFERENCE 2021 || BY THE RULE OF LAW DEVELOPMENT FOUNDATION [ROL…,https://www.youtube.com/watch?v=34OjfVHaiwQ,UCCSYQW9Dj4qNwjr9PGEuPPw,2021-11-26T22:42:18Z
Flashback: Obama: Transparency and the rule of law will be the touchstones of this presidency.,https://www.youtube.com/watch?v=lgTydr4gAaI,UCvQ2kejN6UkrEVhE5oiYwBw,2011-11-04T21:58:30Z
