title,link,channelId,date
Mark Levin: Democrats don&#39;t want rule of law to apply,https://www.youtube.com/watch?v=qhVM60sBjtw,UCXIJgqnII2ZOINSWNOGFThA,2018-09-27T02:15:02Z
Hungary has one month to reply on European ‘Rule of law’ conditionality,https://www.youtube.com/watch?v=qAUhp2Sk_Hg,UCkXWisas7nopnXQVgqMwodQ,2022-07-26T11:46:48Z
Rule of Law &amp; Modern Constitutional Arrangement of the UK,https://www.youtube.com/watch?v=1_qGeFS8gm0,UCJiq-hQijemX8B7oRifPIZw,2016-07-26T01:31:00Z
Indian Polity - Rule of Law | TNPSC New Syllabus,https://www.youtube.com/watch?v=FX8p1X-Fo7M,UCpCT3Au99vSIV0mo-Rwhofg,2019-10-03T02:30:09Z
Did the Supreme Court Just Shoot Down Washington&#39;s Mandatory Waiting Period?,https://www.youtube.com/watch?v=Lh-FCh8lx0U,UC3CfC922pS8htNjW8yTPGRg,2022-07-27T21:00:21Z
Laws and Rules for Kids | What is the difference between a rule and a law?,https://www.youtube.com/watch?v=5dtuZkposkk,UCKCsVSA5THlkHbnkZTPm6-g,2022-07-28T15:00:02Z
Rule of Law | British Constitutional Law | Constitutional Law complete Lectures in Urdu/Hindi,https://www.youtube.com/watch?v=gPL4owP0zA0,UC4ekosKv3MlC9rb4GCZmN9g,2020-05-06T09:05:18Z
Success story//Best motivation status//life rule of law //#short// #motivation short,https://www.youtube.com/watch?v=x1nUmDwHfJo,UClekz3F2ZTGkjxXE04EdOdg,2022-07-27T18:00:17Z
What is Rule of Law | EXPLAINED | Online UPSC Foundation Course DEMO CLASS | IASBYHEART,https://www.youtube.com/watch?v=_ZUrhInSdHA,UCS_BE75l0vDvSVU9xLKJ-5w,2020-06-09T14:34:02Z
##TRENDING#RULE#OF#LAW#GODI#MEDIA#RAVISH#KUMAR,https://www.youtube.com/watch?v=a7c3XH5EdV0,UCUzGQW1ZmH0zt7YEPpCrJqA,2022-07-28T08:58:44Z
"Rule of Law - part II (Rule of law &amp; Indian Constitution, Modern concept &amp; principles related to it)",https://www.youtube.com/watch?v=1tOOXRwBA8s,UCyeEMc9PJMmChWND_7PGfMA,2020-03-29T06:59:35Z
Licensed Agents Crisis: Registered Board Of Trustee Insists On Rule Of Law,https://www.youtube.com/watch?v=ma8NVrDTC1M,UCgp4A6I8LCWrhUzn-5SbKvA,2021-07-07T06:19:36Z
Hot Pursuit 2010 Remastered - Rule of Law,https://www.youtube.com/watch?v=_We3NWfYcwg,UC0r2LaSi146T5Obv8CjldpQ,2022-07-26T22:54:56Z
After Robbed On Livestream New York Pastor Wants Ability To Conceal Carry,https://www.youtube.com/watch?v=JxbA080Jpi8,UC193r5YXcpQJV34N99ZbhzQ,2022-07-26T23:11:38Z
"Important new data points indicate DOJ does, in fact, have Donald Trump in its criminal sights",https://www.youtube.com/watch?v=Qh9PGyZ6v9s,UCrWmonkmTk5NbvmVnc7f70w,2022-07-28T00:30:10Z
The spirit of the rule of law cannot be desecrated. # Western countries .,https://www.youtube.com/watch?v=Hao22CXFl80,UCYmckKnE5hhQ5lUsxzWUCIw,2022-07-28T06:57:44Z
Laying the Foundation - Part I Construction of Law,https://www.youtube.com/watch?v=LssEcE0aqk0,UCgnTlUbnGEXimnumVGEHlGg,2022-07-22T16:55:04Z
DISSECTING THE RULE OF LAW &amp; HUMAN RIGHTS VIOLATION.,https://www.youtube.com/watch?v=DK36sXh5g0o,UCIe7-0BMSpE-jttc-80O63Q,2019-05-04T11:44:43Z
What is Rule of Law🤔| Dr. Vikas Divyakirti | #shorts | #DrishtiIAS,https://www.youtube.com/watch?v=5mTleydYqFU,UC2bwxp-fpNiKx9P4VLXR_LA,2022-06-04T04:30:02Z
"Legality Of Muslim-Muslim Ticket, Alleged Professional Misconduct +More  |Law Weekly|",https://www.youtube.com/watch?v=H5XSDz5oWWw,UCEXGDNclvmg6RW0vipJYsTQ,2022-07-23T16:07:07Z
UPSI 2021 CLASS | मूलविधि | Rule of Law (विधि का शासन) | UPSI 2021 &amp; Other One Day Exams,https://www.youtube.com/watch?v=oZsQuFohvrE,UCE4Vye7kmAI0AhvC5FTdSug,2021-09-28T23:29:06Z
"Pengertian dan Penjelasan tentang Negara Hukum, Rule Of Law, dan HAM | materi PPKn",https://www.youtube.com/watch?v=TPcsz9_WPQc,UCh9jtSA8V48yme61ngvWRIQ,2020-12-15T00:10:39Z
When Is the ATF Introducing Their New Pistol Brace Rule?,https://www.youtube.com/watch?v=tsUmR_TV8zo,UC3CfC922pS8htNjW8yTPGRg,2022-07-22T16:00:38Z
पुरुष  आयोग. |.  भारत  का संविधान  / Rule. Of law &amp;,https://www.youtube.com/watch?v=7LdQvywLRWQ,UCX2mt8Ok3LK0DOSLsioSfkw,2022-07-26T09:22:44Z
Concept of Constitutionalism / Rule of law &amp;  Judial Review,https://www.youtube.com/watch?v=n5TQra78Q-U,UCMqr9huzBUY-yB3f2P7hLew,2022-07-27T11:50:52Z
National Interest outside Rule of Law is illegality - Paul Usoro,https://www.youtube.com/watch?v=GbLkI3Zug6M,UCyEJX-kSj0kOOCS7Qlq2G7g,2019-09-13T13:13:46Z
Law of Attraction or Law of Assumption? Break the Rules and do it Your Way!,https://www.youtube.com/watch?v=olJlZ1XsDis,UCOvuyYyk8z_dcpYM4vib1GA,2022-07-27T20:00:12Z
Outside the Rule of Law (Trailer Music),https://www.youtube.com/watch?v=-SjVilxoVhg,UCm2tMNOomoGT9ef0y5zqVBw,2015-02-04T13:03:57Z
"APC playing with fire, double nomination by members, criminal - Falana",https://www.youtube.com/watch?v=pZ2se_bA5Fw,UCyEJX-kSj0kOOCS7Qlq2G7g,2022-07-22T04:16:03Z
"9. The Mixed Regime and the Rule of Law: Aristotle&#39;s Politics, VII",https://www.youtube.com/watch?v=mKLkb4LDi5M,UC4EY_qnSeAP1xGsh61eOoJA,2008-09-22T04:47:44Z
Which bonuses and techs help Genitours?,https://www.youtube.com/watch?v=bjL0H0VQXbk,UChzLZJo-SxuPHz-oYKAIC_g,2022-07-28T16:35:22Z
US seeks to add India to NATO plus,https://www.youtube.com/watch?v=9MiBnfyVyY4,UCPsEDPGf3m7ehOzzLqxwNFA,2022-07-27T12:26:06Z
"Awaz-e-Insaaniyat Ep#1 | Human Rights, Rule of Law and Gender Equality | Desi TV USA | July27,2022",https://www.youtube.com/watch?v=Kuogp93huzU,UC-yDqvnCxwkZ7EoarPnT-fw,2022-07-27T12:00:15Z
Checklist #3: Rules of Professional Conduct to Consider,https://www.youtube.com/watch?v=p-_AIPR973Q,UClehhEdK8USY6tWi9Mi__ng,2022-07-29T05:41:09Z
Revision + Rule of the Law (28/07/2022) paper 1,https://www.youtube.com/watch?v=s-Os2ntIe-M,UCZB7xcDTzfbGFhzHPKFy5Rg,2022-07-28T09:20:01Z
Violence in Papua New Guinea&#39;s capital forces city into virtual lockdown | ABC News,https://www.youtube.com/watch?v=uLUF_N9Nq9Y,UCVgO39Bk5sMo66-6o6Spn6Q,2022-07-25T09:37:26Z
Law on rejection of plaint under Order VII Rule 11 of CPC #வழக்கு #நிராகரிப்பு #tamil,https://www.youtube.com/watch?v=kOBtwU-XP7Q,UC_ogLoMmIn11LiadoKaLq2Q,2022-07-28T06:00:10Z
"Trinity Homes, LLC v. Fang Case Brief Summary | Law Case Explained",https://www.youtube.com/watch?v=Nqt3JFuoxn8,UCVTrDBjyx2YUs-IyqTn2AVg,2022-07-26T11:35:19Z
"Neneh Gomez speak to the media, and MC Cham advise the judge to be mindful#gambia",https://www.youtube.com/watch?v=XIy9GYx5BZk,UCizyKhtONxvyaL0PiLbU80g,2022-07-27T13:48:28Z
Why Does the EU Keep Suing its Member States?,https://www.youtube.com/watch?v=__WhuhoGi5Y,UC-eegKVWEgBCa4OzjnK_PtA,2022-07-19T09:30:12Z
&#39;Unruly&#39; Opposition MPs Suspended | When Did Ruckus Become A Rule? | India Upfront | English News,https://www.youtube.com/watch?v=sKrJriCAuU4,UC6RJ7-PaXg6TIH2BzZfTV7w,2022-07-26T16:12:32Z
Tom Nichols: Goal of Today’s “Authoritarian and Cultish” GOP Is Minority Rule | Amanpour and Company,https://www.youtube.com/watch?v=yOZjsMN7rkg,UCqqjiYoD0nP1fR6vf5AcSfQ,2022-07-26T20:31:41Z
THE GOLDEN RULE / JESUS MESSAGE / BIBLE QUOTES,https://www.youtube.com/watch?v=K_TuGu7SWfI,UCuBtpgE2GKyendi1kPzK9Zw,2022-07-26T18:14:31Z
Power decomposition and the law of diminishing marginal returns,https://www.youtube.com/watch?v=hGxYwTQ5YMs,UCVAIEH5KaRowB27O9gQCFdA,2022-07-21T12:00:24Z
UNIT 2 - THE NATURE OF LAW IN SOCIETY (INTRODUCTION TO NIGERIAN LAW),https://www.youtube.com/watch?v=tDGG9SflYuU,UCbubBmQLTb72p8kEiVUJTwQ,2022-07-28T14:42:03Z
"THE LAW OF CONVERSION, PART 1 || DR DAVID OGBUELI",https://www.youtube.com/watch?v=If0vkXwdOnQ,UCLrBzDNqm1pCxFjFqy3yQPA,2022-07-28T21:31:29Z
We respect Pakistan&#39;s Courts: General Pervez Musharraf,https://www.youtube.com/watch?v=BOr7KdURR6U,UCJLLwK19NscYmCR0Ue6FvEw,2022-07-27T00:23:06Z
Matter of Zang Case Brief Summary | Law Case Explained,https://www.youtube.com/watch?v=94V4V1GBKrA,UCVTrDBjyx2YUs-IyqTn2AVg,2022-07-26T11:17:35Z
"Sen. Ted Cruz: The FBI, DOJ, And Our Intel Agencies Are Deeply Corrupted",https://www.youtube.com/watch?v=2i9DkChzPwY,UCzMQMhq7Id0Y_wSDA_CJdGg,2022-07-27T23:49:14Z
Texas Mothers release MEGAVIRAL ad SLAMMING Texas Republicans,https://www.youtube.com/watch?v=OTIUBZKYCpM,UC9r9HYFxEQOBXSopFS61ZWg,2022-07-27T14:00:11Z
Council Of Legal Education Holds 2022 Call To Bar Ceremony |LIVE|,https://www.youtube.com/watch?v=arQvXtR-QX0,UCEXGDNclvmg6RW0vipJYsTQ,2022-07-27T13:39:04Z
&#39;I think the law is with us&#39;: Bannon plans appeal of conviction,https://www.youtube.com/watch?v=SJ6y8hsRRvw,UCDrLGkZTcNCshOLiKi5NtEw,2022-07-23T02:34:44Z
HOW TO WIN IN COURT -- RULES OF EVIDENCE,https://www.youtube.com/watch?v=l8F6r-Fjhfc,UCwC7VpIHS2uJzJ0q5I11oQA,2022-07-26T23:56:48Z
RULE OF LAW IN HINDI | विधि का शासन |CONSTITUTIONAL LAW NOTES FOR LLB &amp; CS,https://www.youtube.com/watch?v=NDzQdPYppnE,UCoCXnXJWWkzXNcAgMwFZc9g,2018-06-02T09:43:02Z
ረቋሒታት ኣፍርያይነት ኣብ ኤርትራ Factors of production in Eritrea. part 2,https://www.youtube.com/watch?v=8Jeq2Pz6A0g,UCwXPEimbsll5eMG4_KMpXIA,2022-07-28T07:53:46Z
Indian Polity - Rule of Law | TNPSC New Syllabus,https://www.youtube.com/watch?v=FX8p1X-Fo7M,UCpCT3Au99vSIV0mo-Rwhofg,2019-10-03T02:30:09Z
穿白襯衫的人是誰？台灣會這樣做嗎？錢在哪裡？MILLIONS of DOLLARS Are MISSING in China! Would This Ever Happen in Taiwan?,https://www.youtube.com/watch?v=zDyM7-jwOsM,UCa2XAjd0xOcVJtfrtBKSM_Q,2022-07-22T10:19:56Z
"Halo Electronics, Inc. v. Pulse Electronics, Inc. Case Brief Summary | Law Case Explained",https://www.youtube.com/watch?v=UJEFWKNk0Rs,UCVTrDBjyx2YUs-IyqTn2AVg,2022-07-26T11:23:44Z
"Pres. Yoon emphasizes &quot;universal values&quot; as key to national unity, celebrating launching of ...",https://www.youtube.com/watch?v=Tn1WTLLFa2o,UCzznO4xSV8BKnUBPyswtCUw,2022-07-27T22:03:03Z
Rule of Law | British Constitutional Law | Constitutional Law complete Lectures in Urdu/Hindi,https://www.youtube.com/watch?v=gPL4owP0zA0,UC4ekosKv3MlC9rb4GCZmN9g,2020-05-06T09:05:18Z
ባህሪ ዲክታተራት | Characteristics Of Dictators,https://www.youtube.com/watch?v=BTP9NpvoZpA,UCMaD-1iOVluW63K_-5XyE3Q,2022-07-28T17:00:07Z
Pitts v. McGraw-Edison Co. Case Brief Summary | Law Case Explained,https://www.youtube.com/watch?v=e_99OWl_DpA,UCVTrDBjyx2YUs-IyqTn2AVg,2022-07-26T11:09:49Z
"Rule of Law - part II (Rule of law &amp; Indian Constitution, Modern concept &amp; principles related to it)",https://www.youtube.com/watch?v=1tOOXRwBA8s,UCyeEMc9PJMmChWND_7PGfMA,2020-03-29T06:59:35Z
Myanmar&#39;s military junta executes four political prisoners | DW News,https://www.youtube.com/watch?v=xww4pdqxeLc,UCknLrEdhRCp1aegoMqRaCZg,2022-07-25T08:09:43Z
Leonard Pevar Co. v. Evans Products Co. Case Brief Summary | Law Case Explained,https://www.youtube.com/watch?v=MhpO2aGeFhU,UCVTrDBjyx2YUs-IyqTn2AVg,2022-07-26T11:05:41Z
Answer key of LAW GAT test held on 24 July 2022,https://www.youtube.com/watch?v=b0-k8_TtlkY,UCTyeCLeyHbzjNy5ZU9weTPA,2022-07-27T07:58:19Z
What is Rule of Law | EXPLAINED | Online UPSC Foundation Course DEMO CLASS | IASBYHEART,https://www.youtube.com/watch?v=_ZUrhInSdHA,UCS_BE75l0vDvSVU9xLKJ-5w,2020-06-09T14:34:02Z
තෙල් මාරුකරගන්න හොර අඹුවගේ ගෙට රිංගපු කාංචන ගෙදර මිනිහගෙන් නිල්වෙන්න කයි....................,https://www.youtube.com/watch?v=7Qm9aeCV7tQ,UCXVKlt8ddkf0zwc5X8UNTlg,2022-07-28T11:12:18Z
THE RULE OF NINES- CHANNELED MESSAGES #LissasLighthouse,https://www.youtube.com/watch?v=c2wTVoBgONI,UCfi4E5AG7BL39tAVN28s-Yg,2022-07-05T01:11:43Z
"Daynard v. Ness, Motley, Loadholt, Richardson &amp; Poole, P.A. Case Brief Summary | Law Case Explained",https://www.youtube.com/watch?v=Esp7iIWLTks,UCVTrDBjyx2YUs-IyqTn2AVg,2022-07-26T11:26:15Z
Locus Standi- Prof. Priti Saxena,https://www.youtube.com/watch?v=kMm8OVm9hMs,UCTDkRljszM3nKFyNYWI1EwA,2022-07-28T04:10:12Z
What is Rule of Law🤔| Dr. Vikas Divyakirti | #shorts | #DrishtiIAS,https://www.youtube.com/watch?v=5mTleydYqFU,UC2bwxp-fpNiKx9P4VLXR_LA,2022-06-04T04:30:02Z
UPSI 2021 CLASS | मूलविधि | Rule of Law (विधि का शासन) | UPSI 2021 &amp; Other One Day Exams,https://www.youtube.com/watch?v=oZsQuFohvrE,UCE4Vye7kmAI0AhvC5FTdSug,2021-09-28T23:29:06Z
ගෝඨා   සිංගප්පූරුවේදී   අත් ආඩංගුවට  පත්වීමෙන්  බේරෙන්න   ලංකාවට පැනගනී..........................,https://www.youtube.com/watch?v=MRYAzkhBaHM,UCxz9CME-gICydnJqCieVF8A,2022-07-26T08:23:38Z
Madani Qaida lesson 2 | Madani qaida for beginners | Urdu | Hindi | #faizanemadinachannel #serial 5,https://www.youtube.com/watch?v=7SgxC3KoqA8,UC4SNXD-R9C2yO-4BR-qEBzA,2022-07-28T10:13:47Z
घातांक के नियम || law of exponent || rule of power,https://www.youtube.com/watch?v=tLeolk-qQjc,UCAVtyEfeT0hnD4zMQAuaO0w,2022-07-29T03:47:00Z
"Supreme Court Rules In Enforcement Directorate&#39;s Favour | Left, Right &amp; Centre",https://www.youtube.com/watch?v=kxXMmkIUHfs,UCZFMm1mMw0F81Z37aaEzTUA,2022-07-27T18:09:02Z
Response to Burma military regime’s executions of democracy activists,https://www.youtube.com/watch?v=10as8g8RGWA,UCj5yk1kToYTf8YqcfPVas3A,2022-07-26T12:23:11Z
"XRP: Judge Set to RULE ON LBRY CASE, &amp; IT WILL Hit Ripple Lawsuit",https://www.youtube.com/watch?v=DKyNU4Kc86s,UCf3Vlkhhxrwr3A8IYN8KVkw,2022-07-23T02:45:00Z
SAPHEA HUN SEN TOB TOV AMERIK NHOR MAT THA KOM KHLANG UNH NOS,https://www.youtube.com/watch?v=C3q5dDuG74M,UCmqgbOrDjBDtCkmWpWT9fGw,2022-07-28T08:00:15Z
DSCO wants law change to extend probation for new recruits,https://www.youtube.com/watch?v=Nhf4rHo-5i0,UCczdiIilpYSmiF074WMCNiA,2022-07-27T03:26:48Z
Youth Dialogue in the Balkans - Greece &amp; North Macedonia,https://www.youtube.com/watch?v=77jTZ2xCn1I,UCzR4RbLWoMafCIGA7SkcFQQ,2022-07-29T07:35:05Z
Roundtable: Money and the Law,https://www.youtube.com/watch?v=yQjE2UV6CvU,UCmvJCmiT1N4-5Zl2tnBTEYA,2022-07-26T04:00:20Z
EN News ዜናዎች - የኢትዮጵያ ኬንያ የኃይል ሽያጭ,https://www.youtube.com/watch?v=i5AkSlVejq4,UCi9P_KT87aHcby28rjzl4Xw,2022-07-29T06:52:10Z
Roger Stone Upset,https://www.youtube.com/watch?v=aY2KxoeHzak,UC3IQfJrgj5WjRm8746riHWA,2022-07-26T13:07:18Z
Our Core Democratic Values of Good Government,https://www.youtube.com/watch?v=f_ml7CbPslg,UC1UHNidd_4Psui7I0Sp5jaA,2022-07-28T13:30:11Z
"Smith takes heat by the Sovereignty Law, Comments on Cancer and PST in the first UCP leadership deba",https://www.youtube.com/watch?v=lZoIR-hzo4g,UC5WrAKezjHzFC7TEFpSjzbw,2022-07-28T14:18:34Z
The Intermediate decisions in the Brazilian Constitutional Jurisdiction,https://www.youtube.com/watch?v=QMUTcKg3inc,UCKawrcatldOpt36Br42cYLA,2022-07-28T21:29:12Z
Matt Gaetz v. Mike Pence Chief of Staff,https://www.youtube.com/watch?v=Rkp2O73Opms,UC3IQfJrgj5WjRm8746riHWA,2022-07-28T12:49:31Z
"LIVE: सोनिया गाँधी ED केस पर, कांग्रेस पार्टी की प्रेस वार्ता  |",https://www.youtube.com/watch?v=zhOMS-a_ux4,UCHg-nKyyHqbraegYp1qkoUA,2022-07-27T17:48:54Z
අරගලකරුවන්ට   පහරදුන්   (STF)   SI ගේ  ජුංඩාගේ මිරිස් උලලා.......................................,https://www.youtube.com/watch?v=0B8J-gkmlfQ,UCxz9CME-gICydnJqCieVF8A,2022-07-28T02:30:00Z
The Harsh Rule of The Extrovert to the Introverted Passivity in Meterwyrhta by Beldam,https://www.youtube.com/watch?v=yo_Spxb1chI,UCba2JZjsqkhE7Y7b7YdIpog,2022-07-28T23:23:40Z
‘Justice needs to be served’ Coachella Mayor promises action as search for suspects in ...,https://www.youtube.com/watch?v=VRMAI1BZCfs,UCaz6po5vCT45BloJmXDJDJg,2022-07-29T05:41:00Z
Rep. Jim Jordan: We have to get to the bottom of this,https://www.youtube.com/watch?v=-4MXnQmVUBc,UCx6h-dWzJ5NpAlja1YsApdg,2022-07-28T00:59:25Z
How Many People REALLY Want American Values? #shorts,https://www.youtube.com/watch?v=RN6PyBLq5EQ,UC3k3floOm_HtKOv0l6JU-xQ,2022-07-25T02:00:06Z
VINDICATED: Pastor Artur Pawlowski on his legal victory,https://www.youtube.com/watch?v=4HEEoK4Zevk,UCGy6uV7yqGWDeUWTZzT3ZEg,2022-07-26T20:24:56Z
مصاحبه عیسی اسحاق زایی ریس کانگرس ملی باتلویزون جهانی شمشادبخاطرفیصله نشست منطقوی تاشکند درافغانستان,https://www.youtube.com/watch?v=pYRunaJL5pY,UCR34wU_Z8BsgGehWQAEPjKw,2022-07-28T08:58:40Z
