title,link,channelId,date
Human rights and rule of law perspective in Zimbabwe: Washington Katema,https://www.youtube.com/watch?v=ors3Z-d_uPg,UC8yH-uI81UUtEMDsowQyx1g,2020-08-04T18:56:13Z
The Erosion of Stare Decisis and the Rule of Law,https://www.youtube.com/watch?v=MxKF_6QnIIU,UCqSPoOaDhRPrxmtfpUR6N9Q,2018-02-21T16:57:54Z
Elizabeth May: &quot;Government not respecting the rule of law&quot; regarding GasLink pipeline,https://www.youtube.com/watch?v=F6wYn4c7kgA,UCi7Zk9baY1tvdlgxIML8MXg,2020-02-13T02:30:02Z
"Migration, Europe and the Rule of Law: Vijay Monany speaks to the Danube Institute",https://www.youtube.com/watch?v=LwMyKrP662k,UCqaco3WuAaf6wlhaeh0CsbQ,2021-02-17T08:30:01Z
《Love for Hong Kong – 法治新一代》Music Video,https://www.youtube.com/watch?v=eZ6TxylKJVM,UCr1Us2FPAibDS7OQKLPcE0A,2022-07-22T13:02:14Z
Rule of Law in 5 questions: 4/What is the Rule of Law Report?,https://www.youtube.com/watch?v=Z-B-9PSbIXA,UC8gqtMa1oTeBQmKyoYaZjfA,2020-08-21T08:22:58Z
Discussion on the Rule of Law Operation in Tigray   Part One,https://www.youtube.com/watch?v=TiSw9-jCo7Y,UCZtXd8pSeqURf5MT2fqE51g,2020-11-25T08:41:43Z
"Obaseki Hails Court Verdict, Says It Is Triumph for Rule of Law (News | Nigeria)",https://www.youtube.com/watch?v=1jT_86QZEwk,UCkY5L8JYwx7BT0cOXYZX_dw,2021-01-10T12:23:12Z
Breaking down the rule of law will break down society: McCarthy,https://www.youtube.com/watch?v=hJQsIY-XU6A,UCXIJgqnII2ZOINSWNOGFThA,2020-06-26T15:16:22Z
Mahabharata and Rule of Law | Apurv Mishra | TEDxRGNUL,https://www.youtube.com/watch?v=U3XqxG2FvRw,UCsT0YIqwnpJCM-mx7-gSA4Q,2017-08-08T19:57:44Z
RULE OF LAW,https://www.youtube.com/watch?v=1oyW1qlKIOY,UCMEoy8TQhBB9COGhfkoKKKQ,2022-06-05T10:06:21Z
4TH ANNUAL CRIMINAL LAW REVIEW CONFERENCE 2021 || BY THE RULE OF LAW DEVELOPMENT FOUNDATION [ROL…,https://www.youtube.com/watch?v=6vGNvlpbjEQ,UCCSYQW9Dj4qNwjr9PGEuPPw,2021-11-25T11:08:31Z
Natasha Srdoc | Jerusalem Leaders Summit 2016 | Erosion of the Rule of Law and Security Threats,https://www.youtube.com/watch?v=zX3J-XXd4Ls,UCGuOxUSmyfGF6RR_lELtU2A,2017-02-09T18:52:19Z
Evidence Law: The Rule of Relevance and Admissibility of Character Evidence,https://www.youtube.com/watch?v=byczmeYHCyE,UCSxkqyENz-czORfYZipgt1w,2020-04-22T15:09:45Z
America’s Criminal Justice System: Essential for the Rule of Law,https://www.youtube.com/watch?v=rfWj6eC_hNE,UCJR7EPRDPsgiy8B7uvZL_-A,2018-08-10T16:57:05Z
Protection of Human rights and the Rule of law.,https://www.youtube.com/watch?v=toU-Qzdr5-k,UCDByt2wQEx6-Qb2p7-5i5Qg,2021-01-18T09:13:30Z
"Extradition bill could damage Hong Kong&#39;s rule of law, says AmCham president",https://www.youtube.com/watch?v=aEP_-FUzqLY,UC4SUWizzKc1tptprBkWjX2Q,2019-05-19T03:07:36Z
16th Annual Timothy A. Gelatt Dialogue on the Rule of Law in Asia,https://www.youtube.com/watch?v=rOqas45h7hg,UCPIj95W1bHT9NSpNMm2oVbQ,2010-09-21T01:07:09Z
What is Rule of Law🤔| Dr. Vikas Divyakirti | #shorts | #DrishtiIAS,https://www.youtube.com/watch?v=5mTleydYqFU,UC2bwxp-fpNiKx9P4VLXR_LA,2022-06-04T04:30:02Z
Rep. Ted Lieu: ‘Incredible Disrespect’ For Rule Of Law By Trump Administration | All In | MSNBC,https://www.youtube.com/watch?v=V01J3ZyK3q8,UCaXkIU1QidjPwiAYu6GcHjg,2017-06-07T19:13:48Z
Gender Equality and the Rule of Law: Chief Justice Maite Oronoz-Rodríguez,https://www.youtube.com/watch?v=7QxVJ1aTLB0,UCPIj95W1bHT9NSpNMm2oVbQ,2020-04-27T15:04:24Z
"Biden Vows to &#39;Restore Democracy, the Rule of Law&#39; Amid U.S. Capitol Chaos",https://www.youtube.com/watch?v=eBrE0qFlAwY,UChirEOpgFCupRAk5etXqPaA,2021-01-06T23:36:37Z
Comey: Trump &#39;undermines the rule of law&#39; when calling Cohen a &#39;rat&#39;,https://www.youtube.com/watch?v=i97_9nbN9u8,UCHd62-u_v4DvJ8TCFtpi4GA,2018-12-17T21:28:33Z
WJP Rule of Law Index 2014,https://www.youtube.com/watch?v=pKWctwIJJlc,UCJR7EPRDPsgiy8B7uvZL_-A,2014-05-30T23:18:02Z
Criminal Justice 2021 and The Rule of Law [2021 National Lawyers Convention],https://www.youtube.com/watch?v=dH6ss_oAiVY,UCMk8U2Hmfdxqn3zrCq2g9oQ,2021-12-07T12:57:25Z
"Democratising Information, Justice, Equality and the Rule of Law",https://www.youtube.com/watch?v=KB0cazFvbP4,UCh7EUh69RBoRL-xkMWKFwfA,2013-01-24T12:20:33Z
CIVIC EDUCATION: Rule of Law,https://www.youtube.com/watch?v=bkmw55s69Jw,UCinL3xGKFt1BgWPPbSzK0bA,2022-06-24T00:53:04Z
4TH ANNUAL CRIMINAL LAW REVIEW CONFERENCE 2021 || BY THE RULE OF LAW DEVELOPMENT FOUNDATION [ROL…,https://www.youtube.com/watch?v=34OjfVHaiwQ,UCCSYQW9Dj4qNwjr9PGEuPPw,2021-11-26T22:42:18Z
Flashback: Obama: Transparency and the rule of law will be the touchstones of this presidency.,https://www.youtube.com/watch?v=lgTydr4gAaI,UCvQ2kejN6UkrEVhE5oiYwBw,2011-11-04T21:58:30Z
Human rights and rule of law perspective in Zimbabwe: Washington Katema,https://www.youtube.com/watch?v=ors3Z-d_uPg,UC8yH-uI81UUtEMDsowQyx1g,2020-08-04T18:56:13Z
The Erosion of Stare Decisis and the Rule of Law,https://www.youtube.com/watch?v=MxKF_6QnIIU,UCqSPoOaDhRPrxmtfpUR6N9Q,2018-02-21T16:57:54Z
Elizabeth May: &quot;Government not respecting the rule of law&quot; regarding GasLink pipeline,https://www.youtube.com/watch?v=F6wYn4c7kgA,UCi7Zk9baY1tvdlgxIML8MXg,2020-02-13T02:30:02Z
"Migration, Europe and the Rule of Law: Vijay Monany speaks to the Danube Institute",https://www.youtube.com/watch?v=LwMyKrP662k,UCqaco3WuAaf6wlhaeh0CsbQ,2021-02-17T08:30:01Z
"Rule of Law - part II (Rule of law &amp; Indian Constitution, Modern concept &amp; principles related to it)",https://www.youtube.com/watch?v=1tOOXRwBA8s,UCyeEMc9PJMmChWND_7PGfMA,2020-03-29T06:59:35Z
《Love for Hong Kong – 法治新一代》Music Video,https://www.youtube.com/watch?v=eZ6TxylKJVM,UCr1Us2FPAibDS7OQKLPcE0A,2022-07-22T13:02:14Z
Rule of Law in 5 questions: 4/What is the Rule of Law Report?,https://www.youtube.com/watch?v=Z-B-9PSbIXA,UC8gqtMa1oTeBQmKyoYaZjfA,2020-08-21T08:22:58Z
Discussion on the Rule of Law Operation in Tigray   Part One,https://www.youtube.com/watch?v=TiSw9-jCo7Y,UCZtXd8pSeqURf5MT2fqE51g,2020-11-25T08:41:43Z
"Obaseki Hails Court Verdict, Says It Is Triumph for Rule of Law (News | Nigeria)",https://www.youtube.com/watch?v=1jT_86QZEwk,UCkY5L8JYwx7BT0cOXYZX_dw,2021-01-10T12:23:12Z
COVID-19 Lockdown | The rule of law in a time of crisis,https://www.youtube.com/watch?v=uJRwZUCroMU,UC8yH-uI81UUtEMDsowQyx1g,2020-04-15T06:58:34Z
"Separation of powers, rule of law fundamental principles but need to ‘look at what works’: Shanmugam",https://www.youtube.com/watch?v=8P3F1W52Qtg,UC7LSrRnB3_4JsvixyR9D3fw,2021-10-04T23:52:17Z
"Sri Lanka: Quest for Justice, Rule of Law &amp; Democratic Rights - February 12, 2021.",https://www.youtube.com/watch?v=0muPVjyF7E8,UCo2JkmPs4jpFBPDfXB6eM1A,2021-02-13T17:58:07Z
2016.04.12 Wang Zhenmin - Rule of Law,https://www.youtube.com/watch?v=OXY7Ykldbx0,UCh1qQ8SHP8-6WfGk2zpZoRg,2016-04-12T17:18:25Z
High-level Conference Rule of Law in Europe - Day 1,https://www.youtube.com/watch?v=o48nE1jwu1s,UCK3s9wcrjBReS2veJrB-nAw,2021-05-17T17:24:46Z
"WJP Rule of Law Index: Suet-Fern Lee, Singapore",https://www.youtube.com/watch?v=GVsREiOcNq8,UCJR7EPRDPsgiy8B7uvZL_-A,2016-10-20T08:19:49Z
&quot;Rule of Law in a Developing Society&quot; by Pratap Bhanu Mehta,https://www.youtube.com/watch?v=5LfW7dr3tQ8,UCv4bdkxXT_h4NlnmNhDbq4w,2012-06-04T09:00:51Z
EU parliament approves punitive action against Hungary over rule of law,https://www.youtube.com/watch?v=ax3KlkSGkyE,UCQfwfsi5VrQ8yKZ-UWmAEFg,2018-09-12T13:01:37Z
Rule of Law: Myth or Reality,https://www.youtube.com/watch?v=lb1FdoamCYw,UC2eJZ7eVkmzgOP8TMPLqaqA,2022-01-24T09:49:08Z
"Malami Has Consistently Adhered To The Rule of Law, With Transparency And Accountability",https://www.youtube.com/watch?v=G_S8PwM4BVw,UChsIRM20m_t8nvIgYcoSCbw,2022-01-31T13:57:46Z
"Rule of law, paiiralin sa pagbawi sa amnesty ni Trillanes",https://www.youtube.com/watch?v=Qm1fsXnBiH8,UCJCUbMaY593_4SN1QPG7NFQ,2018-09-07T12:15:42Z
"The End of the Global Rule of Law?, a Conversation with Andrew Hurrell",https://www.youtube.com/watch?v=3kLCGNCX3hA,UCtjLPHCyI5V-xuumAXzAizA,2017-03-29T07:21:02Z
INDIAN POLITY (RULE OF LAW IN INDIA SO AGREEMENT  BY P.M U/A 370 IS UNCONSTITUTIONAL),https://www.youtube.com/watch?v=9Rm86KPGXeI,UC4vgB_qDWH3-RrgHE1isOYQ,2013-05-16T02:13:28Z
RULE OF LAW WINS OVER ABS-CBN FRANCHISE,https://www.youtube.com/watch?v=SElQ3USRFeQ,UCNaQMcnWvx95j7OG3217IMg,2020-05-05T14:23:43Z
Rule of Law|| Administrative Law|| Applicability in Indian Constitution #indianpolity #ruleoflaw,https://www.youtube.com/watch?v=GVxrVNSZS88,UCNSqVDXO2qKJqcCYO5VOqOA,2020-10-26T17:05:28Z
Human Rights Activist: SCOTUS Followed &#39;Rule Of Law&#39; In LGBTQ Decision | Hallie Jackson | MSNBC,https://www.youtube.com/watch?v=2cPCYSrgubc,UCaXkIU1QidjPwiAYu6GcHjg,2020-06-15T19:29:48Z
Trudeau says Canada to hold firm on &#39;rule of law&#39; as U.S. charges Huawei officials,https://www.youtube.com/watch?v=eMiMW6ZXOHs,UChLtXXpo4Ge1ReTEboVvTDg,2019-01-29T19:08:08Z
"Governor Obaseki Did Not Respect The Rule of Law - APC National Leader, Asiwaju Bola Tinubu",https://www.youtube.com/watch?v=3BSdiQgNFRA,UCRiCbyTfRqcMimtL4WbguIg,2020-09-15T11:01:38Z
APC IS COMMITTED IDEALS OF DEMOCRATIC  GOVERNANCE AND RULE OF LAW... ABDULLAHI ADAMU,https://www.youtube.com/watch?v=gsxf_plI-dE,UCnbPtwq3UaifNInJnSGShTg,2022-07-03T20:11:36Z
SLAPP lawsuits: A slap in the face of democracy &amp; rule of law | DW News,https://www.youtube.com/watch?v=um2NbX_Ge9Y,UCknLrEdhRCp1aegoMqRaCZg,2022-01-30T11:02:03Z
Mark Levin: Democrats don&#39;t want rule of law to apply,https://www.youtube.com/watch?v=qhVM60sBjtw,UCXIJgqnII2ZOINSWNOGFThA,2018-09-27T02:15:02Z
The Kyoto Congress Ancillary Meeting&quot;The Rule of Law and International Arbitration / Mediation&quot;,https://www.youtube.com/watch?v=6n3Ya8Kkcck,UCH8ROF03TnxUIJdBbXoxR7g,2021-03-29T01:32:54Z
Hyderabad Killings: Instant Justice Overrides Rule Of Law?,https://www.youtube.com/watch?v=6PBN6BMIyFg,UCZFMm1mMw0F81Z37aaEzTUA,2019-12-09T14:19:36Z
Desh Deshantar - Dimapur lynching case: How vigilantism is threatening rule of law?,https://www.youtube.com/watch?v=7Vi9AMHWv0Y,UCISgnSNwqQ2i8lhCun3KtQg,2015-03-10T10:18:17Z
India Supports Peace Consolidation Plans To Strengthen &#39;Rule Of Law&#39; At UNGA Debate | Republic TV,https://www.youtube.com/watch?v=ScxpS7ZrxJQ,UCwqusr8YDwM-3mEYTDeJHzw,2021-07-30T05:01:38Z
Rep. Schiff on ABC: Anyone Who Cares About Rule of Law Nauseated By Trump&#39;s Commutation of Stone,https://www.youtube.com/watch?v=JDasklvHAoY,UCadiUi-KZoFk1K5ZDsluLcA,2020-07-12T14:34:11Z
UP has rule of Bulldozer or rule of law? I PRAYAGRAJ PROTESTS I PROPHET MUHAMMAD,https://www.youtube.com/watch?v=l1Lgdy9f4Yo,UCrYpceU8cvXNSqaiYC-8hJA,2022-06-13T07:33:48Z
Rule of Law Champion Vania Masías,https://www.youtube.com/watch?v=UofhggIkuS4,UCDlPLsjr5DYxtZKAfx4HlzQ,2020-05-07T13:04:47Z
China: Beijing crackdown becoming Hong Kong&#39;s rule of Law | Latest English News | WION News,https://www.youtube.com/watch?v=oRtlzoNQww4,UC_gUM8rL-Lrg6O3adPW9K1g,2021-03-17T05:25:39Z
Dele Adesina SAN On Government And The Rule Of Law,https://www.youtube.com/watch?v=fH40H6LC9eg,UC4EpitfmUX4Kr4vKptalVPQ,2020-07-27T05:02:57Z
"Rule of Law, dapat kilalanin ni VP Robredo sa issue ng ABS-CBN",https://www.youtube.com/watch?v=_K7U8wM07lw,UCNaQMcnWvx95j7OG3217IMg,2020-07-14T05:58:25Z
"2013 | Chen Guangcheng, Future of the Rule of Law and Human Rights in China | The New School",https://www.youtube.com/watch?v=WeeZy3op-s4,UC1iFTPspSKcb4vb1N7czmRQ,2013-02-07T22:06:29Z
COVID Chronicles Briefing #3: The Rule of Law -- The Tipping Point,https://www.youtube.com/watch?v=zFEjP_dbOTQ,UCeFX2inUBRyod14fWuMoVlg,2020-05-02T00:38:11Z
Rappler Talk: IBP national president Abdiel Fajardo on the rule of law,https://www.youtube.com/watch?v=lvLUDqgNAdY,UCdnZdQxYXnbN4uWJg96oGxw,2018-02-15T07:37:57Z
RULE OF LAW FOUNDATION ADVOCATES STIFFER PENALTY AGAINST PERPETRATORS,https://www.youtube.com/watch?v=Pm0JLjjNC8A,UCZXy8kp7dLqeJSQ8-Qm1IxQ,2019-11-26T14:10:41Z
Book Launch &#39;International Arbitration and the Rule of Law: Essays in honour of  Fali S. Nariman&#39;,https://www.youtube.com/watch?v=BuSUqx5Kap4,UCdIawGl2i_LOIHmGUw1S9Ug,2021-02-01T06:17:32Z
Michal Šimečka eudebates the rule of law at European parliament in Brussels,https://www.youtube.com/watch?v=VjHiiXqTil0,UCkXWisas7nopnXQVgqMwodQ,2020-10-06T09:58:37Z
TWD Michonne&#39;s Rule of Law &amp; Oceanside,https://www.youtube.com/watch?v=TU7dblufP6Y,UCuWUBTO9R9VUP0H0HmD7ooA,2018-11-22T00:46:15Z
Sally Yates on Trump&#39;s travel ban and protecting the rule of law,https://www.youtube.com/watch?v=eKKR4rSvrp4,UC6ZFN9Tx6xh-skXCuRHCDpQ,2018-04-25T23:57:14Z
"Fmr. Prosecutor: Trump Has &#39;Beef&#39; With Rule Of Law, Not Sessions | The Beat With Ari Melber | MSNBC",https://www.youtube.com/watch?v=0GAhvBy4fPY,UCaXkIU1QidjPwiAYu6GcHjg,2018-09-20T01:04:35Z
Rep. Debbie Dingell: &quot;Rule Of Law Under Attack&quot; By Donald Trump | MSNBC,https://www.youtube.com/watch?v=t9xhOvW2-wg,UCaXkIU1QidjPwiAYu6GcHjg,2017-08-28T20:58:59Z
RULE OF LAW - SUGATEACH,https://www.youtube.com/watch?v=IEBbcsI3mHk,UCNZZDib89UVoDaeS9KUODQg,2022-04-25T04:19:05Z
"EU co-operation crisis: Hungary, Poland veto EU budget over rule of law",https://www.youtube.com/watch?v=tdIBHqTlbBU,UCQfwfsi5VrQ8yKZ-UWmAEFg,2020-11-20T20:29:05Z
Official Says Trump’s Ukraine Conduct Was ‘Injurious To The Rule Of Law’- The Day That Was | MSNBC,https://www.youtube.com/watch?v=SAFhheIIZFA,UCaXkIU1QidjPwiAYu6GcHjg,2019-11-08T16:21:49Z
"Myanmar Coup: &quot;The rule of law should prevail in Myanmar&quot;, says India",https://www.youtube.com/watch?v=C3LQlMYFIkE,UC_gUM8rL-Lrg6O3adPW9K1g,2021-04-04T06:01:59Z
Senator Worries President Donald Trump Won&#39;t Follow Rule Of Law In Future | Morning Joe | MSNBC,https://www.youtube.com/watch?v=MF-ddmUljjw,UCaXkIU1QidjPwiAYu6GcHjg,2019-04-10T13:54:14Z
WATCH LIVE: Deputy Attorney General Rod Rosenstein speaks on rule of law to commemorate &#39;Law Day.&#39;,https://www.youtube.com/watch?v=EHqHjwNAQM0,UC6ZFN9Tx6xh-skXCuRHCDpQ,2018-05-01T19:10:10Z
Rule of Law Index | India Ranks worst than Srilanka | Current Affairs | MPSC,https://www.youtube.com/watch?v=KJxaqNRNjeI,UCjhTfq5TACq6pu2Dl2aYTGw,2022-06-06T09:30:03Z
Polish PM Morawiecki to address EU over rule of law rift • FRANCE 24 English,https://www.youtube.com/watch?v=X3jmmGvRuZY,UCQfwfsi5VrQ8yKZ-UWmAEFg,2021-10-19T09:35:22Z
MEHWAR: Rule Of Law In Afghanistan Reviewed,https://www.youtube.com/watch?v=wgKSjS3pMCM,UCknKEREcKsqhB9DFvT61LZQ,2017-08-21T05:54:43Z
JUNGLE JUSTICE NEGLECT FOR THE RULE OF LAW,https://www.youtube.com/watch?v=-5QLuOhVSPM,UC6HDirx1NOx2JvWB3EiUftQ,2021-06-29T14:22:20Z
"FRIDAY BEYOND SPOTLIGHTS EP 9 Grenville Cross: Hong Kong’s Rule of Law: Past, Present and Future",https://www.youtube.com/watch?v=z-CP_EUiHGs,UC_q7e5XYJB0JDGagcF0KW0w,2022-04-08T13:00:36Z
Trump Attacks The Rule Of Law. Critics Say It’s Time To Use ‘The F Word: Fascism’ | MSNBC,https://www.youtube.com/watch?v=7AxO7Cg29mU,UCaXkIU1QidjPwiAYu6GcHjg,2020-07-25T16:04:30Z
Indian Polity - Rule of Law | TNPSC New Syllabus,https://www.youtube.com/watch?v=FX8p1X-Fo7M,UCpCT3Au99vSIV0mo-Rwhofg,2019-10-03T02:30:09Z
Video 2 - Torts and the Rule of Law,https://www.youtube.com/watch?v=qaGtKBUtH3c,UCqBENFkPqJaIra7OQjMXA1A,2012-02-07T00:10:53Z
4TH ANNUAL CRIMINAL LAW REVIEW CONFERENCE 2021 || BY THE RULE OF LAW DEVELOPMENT FOUNDATION [ROL…,https://www.youtube.com/watch?v=zygwKNz9bEw,UCCSYQW9Dj4qNwjr9PGEuPPw,2021-11-25T13:48:40Z
"Oshiomhole Asks State Govt, Lawmakers To Respect Rule Of Law",https://www.youtube.com/watch?v=jHIdIBkCSs8,UCEXGDNclvmg6RW0vipJYsTQ,2019-06-22T18:56:17Z
"RESTRUCTURING, RULE-OF-LAW KEY SOLUTION TO NIGERIA PROBLEMS -  NBA",https://www.youtube.com/watch?v=isLCxdufwrk,UCcspjcKq8gfApPjZ2ySzflA,2021-05-03T09:16:43Z
High-level Conference Rule of Law in Europe - Day 1,https://www.youtube.com/watch?v=o48nE1jwu1s,UCK3s9wcrjBReS2veJrB-nAw,2021-05-17T17:24:46Z
Rule of Law: Issue of &#39;Ejectment&#39; on lot/house (from: Maricel Cahilig),https://www.youtube.com/watch?v=ZLkTGrvBADw,UCJCUbMaY593_4SN1QPG7NFQ,2015-06-24T07:58:59Z
"EU top court dismisses Polish, Hungarian rule of law challenge • FRANCE 24 English",https://www.youtube.com/watch?v=4HvYtN_pm3s,UCQfwfsi5VrQ8yKZ-UWmAEFg,2022-02-16T12:03:00Z
#FreeSowore: Sowore&#39;s stringent bail conditions and Rule of law - Tope Akinyode,https://www.youtube.com/watch?v=GVwhrAydZXM,UCyEJX-kSj0kOOCS7Qlq2G7g,2019-10-07T15:25:40Z
I SIMPLY CANNOT ALLOW YOU TO PLAY SPELLS!! Rule of Law Jace Historic MTG Arena,https://www.youtube.com/watch?v=cvt75Uav94s,UCi3VPBRXVBcvI0OW1WDHlzw,2020-10-12T14:00:15Z
The Signature Show: Nigerian Elite and the Rule of Law - Implication for a stable polity,https://www.youtube.com/watch?v=rm0yfO2CPYk,UCvEmSD5fBgnXsYKV-xKR3qA,2022-06-05T02:42:37Z
"Macron&#39;s New Europe, Downing Street Christmas Party, Biden&#39;s World Rule of Law...",https://www.youtube.com/watch?v=k5QFe3yI3Mo,UCQfwfsi5VrQ8yKZ-UWmAEFg,2021-12-11T08:27:17Z
GOP Lawmaker Says US Has Had &#39;Complete Breakdown&#39; Of Rule Of Law Under Biden,https://www.youtube.com/watch?v=rx_1FJIZktc,UCg40OxZ1GYh3u3jBntB6DLg,2021-12-19T22:30:09Z
Rule of Law: Myth or Reality,https://www.youtube.com/watch?v=lb1FdoamCYw,UC2eJZ7eVkmzgOP8TMPLqaqA,2022-01-24T09:49:08Z
Protection of Human rights and the Rule of law.,https://www.youtube.com/watch?v=toU-Qzdr5-k,UCDByt2wQEx6-Qb2p7-5i5Qg,2021-01-18T09:13:30Z
World Justice Forum 2019: World Justice Project Rule of Law Award Ceremony,https://www.youtube.com/watch?v=yDtxGkv1Ys8,UCJR7EPRDPsgiy8B7uvZL_-A,2019-05-01T14:16:53Z
Rule of Law: Issue of &#39;right of way&#39; between house owner &amp; subdivision&#39;s assoc. (Fr: Jocelyn Iso),https://www.youtube.com/watch?v=Bv_FOxmjhRo,UCJCUbMaY593_4SN1QPG7NFQ,2015-05-13T08:19:39Z
William P. Barr | The Constitution and the Rule of Law,https://www.youtube.com/watch?v=I0Ho5_DiRdc,UCudqVyQYnmi8NwWfd11Rmvw,2020-09-21T18:03:14Z
&quot;Umahi does not respect the rule of law&quot;- Abia Onyike,https://www.youtube.com/watch?v=FceHAFsDoD4,UCyEJX-kSj0kOOCS7Qlq2G7g,2022-03-10T12:05:28Z
"Poland, Hungary risk funding cuts after EU rule-of-law decision • FRANCE 24 English",https://www.youtube.com/watch?v=pbcSbcZD_y4,UCQfwfsi5VrQ8yKZ-UWmAEFg,2022-02-16T16:24:34Z
Rule of Law.,https://www.youtube.com/watch?v=sYTGVZvZE90,UCDByt2wQEx6-Qb2p7-5i5Qg,2022-01-24T15:02:20Z
Can Bosnia Thrive Through Rule of Law,https://www.youtube.com/watch?v=UKek_fStok0,UCd6TdtUSk8wLXM_vXuLlsKA,2022-07-25T17:00:21Z
Dale Hansen Unplugged: &quot;The rule of law doesn&#39;t matter...as long as you are well-to-do and white&quot;,https://www.youtube.com/watch?v=Vj577ipuEhQ,UCBu0KdNokE4MqdkacvH37_A,2020-05-08T04:49:16Z
Hernando De Soto on Property Rights and Rule of Law,https://www.youtube.com/watch?v=7Fzpx75RezI,UCJJniHyad24Lox_ioZVJfPA,2011-03-18T17:33:20Z
"Macron&#39;s New Europe, Downing Street Christmas Party, Biden&#39;s World Rule of Law...",https://www.youtube.com/watch?v=k5QFe3yI3Mo,UCQfwfsi5VrQ8yKZ-UWmAEFg,2021-12-11T08:27:17Z
British Constitution - Rule Of Law In Hindi| How Special For All Countries|By Sonam Chauhan,https://www.youtube.com/watch?v=2bDVUuBu4QM,UCBhkNOK6hszOR7tryqeD9UQ,2021-07-08T01:43:40Z
"2013 | Chen Guangcheng, Future of the Rule of Law and Human Rights in China | The New School",https://www.youtube.com/watch?v=WeeZy3op-s4,UC1iFTPspSKcb4vb1N7czmRQ,2013-02-07T22:06:29Z
"विधि का शासन: अर्थ,परिभाषा और विशेषताएं Rule Of Law",https://www.youtube.com/watch?v=GuIJTX-j1Lc,UCEt-xApTD0yM_vIj3Wo8JhQ,2019-08-31T14:41:06Z
Rule by Law in Public Administration,https://www.youtube.com/watch?v=3P7_qpmAJHE,UCl9CUCvOPotOcl9ZZEzPZsA,2018-04-09T19:00:01Z
"Scaffolding of the Rule of Law: Legal Violence, Policing, and Scientific Interrogations in India",https://www.youtube.com/watch?v=9WCrp8oLVsY,UCcenDNKaJnLl1opqzlWgoqA,2022-07-28T20:33:26Z
Prime Time With Ravish Kumar: Bulldozing The Rule Of Law In Delhi?,https://www.youtube.com/watch?v=CtOuUpIJTog,UCZFMm1mMw0F81Z37aaEzTUA,2022-04-21T17:55:18Z
WATCH: Sen. Richard Blumenthal condemns attack on rule of law in Kavanaugh hearing,https://www.youtube.com/watch?v=gbe6EnSSx5Y,UC6ZFN9Tx6xh-skXCuRHCDpQ,2018-09-04T18:57:08Z
China urges European Parliament to respect China&#39;s sovereignty and rule of law in HKSAR,https://www.youtube.com/watch?v=81bYoLeCN4o,UCgrNz-aDmcr2uuto8_DL2jg,2021-01-22T12:28:54Z
നിയമത്തോട് വിയോജിപ്പുണ്ടായാൽ എന്തുചെയ്യണം? ബിജെപി നേതാവിന്റെ പ്രതികരണം|bjp leader on rule of law,https://www.youtube.com/watch?v=1WXPnGH4IVE,UCP0uG-mcMImgKnJz-VjJZmQ,2019-12-17T04:26:49Z
Corruption and the Rule of Law in the Time of COVID-19: Spotlight on Asia Pacific,https://www.youtube.com/watch?v=WOyF5v1-CZs,UCJR7EPRDPsgiy8B7uvZL_-A,2020-07-23T20:42:24Z
Threats to the rule of law by the Romanian justice system reform,https://www.youtube.com/watch?v=zBmE13H6wiQ,UCFdI38niBOh-z5bd8y5N9fQ,2018-02-07T19:18:19Z
Official Says Trump’s Ukraine Conduct Was ‘Injurious To The Rule Of Law’- The Day That Was | MSNBC,https://www.youtube.com/watch?v=SAFhheIIZFA,UCaXkIU1QidjPwiAYu6GcHjg,2019-11-08T16:21:49Z
MGTV LIVE : Rupanya Negara Kita Tiada Lagi &quot;Rule Of Law&quot;.- Ibrahim Ali,https://www.youtube.com/watch?v=25OgSGoElaQ,UC-zwAo_0PsviX7-H71mbHYg,2021-05-04T07:06:34Z
Murray Rankin on SNC-Lavalin scandal: &#39;The rule of law means something&#39;,https://www.youtube.com/watch?v=BML5wV19qVc,UCi7Zk9baY1tvdlgxIML8MXg,2019-03-01T02:05:45Z
Trump Attacks The Rule Of Law. Critics Say It’s Time To Use ‘The F Word: Fascism’ | MSNBC,https://www.youtube.com/watch?v=7AxO7Cg29mU,UCaXkIU1QidjPwiAYu6GcHjg,2020-07-25T16:04:30Z
Thein Moe Win and U Ko Ni Discussion about Rule of Law and Peaceful Coexistence 23 08 16,https://www.youtube.com/watch?v=A6mZZTsAM7c,UCxEcOorvKWqlzZLr6w9riGw,2016-09-01T19:31:05Z
Harriette Chiggai: the political class should protect the rule of law,https://www.youtube.com/watch?v=bS22ysu5rqg,UCt3SE-Mvs3WwP7UW-PiFdqQ,2020-01-12T19:33:32Z
Neden Hukukun Üstünlüğü? | Why The Rule of Law ? | 2016 | Didem Yılmaz | TEDxReset,https://www.youtube.com/watch?v=QjI8M1W6qIg,UCsT0YIqwnpJCM-mx7-gSA4Q,2016-06-13T16:06:44Z
I SIMPLY CANNOT ALLOW YOU TO PLAY SPELLS!! Rule of Law Jace Historic MTG Arena,https://www.youtube.com/watch?v=cvt75Uav94s,UCi3VPBRXVBcvI0OW1WDHlzw,2020-10-12T14:00:15Z
British Council on Rule of Law and Anti corruption,https://www.youtube.com/watch?v=1CNdE2lOCg0,UCLLWAXn5F415g2kNAcE_T1g,2021-11-23T19:07:57Z
The Kyoto Congress Ancillary Meeting&quot;The Rule of Law and International Arbitration / Mediation&quot;,https://www.youtube.com/watch?v=6n3Ya8Kkcck,UCH8ROF03TnxUIJdBbXoxR7g,2021-03-29T01:32:54Z
"Fmr. Prosecutor: Trump Has &#39;Beef&#39; With Rule Of Law, Not Sessions | The Beat With Ari Melber | MSNBC",https://www.youtube.com/watch?v=0GAhvBy4fPY,UCaXkIU1QidjPwiAYu6GcHjg,2018-09-20T01:04:35Z
Sally Yates on Trump&#39;s travel ban and protecting the rule of law,https://www.youtube.com/watch?v=eKKR4rSvrp4,UC6ZFN9Tx6xh-skXCuRHCDpQ,2018-04-25T23:57:14Z
💯#bulldozer Lagake Tumne #afreenfatima k Ghar Ko Nahi &#39;Rule Of Law&#39; Ko toda #asaduddinowaisi #shorts,https://www.youtube.com/watch?v=DgXXBaW3bok,UCwgQW6BLm3S3vtYyWTwQlwA,2022-06-14T07:50:01Z
Senator Worries President Donald Trump Won&#39;t Follow Rule Of Law In Future | Morning Joe | MSNBC,https://www.youtube.com/watch?v=MF-ddmUljjw,UCaXkIU1QidjPwiAYu6GcHjg,2019-04-10T13:54:14Z
LAW4007 Rule of law,https://www.youtube.com/watch?v=40LF_wCbWr0,UCnDVx02wXPdmJtpbQwK5XUw,2022-07-18T12:44:59Z
Tahir ul Qadri: &#39;No rule of law&#39; in Pakistan - UpFront,https://www.youtube.com/watch?v=ffgGqDAHcjQ,UCNye-wNBqNL5ZzHSJj3l8Bg,2017-07-21T16:38:45Z
60 MINUTES NIGERIA | ENTRENCHING DEMOCRACY AND RULE OF LAW IN NIGERIA,https://www.youtube.com/watch?v=mPJ-WP1MPEo,UCzuiQaDS-LR2Qr3QYcj730w,2021-11-04T15:06:58Z
UP has rule of Bulldozer or rule of law? I PRAYAGRAJ PROTESTS I PROPHET MUHAMMAD,https://www.youtube.com/watch?v=l1Lgdy9f4Yo,UCrYpceU8cvXNSqaiYC-8hJA,2022-06-13T07:33:48Z
Government is nothing without rule of law,https://www.youtube.com/watch?v=k1aCGwMU5y8,UCY310om-MXXaVFfbtiVKQ3w,2022-04-26T03:40:02Z
Ferguson: Rule of law hurting West?,https://www.youtube.com/watch?v=Nwc8-X0qSkY,UCupvZG-5ko_eiXAupbDfxWw,2012-11-26T19:38:50Z
Rep. Debbie Dingell: &quot;Rule Of Law Under Attack&quot; By Donald Trump | MSNBC,https://www.youtube.com/watch?v=t9xhOvW2-wg,UCaXkIU1QidjPwiAYu6GcHjg,2017-08-28T20:58:59Z
WATCH LIVE: Deputy Attorney General Rod Rosenstein speaks on rule of law to commemorate &#39;Law Day.&#39;,https://www.youtube.com/watch?v=EHqHjwNAQM0,UC6ZFN9Tx6xh-skXCuRHCDpQ,2018-05-01T19:10:10Z
"Rule of Law: The Constitution, The President, and His Powers",https://www.youtube.com/watch?v=aXrD0pwwSYg,UCgRf62bnK3uX4N-YEhG4Jog,2022-06-13T08:30:00Z
"PAANO &#39;BINABOY&#39; NG KASALUKUYANG ADMIN. ANG RULE OF LAW?! (LAPID FIRE, Oct 26, 2021)",https://www.youtube.com/watch?v=guWxnO2J4JA,UCMSfJHfVIH8NPvuXJNCygoA,2021-10-31T00:00:13Z
US: Military seizure is a direct assault on rule of law | World News | Myanmar Coup,https://www.youtube.com/watch?v=xqvurHTPlig,UC_gUM8rL-Lrg6O3adPW9K1g,2021-02-04T03:42:32Z
Rule of Law|| Administrative Law|| Applicability in Indian Constitution #indianpolity #ruleoflaw,https://www.youtube.com/watch?v=GVxrVNSZS88,UCNSqVDXO2qKJqcCYO5VOqOA,2020-10-26T17:05:28Z
RULE OF LAW IN HINDI | विधि का शासन |CONSTITUTIONAL LAW NOTES FOR LLB &amp; CS,https://www.youtube.com/watch?v=NDzQdPYppnE,UCoCXnXJWWkzXNcAgMwFZc9g,2018-06-02T09:43:02Z
CJN Onnoghen: Government’s Actions An Aberration And Desecration of Rule of Law,https://www.youtube.com/watch?v=9PAynrTUieY,UCKnyVIW5QvfnsXddsjFKx4A,2019-01-14T13:42:37Z
