username,displayName,tweet,likes,retweets,link,date
ssalifu0gmailc1,@Iko,@SaharaReporters Do we have a common front? Is it Tiv and Jukun that should form a common front or is it Igala and Igbira that should liaise with the Hausa/ Fulani? Are you asking Birom and Hausa/ Fuluni to have a united front? Anytime we stop the sickness of ethnic supremacy wake me up.,0,0,https://twitter.com/ssalifu0gmailc1/status/1221388750888095750,2020-01-26 11:05:45+00:00
dogaraCaesar,#iWriteWhatILike,"Hausa Fulani supremacy in Nigeria is real. 

They have taken control of the state.. 

They are arming a huge number of militia…  

Minorities must do what they've got to do. #iWriteWhatILike",10,3,https://twitter.com/dogaraCaesar/status/1219896919830429696,2020-01-22 08:17:44+00:00
SurvivedaPeace,Foundational inner Html.,"@BashiruAdeniyi4 @farooqkperogi we are not forgetting anything ,its your turn to get your own dose of Hausa-Fulani Supremacy round 2 since the killing of abiola,june 12,Bola Ige etc was not enough for you to stop slaving yourselves to the north while betraying others.",2,1,https://twitter.com/SurvivedaPeace/status/1217314914018250752,2020-01-15 05:17:46+00:00
